title,url,source_country,language,published_date,tone,domain,collected_at
Virginia needs more nurses . Educators say training them will take more than just adding classroom seats . ,https://www.wvtf.org/2026-07-13/virginia-needs-more-nurses-educators-say-training-them-will-take-more-than-just-adding-classroom-seats,United States,English,20260713T161500Z,,wvtf.org,2026-07-13 17:07:31
Музыкальный центр Technics SC - EH60 : мечта из 1997 года с задатками Hi - Fi / Аудио и звук / iXBT Live,https://www.ixbt.com/live/digs/muzykalnyy-centr-technics-sc-eh60-mechta-iz-1997-goda-s-zadatkami-hi-fi.html,China,Russian,20260713T161500Z,,ixbt.com,2026-07-13 17:07:31
El Puerto de Valencia se convierte en el banco de pruebas de la fotovoltaica flotante marina,https://www.energias-renovables.com/fotovoltaica/el-puerto-de-valencia-se-convierte-en-20260713,Spain,Spanish,20260713T161500Z,,energias-renovables.com,2026-07-13 17:07:31
"Trump promove criptomoedas , mas reforça fortuna em ativos tradicionais",https://www.brasil247.com/mundo/trump-promove-criptomoedas-mas-reforca-fortuna-em-ativos-tradicionais/,Brazil,Portuguese,20260713T161500Z,,brasil247.com,2026-07-13 17:07:31
Cao điểm đẩy mạnh phát triển công dân số tại Cao Bằng,https://baomoi.com/cao-diem-day-manh-phat-trien-cong-dan-so-tai-cao-bang-c55608482.epi,Vietnam,Vietnamese,20260713T161500Z,,baomoi.com,2026-07-13 17:07:31
"ALLEN Career Institute Strengthens Board with Next - Generation Leadership , Eyes Centennial Growth",https://bilkulonline.com/2026/07/13/allen-career-institute-strengthens-board-with-next-generation-leadership-eyes-centennial-growth/,India,English,20260713T161500Z,,bilkulonline.com,2026-07-13 17:07:31
Срок за блиндаж,https://www.kommersant.ru/doc/8814327,Russia,Russian,20260713T161500Z,,kommersant.ru,2026-07-13 17:07:31
Chính phủ quy định cơ cấu tổ chức mới của Bộ Giáo dục và Đào tạo,https://baomoi.com/chinh-phu-quy-dinh-co-cau-to-chuc-moi-cua-bo-giao-duc-va-dao-tao-c55608296.epi,Vietnam,Vietnamese,20260713T161500Z,,baomoi.com,2026-07-13 17:07:31
"For Sale ( 5 Pieces ) New Apple iPhone Air Original 256GB Unlocked $4 , 995CAD",http://www.dhal3.com/vb/showthread.php?s=45cc95f61c26269e678a75ca2e80ae16&t=307122,United States,English,20260713T161500Z,,dhal3.com,2026-07-13 17:07:31
"Philippines to use AI , satellite technology to improve food security - Xinhua",https://english.news.cn/20260713/5981a82b91fb441695609e0d64623cc4/c.html,,English,20260713T161500Z,,english.news.cn,2026-07-13 17:07:31
দুর্যোগ ও রাজনৈতিক নেতৃত্বের দায়িত্ব,https://www.dailynayadiganta.com/opinions/editorial/sub-editorial/yMpqU8zHq0hl,Bangladesh,Bengali,20260713T161500Z,,dailynayadiganta.com,2026-07-13 17:07:31
"Cascade Copper Announces Drilling Completed on its Maiden Drill Program at the Centrefire Copper - Gold Project Near Dryden , NW Ontario",https://www.juniorminingnetwork.com/junior-miner-news/press-releases/3268-cse/casc/207216-cascade-copper-announces-drilling-completed-on-its-maiden-drill-program-at-the-centrefire-copper-gold-project-near-dryden-nw-ontario.html,Canada,English,20260713T161500Z,,juniorminingnetwork.com,2026-07-13 17:07:31
周忻要做房地产行业的  基建  深度测评深度智联  CoWork,https://www.163.com/dy/article/L1OMBBVR0535BXWI.html,China,Chinese,20260713T161500Z,,163.com,2026-07-13 17:07:31
AppLovin - Aktie gibt deutlich nach : Analysten sehen Wachstumsbremse im E - Commerce - Geschäft,https://www.finanzen.ch/nachrichten/aktien/applovin-aktie-gibt-deutlich-nach-analysten-sehen-wachstumsbremse-im-e-commerce-geschaft-1036319193,Switzerland,German,20260713T161500Z,,finanzen.ch,2026-07-13 17:07:31
200 خبير عالمي يطالبون بفرملة الذكاء الاصطناعي,https://www.albayan.ae/economy/business/world-economy/1524392,United Arab Emirates,Arabic,20260713T161500Z,,albayan.ae,2026-07-13 17:07:31
"Nueva vida para el puente de La Navata , sobre el río Guadarrama , en Galapagar",https://www.larazon.es/madrid/nueva-vida-puente-navata-rio-guadarrama-galapagar_202607136a550983c0b5fb431c535146.html,Spain,Spanish,20260713T161500Z,,larazon.es,2026-07-13 17:07:31
إطلاق نظام الرسم الكروكي الالكتروني الوطني ( E - KROKA ) لتطوير نظام حوادث المرور في فلسطين,https://www.raya.ps/news/1221037.html,Israel,Arabic,20260713T161500Z,,raya.ps,2026-07-13 17:07:31
MBDA продвинула проект системы ПВО против гиперзвуковых ракет,https://flotprom.ru/2026/%d0%95%d0%b2%d1%80%d0%be%d0%bf%d1%8b1/,Russia,Russian,20260713T161500Z,,flotprom.ru,2026-07-13 17:07:31
"SDT Uzaydan 5 , 35 milyon dolarlık savunma sözleşmesi",https://www.borsamatik.com.tr/sdt-uzaydan-535-milyon-dolarlik-savunma-sozlesmesi-haber-179628,Turkey,Turkish,20260713T161500Z,,borsamatik.com.tr,2026-07-13 17:07:31
特斯拉FSD全面登陆 中国车企害怕了 ！（ 视频 ） ,https://www.renminbao.com/rmb/articles/2026/7/13/95875.html,China,Chinese,20260713T161500Z,,renminbao.com,2026-07-13 17:07:31
A Prato nasce DĀR il festival che trasforma San Domenico nella casa dei suoni e della voce,https://www.intoscana.it/it/a-prato-nasce-dar-il-festival-che-trasforma-san-domenico-nella-casa-dei-suoni-e-della-voce/,Italy,Italian,20260713T161500Z,,intoscana.it,2026-07-13 17:07:31
What to do after getting a hypertension alert from your smartwatch,http://www.grandrapidsmn.com/around_the_web/health/what-to-do-after-getting-a-hypertension-alert-from-your-smartwatch/article_1a50ba72-4f12-5e35-b8b6-bcf427e98099.html,United States,English,20260713T161500Z,,grandrapidsmn.com,2026-07-13 17:07:31
上半年数据会商 ， 抓显绩更重潜绩 - 中华人民共和国最高人民法院,https://www.court.gov.cn/zixun/xiangqing/505851.html,China,Chinese,20260713T161500Z,,court.gov.cn,2026-07-13 17:07:31
工作动态 | 上海医学人工智能赋能医疗援青试点项目启动,https://newsghexport.shobserver.cn/html/baijiahao/2026/07/13/4020454.html,,Chinese,20260713T161500Z,,newsghexport.shobserver.cn,2026-07-13 17:07:31
Self - sufficiency in cyber security crucial to safeguard India digital transformation : IISc Director,https://www.thehindu.com/news/cities/Coimbatore/self-sufficiency-in-cyber-security-crucial-to-safeguard-indias-digital-transformation-iisc-director/article71218329.ece,India,English,20260713T161500Z,,thehindu.com,2026-07-13 17:07:31
Florida DOGE Is Working Thanks to DeSantis,https://www.dailysignal.com/2026/07/13/desantis-florida-doge/,United States,English,20260713T161500Z,,dailysignal.com,2026-07-13 17:07:31
Tajikistan Lithium Project Planned at Namadgut Deposit - The Times Of Central Asia,https://timesca.com/tajikistan-lithium-namadgut-project/,Kyrgyzstan,English,20260713T161500Z,,timesca.com,2026-07-13 17:07:31
Monkey vs machine : Nepal tests AI to fight crop - raiding macaques,https://news.mongabay.com/2026/07/monkey-vs-machine-nepal-tests-ai-to-fight-crop-raiding-macaques/,Indonesia,English,20260713T161500Z,,news.mongabay.com,2026-07-13 17:07:31
Martı  dan Dev Adım : Türkiyede Sürücüsüz Dönem Başlıyor,https://www.memleket.com.tr/martidan-dev-adim-turkiyede-surucusuz-donem-basliyor-2360911h.htm,Turkey,Turkish,20260713T161500Z,,memleket.com.tr,2026-07-13 17:07:31
Oxford inicia testes em humanos de vacina contra nova cepa do ebola em meio a surto na África,https://www.jornalopcao.com.br/saude/oxford-inicia-testes-em-humanos-de-vacina-contra-nova-cepa-do-ebola-em-meio-a-surto-na-africa-846520/,Brazil,Portuguese,20260713T161500Z,,jornalopcao.com.br,2026-07-13 17:07:31
Ukraine and European allies form ballistic missile defense coalition,https://www.capitalgazette.com/2026/07/13/ukraine-europe-form-ballistic-missile-defense-coalition/,United States,English,20260713T161500Z,,capitalgazette.com,2026-07-13 17:07:31
A conta que faz EUA e Europa pensarem duas vezes antes de romper com a China,https://veja.abril.com.br/economia/o-valor-que-faz-eua-e-europa-pensarem-duas-vezes-antes-de-romper-com-a-china/,Brazil,Portuguese,20260713T161500Z,,veja.abril.com.br,2026-07-13 17:07:31
US company to send giant mirror to space so it can sell reflected sunlight,https://metro.co.uk/2026/07/13/us-company-send-giant-mirror-space-can-sell-reflected-sunlight-29125449/,United Kingdom,English,20260713T161500Z,,metro.co.uk,2026-07-13 17:07:31
Przełom w leczeniu SMA . Długo wyczekiwana terapia genowa zatwierdzona w UE,https://wiadomosci.radiozet.pl/zdrowie/przelom-w-leczeniu-sma-dlugo-wyczekiwana-terapia-genowa-zatwierdzona-w-ue,Poland,Polish,20260713T161500Z,,wiadomosci.radiozet.pl,2026-07-13 17:07:31
Zelensky seeks more European air defence support for Ukraine at Paris meeting,https://www.gazette-news.co.uk/news/national/26275709.zelensky-seeks-european-air-defence-support-ukraine-paris-meeting/,United Kingdom,English,20260713T161500Z,,gazette-news.co.uk,2026-07-13 17:07:31
"নাটকীয়তা শেষ , সিলেটে জেলা প্রশাসকের চেয়ারে এখন আব্দুল্লাহ আল মামুন",https://dailyinqilab.com/bangladesh/news/916100,Bangladesh,Bengali,20260713T161500Z,,dailyinqilab.com,2026-07-13 17:07:31
Feature : Commuters in Cambodia shift to buses as Mideast conflict raises fuel prices - Xinhua,https://english.news.cn/asiapacific/20260713/c163d6b2f080461f988da982e7a7c9c2/c.html,,English,20260713T161500Z,,english.news.cn,2026-07-13 17:07:31
Man Charged with Hitting Cruiser During Police Chase in Maine,https://q961.com/charged-hitting-cruiser-police-chase-maine/,United States,English,20260713T161500Z,,q961.com,2026-07-13 17:07:31
Польша и Украина : Косиняк - Камыш отправляет украинцев домой подробности,https://focus.ua/world/760792-polsha-i-ukraina-kosinyak-kamysh-otpravlyaet-ukraincev-domoy-podrobnosti,Ukraine,Russian,20260713T161500Z,,focus.ua,2026-07-13 17:07:31
Lidl : dados de clientes expostos após falha de segurança,https://pplware.sapo.pt/internet/seguranca/lidl-dados-de-clientes-expostos-apos-falha-de-seguranca/,Portugal,Portuguese,20260713T161500Z,,pplware.sapo.pt,2026-07-13 17:07:31
"인텔 , 아일랜드 공장에 57억달러 투자 … AI 서버용 반도체 생산 확대  ",http://inews24.com/view/1985177,,Korean,20260713T161500Z,,inews24.com,2026-07-13 17:07:31
Erzurumda karar verildi : 7 milyon liralık yatırım hayata geçiyor,https://www.gazetevatan.com/gundem/erzurumda-karar-verildi-7-milyon-liralik-yatirim-hayata-geciyor-2387743,Turkey,Turkish,20260713T161500Z,,gazetevatan.com,2026-07-13 17:07:31
New Fabric Test Material Could Help Strengthen Domestic Supply Chain for Textiles and Clothing,https://www.nist.gov/news-events/news/2026/07/new-fabric-test-material-could-help-strengthen-domestic-supply-chain,United States,English,20260713T161500Z,,nist.gov,2026-07-13 17:07:31
Hoover undercuts Amazon as  incredibly powerful  vacuum drops from £199 to £99,https://www.walesonline.co.uk/whats-on/shopping/hoover-amazon-powerful-vacuum-cleaner-34281243,United Kingdom,English,20260713T161500Z,,walesonline.co.uk,2026-07-13 17:07:31
MDT TMR1228D magnetic switch supports always - on sensing,https://www.engineering.com/mdt-tmr1228d-magnetic-switch-supports-always-on-sensing/,United States,English,20260713T161500Z,,engineering.com,2026-07-13 17:07:31
Embaixada dos EUA atuou para adiar votao de projeto sobre mercados digitais após pedido de big techs,https://www.brasil247.com/brasil/embaixada-dos-eua-atuou-para-adiar-votacao-de-projeto-sobre-mercados-digitais-apos-pedido-de-big-techs/,Brazil,Portuguese,20260713T161500Z,,brasil247.com,2026-07-13 17:07:31
Từng bước nâng cao tỷ lệ công nhân tiếp cận thông tin pháp luật trên nền tảng số,https://baomoi.com/tung-buoc-nang-cao-ty-le-cong-nhan-tiep-can-thong-tin-phap-luat-tren-nen-tang-so-c55608486.epi,Vietnam,Vietnamese,20260713T161500Z,,baomoi.com,2026-07-13 17:07:31
Україна і ще 9 країн оголосили про створення антибалістичної коаліції – декларація,https://interfax.com.ua/news/general/1184568.html,Ukraine,Ukrainian,20260713T161500Z,,interfax.com.ua,2026-07-13 17:07:31
Uber milite à Washington pour encadrer les robotaxis,https://l-echo.info/uber-lobbying-robotaxi-washington/,France,French,20260713T161500Z,,l-echo.info,2026-07-13 17:07:31
Patans Rani Ki Vav 3D Projection Mapping Wins WOW Gold Award 2026,https://www.divyabhaskar.co.in/local/gujarat/patan/news/patans-raniki-vav-3d-projection-mapping-wins-wow-award-138433564.html,India,Gujarati,20260713T161500Z,,divyabhaskar.co.in,2026-07-13 17:07:31
"Odissea , il nuovo film di Christopher Nolan , arriva nelle sale UCI Cinemas di Roma , anche in IMAX",https://www.romadailynews.it/eventi/odissea-il-nuovo-film-di-christopher-nolan-arriva-nelle-sale-uci-cinemas-di-roma-anche-in-imax-0955407/,Italy,Italian,20260713T161500Z,,romadailynews.it,2026-07-13 17:07:31
Broker call : India Nippon Elec ( Buy ) - The HinduBusinessLine,https://www.thehindubusinessline.com/markets/brokers-call-india-nippon-elec-buy/article71217317.ece,India,English,20260713T161500Z,,thehindubusinessline.com,2026-07-13 17:07:31
Як працює OLX Доставка у 2026 році : інструкція,https://mignews.com.ua/tehnologii/yak-pratsiuie-olx-dostavka-2026.html,Ukraine,Ukrainian,20260713T161500Z,,mignews.com.ua,2026-07-13 17:07:31
 « Интерстеллар » и « Всё везде и сразу » - лучшие фантастические фильмы XXI века,https://www.intermedia.ru:443/news/405213,Russia,Russian,20260713T161500Z,,intermedia.ru,2026-07-13 17:07:31
Мінцифри пообіцяло допомогу прифронтовим інтернет - провайдерам,https://epravda.com.ua/biznes/mincifri-poobicyalo-dopomogu-prifrontovim-internet-provayderam-823611/,Ukraine,Ukrainian,20260713T161500Z,,epravda.com.ua,2026-07-13 17:07:31
Зеленський вручив Макрону українську нагороду | Новини України,https://news.liga.net/ua/politics/news/zelenskyy-nahorodyv-makrona-ordenom-svobody,Ukraine,Ukrainian,20260713T161500Z,,news.liga.net,2026-07-13 17:07:31
Tăng cường tuyên truyền để giảm nghèo thông tin về tín dụng chính sách xã hội,https://baomoi.com/tang-cuong-tuyen-truyen-de-giam-ngheo-thong-tin-ve-tin-dung-chinh-sach-xa-hoi-c55608485.epi,Vietnam,Vietnamese,20260713T161500Z,,baomoi.com,2026-07-13 17:07:31
潮起大湾区 ， 粤港房地产业如何  双向赋能 ？ |广州,https://www.163.com/dy/article/L1OMGDT30535BXWI.html,China,Chinese,20260713T161500Z,,163.com,2026-07-13 17:07:31
"Birla Tyres looks to ramp up distribution reach in Tamil Nadu , Andhra Pradesh , Telangana",https://www.thehindubusinessline.com/companies/birla-tyres-looks-to-ramp-up-distribution-reach-in-tamil-nadu-andhra-pradesh-telangana/article71217917.ece,India,English,20260713T161500Z,,thehindubusinessline.com,2026-07-13 17:07:31
Ukraine and European allies form ballistic missile defense coalition,https://www.mainlinemedianews.com/2026/07/13/ukraine-europe-form-ballistic-missile-defense-coalition/,United States,English,20260713T161500Z,,mainlinemedianews.com,2026-07-13 17:07:31
Bosch sichert sich 225 - Millionen - Förderung für US - Chipwerk,https://www.finanznachrichten.de/nachrichten-2026-07/69013341-bosch-sichert-sich-225-millionen-foerderung-fuer-us-chipwerk-016.htm,Germany,German,20260713T161500Z,,finanznachrichten.de,2026-07-13 17:07:31
Khơi dậy khát vọng hoàn lương từ sự kết hợp giữa nghiêm minh và lòng nhân ái,https://thanhnien.vn/khoi-day-khat-vong-hoan-luong-tu-su-ket-hop-giua-nghiem-minh-va-long-nhan-ai-185260713211053888.htm,Vietnam,Vietnamese,20260713T161500Z,,thanhnien.vn,2026-07-13 17:07:31
"Chevrolet Bolt vs . Nissan Leaf , an Edmunds $30 , 000 EV comparison",https://www.mainlinemedianews.com/2026/07/13/chevrolet-bolt-nissan-leaf-edmunds/,United States,English,20260713T161500Z,,mainlinemedianews.com,2026-07-13 17:07:31
Como a cibersegurança entra definitivamente na era da gestão de riscos,https://canaltech.com.br/colunas/como-a-ciberseguranca-entra-definitivamente-na-era-da-gestao-de-riscos/,Brazil,Portuguese,20260713T161500Z,,canaltech.com.br,2026-07-13 17:07:31
Обшуки та слідство : які ризики виникають у miltech - бізнесу в Україні,https://epravda.com.ua/oborona/obshuki-ta-slidstvo-yaki-riziki-vinikayut-u-miltech-biznesu-v-ukrajini-823556/,Ukraine,Ukrainian,20260713T161500Z,,epravda.com.ua,2026-07-13 17:07:31
El IEDT de la Diputación lanza 13 cursos becados para la inserción laboral de personas desempleadas,http://www.gentedigital.es/cadiz/noticia/4363534/el-iedt-de-la-diputacion-lanza-13-cursos-becados-para-la-insercion-laboral-de-personas-desempleadas/,Spain,Spanish,20260713T161500Z,,gentedigital.es,2026-07-13 17:07:31
Александра Даддарио сеет хаос в трейлере третьего сезона « Мэйфейрских ведьм » ,https://www.intermedia.ru:443/news/405226,Russia,Russian,20260713T161500Z,,intermedia.ru,2026-07-13 17:07:31
Consertar celular Samsung vai ficar mais caro graças à crise da IA,https://canaltech.com.br/smartphone/consertar-celular-samsung-vai-ficar-mais-caro-gracas-a-crise-da-ia/,Brazil,Portuguese,20260713T161500Z,,canaltech.com.br,2026-07-13 17:07:31
"Fossil fuel - based mega projects displace locals in Bangladesh , pushing youth out",https://news.mongabay.com/2026/07/fossil-fuel-based-mega-projects-displace-locals-in-bangladesh-pushing-youth-out/,Indonesia,English,20260713T161500Z,,news.mongabay.com,2026-07-13 17:07:31
ALCALDÍA MÁLAGA | De la Torre anuncia que volverá a ser candidato a la Alcaldía de Málaga :  Creo que será la última  ,https://www.lacronicabadajoz.com/nacional/2026/07/13/torre-anuncia-volvera-candidato-alcaldia-132407996.html,Spain,Spanish,20260713T161500Z,,lacronicabadajoz.com,2026-07-13 17:07:31
中美青少年在重庆回望抗战历史,https://baijiahao.baidu.com/s?id=1870601195273333230,China,Chinese,20260713T161500Z,,baijiahao.baidu.com,2026-07-13 17:07:31
Zelensky seeks more European air defence support for Ukraine at Paris meeting,https://www.leaderlive.co.uk/news/national/26275709.zelensky-seeks-european-air-defence-support-ukraine-paris-meeting/,United Kingdom,English,20260713T161500Z,,leaderlive.co.uk,2026-07-13 17:07:31
Línea 1 del Metro de Santiago tendrá puertas de andén : Revisa plazos y primeras estaciones,https://www.elmostrador.cl/datos-utiles/2026/07/13/viajas-en-la-linea-1-asi-es-el-plan-de-metro-para-que-no-te-quedes-mas-atrapado-en-el-anden/,Chile,Spanish,20260713T161500Z,,elmostrador.cl,2026-07-13 17:07:31
Monstro híbrido : novo SUV da BYD traz emblema em ouro de 24 quilates,https://canaltech.com.br/carros/monstro-hibrido-novo-suv-da-byd-traz-emblema-em-ouro-de-24-quilates/,Brazil,Portuguese,20260713T161500Z,,canaltech.com.br,2026-07-13 17:07:31
Sheinbaum alista informe sobre avances del caso Ayotzinapa ; revisará recomendación de la CNDH,https://oem.com.mx:443/elsoldemexico/mexico/sheinbaum-alista-informe-sobre-avances-del-caso-ayotzinapa-revisara-recomendacion-de-la-cndh-31097275,Mexico,Spanish,20260713T161500Z,,oem.com.mx,2026-07-13 17:07:31
Climate policy - The Times Of Central Asia,https://timesca.com/tag/climate-policy/,Kyrgyzstan,English,20260713T161500Z,,timesca.com,2026-07-13 17:07:31
Thị trường văn phòng bước vào chu kỳ phát triển mới,https://stockbiz.vn/tin-tuc/thi-truong-van-phong-buoc-vao-chu-ky-phat-trien-moi/40887058,Vietnam,Vietnamese,20260713T161500Z,,stockbiz.vn,2026-07-13 17:07:31
"Glioblastoma : una enfermedad poco frecuente , agresiva y de enorme impacto",https://www.andigital.com.ar/nota/142085/glioblastoma-una-enfermedad-poco-frecuente-agresiva-y-de-enorme-impacto/,Argentina,Spanish,20260713T161500Z,,andigital.com.ar,2026-07-13 17:07:31
"Hydrogen - powered trucks , buses get 7 - year permit exemption given to EVs , ethanol - powered vehicles",https://www.thehindubusinessline.com/economy/hydrogen-powered-trucks-buses-get-7-year-permit-exemption-given-to-evs-ethanol-powered-vehicles/article71214962.ece,India,English,20260713T161500Z,,thehindubusinessline.com,2026-07-13 17:07:31
Oro ska tas på allvar och stora beslut ska granskas – Sundsvalls Tidning,https://www.st.nu/asikter/oro-ska-tas-pa-allvar-och-stora-beslut-ska-granskas/,Niue,Swedish,20260713T161500Z,,st.nu,2026-07-13 17:07:31
Sen . Klobuchar remembers Senator Lindsey Graham,https://www.willmarradio.com/news/sen-klobuchar-remembers-senator-lindsey-graham/article_64067a8d-8262-4274-89f0-def621aa610a.html,United States,English,20260713T161500Z,,willmarradio.com,2026-07-13 17:07:31
El algoritmo y el condón : ¿ no se preña en tiempos de redes ? ,https://www.elcolombiano.com/generacion/el-algoritmo-y-el-condon-no-se-prena-en-tiempos-de-redes-JE38787529,Colombia,Spanish,20260713T161500Z,,elcolombiano.com,2026-07-13 17:07:31
Phóng sinh qua ... livestream,https://daidoanket.vn/phong-sinh-qua-livestream.html,Vietnam,Vietnamese,20260713T161500Z,,daidoanket.vn,2026-07-13 17:07:31
"Apple ha comprato SigLens , utility di monitoraggio per il debugging delle app",https://www.macitynet.it/apple-ha-comprato-siglens-utility-di-monitoraggio-per-il-debugging-delle-app/,Italy,Italian,20260713T161500Z,,macitynet.it,2026-07-13 17:07:31
"Mahasiswa UBBG Raih Perunggu Kejurnas Kempo , Harumkan Nama Aceh dan Kampus di Kancah Nasional",https://aceh.tribunnews.com/nanggroe/1033924/mahasiswa-ubbg-raih-perunggu-kejurnas-kempo-harumkan-nama-aceh-dan-kampus-di-kancah-nasional,Indonesia,Indonesian,20260713T161500Z,,aceh.tribunnews.com,2026-07-13 17:07:31
Goiás fecha acordo com empresa sul - coreana para instalar fábrica de armas e munies com investimento de R$ 77 milhões,https://www.jornalopcao.com.br/ultimas-noticias/fabrica-armas-goias-k-tech-investimento-77-milhoes-846453/,Brazil,Portuguese,20260713T161500Z,,jornalopcao.com.br,2026-07-13 17:07:31
El Municipio pone en marcha un nuevo sistema para el juzgamiento de infracciones,https://www.elcordillerano.com.ar/noticias/2026/07/13/250177-el-municipio-pone-en-marcha-un-nuevo-sistema-para-el-juzgamiento-de-infracciones,Argentina,Spanish,20260713T161500Z,,elcordillerano.com.ar,2026-07-13 17:07:31
Kapadokyada Devrim : QR Kodla Yapay Zekalı Rehberlik Dönemi Başladı,https://www.memleket.com.tr/kapadokyada-devrim-qr-kodla-yapay-zekali-rehberlik-donemi-basladi-2360917h.htm,Turkey,Turkish,20260713T161500Z,,memleket.com.tr,2026-07-13 17:07:31
落實智慧觀光 馬管處舉辦 「 數位培能與AI應用課程 」 ,https://www.matsu-news.gov.tw/news/article/242717,Taiwan,Chinese,20260713T161500Z,,matsu-news.gov.tw,2026-07-13 17:07:31
半年报  预喜  公告密集披露 ！ 最高暴增超7600 % ,https://baijiahao.baidu.com/s?id=1870614723665317693,China,Chinese,20260713T161500Z,,baijiahao.baidu.com,2026-07-13 17:07:31
Ядерные амбиции Бурунди в партнерстве с Россией : технологический прорыв перечеркнул все планы Брюсселя,https://www.pravda.ru/news/economics/2370564-russia-burundi-energy-atom/,Russia,Russian,20260713T161500Z,,pravda.ru,2026-07-13 17:07:31
Zelenskyy seeks more European air defense support for Ukraine at Paris meeting,https://toronto.citynews.ca/2026/07/13/zelenskyy-will-discuss-ukraine-support-and-air-defenses-with-european-leaders-in-paris/,,English,20260713T161500Z,,toronto.citynews.ca,2026-07-13 17:07:31
Virginia needs more nurses . Educators say training them will take more than just adding classroom seats . ,https://www.whro.org/health/2026-07-13/virginia-needs-more-nurses-educators-say-training-them-will-take-more-than-just-adding-classroom-seats,United States,English,20260713T161500Z,,whro.org,2026-07-13 17:07:31
Piyasalarda gün sonu,https://www.haberler.com/ekonomi/bist-100-endeksi-yuzde-1-60-dususle-14-092-puandan-kapandi-20047541-haberi/,Turkey,Turkish,20260713T161500Z,,haberler.com,2026-07-13 17:07:31
El Apunte del Director : Hay mucho hate contra Argentina … Alimentado por FIFA,https://www.record.com.mx/historia/el-apunte-del-director-hay-mucho-hate-contra-argentina-alimentado-por-fifa-2026071305060449953,Mexico,Spanish,20260713T161500Z,,record.com.mx,2026-07-13 17:07:31
"What Are You Up to , Ariana ? ",https://www.hypebot.com/what-are-you-up-to-ariana/,United States,English,20260713T161500Z,,hypebot.com,2026-07-13 17:07:31
Caixabank firma una alianza con el grupo de Calzedonia y Tezenis para expandir su nuevo sistema de pagos,https://www.laopiniondezamora.es/economia/2026/07/13/caixabank-firma-alianza-grupo-calzedonia-132418924.html,Spain,Spanish,20260713T184500Z,,laopiniondezamora.es,2026-07-13 19:13:22
The US Stock Market Hottest New Offerings Are Having a Rough Go,https://www.businessinsider.com/stock-market-skhy-adrs-spcx-cbrs-ipo-calendar-ai-tech-2026-7,United States,English,20260713T184500Z,,businessinsider.com,2026-07-13 19:13:22
Урок кібербезпеки для корпоративних Mac | Блоги | Компьютерное Обозрение,https://ko.com.ua/urok_kiberbezpeki_dlya_korporativnih_mac_153998,Ukraine,Ukrainian,20260713T184500Z,,ko.com.ua,2026-07-13 19:13:22
Techgiganternas utsläpp ökar kraftigt – AI är boven,https://www.realtid.se/samhalle/hallbarhet/techgiganternas-utslapp-okar-kraftigt-ai-ar-boven/,Sweden,Swedish,20260713T184500Z,,realtid.se,2026-07-13 19:13:22
