title,url,source_country,language,published_date,tone,domain,collected_at
Egede bir ilk ! Almanya ve İspanyaya satıyorlar ! O sera Aydında kuruldu,https://www.yeniasir.com.tr/ege/aydin/2026/07/12/egede-bir-ilk-almanya-ve-ispanyaya-satiyorlar-o-sera-aydinda-kuruldu,Turkey,Turkish,20260712T161500Z,,yeniasir.com.tr,2026-07-12 16:48:03
达人打卡点赞 ！ 文昌会文星月菩提时尚秀解锁乡村文旅新潮流｜海南  村VA - 南海网,https://www.hinews.cn/page?n=2835609&m=1&s=1044,China,Chinese,20260712T161500Z,,hinews.cn,2026-07-12 16:48:03
Indonesia tăng cường sức mạnh hải quân bằng tên lửa BrahMos,https://giaoducthoidai.vn/indonesia-tang-cuong-suc-manh-hai-quan-bang-ten-lua-brahmos-post784771.html,Vietnam,Vietnamese,20260712T161500Z,,giaoducthoidai.vn,2026-07-12 16:48:03
Esta serie de ciencia ficción es ideal para ti si amaste  Interstellar  y  For all Mankind  ,https://hipertextual.com/cine-television/esta-serie-de-ciencia-ficcion-es-ideal-para-ti-si-amaste-interstellar-y-for-all-mankind/,Spain,Spanish,20260712T161500Z,,hipertextual.com,2026-07-12 16:48:03
Galaxy A37 x Jovi T1 : qual celular básico vale mais a pena ? ,https://canaltech.com.br/smartphone/galaxy-a37-x-jovi-t1-qual-celular-basico-vale-mais-a-pena/,Brazil,Portuguese,20260712T161500Z,,canaltech.com.br,2026-07-12 16:48:03
Childhood friendship remembered with bench at Mountbatten | Isle of Wight County Press,https://www.countypress.co.uk/news/26269618.childhood-friendship-remembered-bench-mountbatten/,,English,20260712T161500Z,,countypress.co.uk,2026-07-12 16:48:03
5 formas de assinar a HBO Max mais barata,https://canaltech.com.br/entretenimento/5-formas-de-assinar-a-hbo-max-mais-barata/,Brazil,Portuguese,20260712T161500Z,,canaltech.com.br,2026-07-12 16:48:03
India - Afghanistan strengthen agricultural ties as Minister Mawlawi Ataullah Omari concludes high - level visit,http://www.bignewsnetwork.com/news/279182817/india-afghanistan-strengthen-agricultural-ties-as-minister-mawlawi-ataullah-omari-concludes-high-level-visit,United States,English,20260712T161500Z,,bignewsnetwork.com,2026-07-12 16:48:03
Govt plans bigger agriculture budget for Papua,https://en.antaranews.com/news/422367/govt-plans-bigger-agriculture-budget-for-papua,Indonesia,English,20260712T161500Z,,en.antaranews.com,2026-07-12 16:48:03
ProEmberCoreの噂はデマ ？ 真実を包み隠さずお伝えします - 避坑ガイド,https://blog.udn.com:443/69263f41/191330436,Taiwan,Japanese,20260712T161500Z,,blog.udn.com,2026-07-12 16:48:03
文教镇书香队3 : 0战胜东路镇荔枝队｜海南  村VA  战报 - 南海网,https://www.hinews.cn/page?n=2835596&m=1&s=1044,China,Chinese,20260712T161500Z,,hinews.cn,2026-07-12 16:48:03
从孟加拉国到文昌会文 ， 这位海南旅游国际推荐官说 ： 村VA  值得全世界看到 - 南海网,https://www.hinews.cn/page?n=2835602&m=1&s=1044,China,Chinese,20260712T161500Z,,hinews.cn,2026-07-12 16:48:03
প্রধানমন্ত্রীর সঙ্গে স্বর্ণপদকজয়ী শিক্ষার্থীদের সাক্ষাৎ,https://www.jugantor.com/national/1125985,Bangladesh,Bengali,20260712T161500Z,,jugantor.com,2026-07-12 16:48:03
Mahasiswa KKN XXIX USK Kelompok 56 Resmi Memulai Pengabdian di Gampong Mesjid Ulim Baroh,https://aceh.tribunnews.com/nanggroe/1033772/mahasiswa-kkn-xxix-usk-kelompok-56-resmi-memulai-pengabdian-di-gampong-mesjid-ulim-baroh,Indonesia,Indonesian,20260712T161500Z,,aceh.tribunnews.com,2026-07-12 16:48:03
В Минпросвещения назвали неадекватным желание ребенка есть мармелад в виде червей 12 / 07 / 2026 – Новости,https://kazanfirst.ru/news/v-minprosveshheniya-nazvali-neadekvatnym-zhelanie-rebenka-est-marmelad-v-vide-chervej,Russia,Russian,20260712T161500Z,,kazanfirst.ru,2026-07-12 16:48:03
中招探校③｜海口市琼山中学今年计划招生近2000人 - 南海网,https://www.hinews.cn/page?n=2835604&m=1&s=1044,China,Chinese,20260712T161500Z,,hinews.cn,2026-07-12 16:48:03
"Piyush Goyal to lead business delegation to Europe from July 13 ; aims to boost trade , investment ties",http://www.kenyastar.com/news/279182799/piyush-goyal-to-lead-business-delegation-to-europe-from-july-13-aims-to-boost-trade-investment-ties,Kenya,English,20260712T161500Z,,kenyastar.com,2026-07-12 16:48:03
Artificial intelligence leadership programme kicks off in Dhofar Governorate,https://timesofoman.com/article/174270-artificial-intelligence-leadership-programme-kicks-off-in-dhofar-governorate,Oman,English,20260712T161500Z,,timesofoman.com,2026-07-12 16:48:03
"Fatih Mühürdar : Eskiden Sanatçı Yetişirdi , Şimdi Ünlü Yetişiyor",https://www.haberaktuel.com/fatih-muhurdar-eskiden-sanatci-yetisirdi-simdi-unlu-yetisiyor-3461774,Turkey,Turkish,20260712T161500Z,,haberaktuel.com,2026-07-12 16:48:03
La adopción de la tecnología por parte de la FIFA se vuelve en su contra en un Mundial polémico,https://forbes.com.mx/la-adopcion-de-la-tecnologia-por-parte-de-la-fifa-se-vuelve-en-su-contra-en-un-mundial-polemico/,Mexico,Spanish,20260712T161500Z,,forbes.com.mx,2026-07-12 16:48:03
Some are raising ethical concerns about political text messages using AI,https://www.houstonpublicmedia.org/npr/2026/07/12/nx-s1-5867763/some-are-raising-ethical-concerns-about-political-text-messages-using-ai/,United States,English,20260712T161500Z,,houstonpublicmedia.org,2026-07-12 16:48:03
למשקיעים הייתה יממה להתקרר אחרי החדשות האלה . איך הם יגיבו ? ,https://www.globes.co.il/news/article.aspx?did=1001548996,Israel,Hebrew,20260712T161500Z,,globes.co.il,2026-07-12 16:48:03
"Sukses di Takalar , FIKP Unhas Kenalkan Inovasi Pengayaan Bibit Rumput Laut di Bulukumba",https://makassar.tribunnews.com/kampus/1843906/sukses-di-takalar-fikp-unhas-kenalkan-inovasi-pengayaan-bibit-rumput-laut-di-bulukumba,Indonesia,Indonesian,20260712T161500Z,,makassar.tribunnews.com,2026-07-12 16:48:03
桃園工安定位鞋墊OEM 》 為什麼企業鞋墊代工首選 廣薪實業 ？ 解析 OEM / ODM 製造優勢 - y37ga2wj84642 的部落格,https://blog.udn.com:443/y37ga2wj84642/191330428,Taiwan,Chinese,20260712T161500Z,,blog.udn.com,2026-07-12 16:48:03
"Российские ученые придумали , как восстанавливать поврежденную роговицу глаза 12 / 07 / 2026 – Новости",https://kazanfirst.ru/news/rossijskie-uchenye-pridumali-kak-vosstanavlivat-povrezhdennuyu-rogoviczu-glaza,Russia,Russian,20260712T161500Z,,kazanfirst.ru,2026-07-12 16:48:03
ایپل نے اوپن اے آئی پر مقدمہ دائر کر دیا,https://dailyausaf.com/latest-news/2026/07/12/278982/,Pakistan,Urdu,20260712T161500Z,,dailyausaf.com,2026-07-12 16:48:03
ÚOHS : AUMOVIO a TEMB mohou založit společný podnik | ParlamentniListy . cz – politika ze všech stran,https://www.parlamentnilisty.cz/zpravy/tiskovezpravy/UOHS-AUMOVIO-a-TEMB-mohou-zalozit-spolecny-podnik-793911,Czech Republic,Czech,20260712T161500Z,,parlamentnilisty.cz,2026-07-12 16:48:03
"Бакалавър за 3 г .: Европа може , а България още спори",https://www.segabg.com/category-observer/bakalavur-za-3-g-evropa-mozhe-bulgariya-oshte-spori,Bulgaria,Bulgarian,20260712T161500Z,,segabg.com,2026-07-12 16:48:03
Президент Путин поощрил омского железнодорожника и сотрудника ОНИИП СуперОмск,https://superomsk.ru/news/163508-prezident_putin_poochshril_omskogo_jeleznodorojnik/,Russia,Russian,20260712T161500Z,,superomsk.ru,2026-07-12 16:48:03
Streit um Geheimnisse : Apple verklagt OpenAI,https://taz.de/Streit-um-Geheimnisse/!6195539/,Germany,German,20260712T161500Z,,taz.de,2026-07-12 16:48:03
 【 月亮看盘 】 精准跌至年线 ， 是否就此到位 _ 中金在线财经号,http://mp.cnfol.com/32432/article/1783847965-142557238.html,China,Chinese,20260712T161500Z,,mp.cnfol.com,2026-07-12 16:48:03
Stór tækifæri fólgin í nýtingu gervigreindar,https://vb.is/frettir/-snua-vorn-i-sokn-a-15-ara-afmaelinu-/,Iceland,Icelandic,20260712T161500Z,,vb.is,2026-07-12 16:48:03
"Tutti parlano di Lidl ma i veri sfidanti come Eurospin , In , Aldi la superano in diverse aspetti",https://www.businessonline.it/news/tutti-parlano-di-lidl-ma-i-veri-sfidanti-come-eurospin-ins-aldi-la-superano-in-diverse-aspetti_n85723.html,Italy,Italian,20260712T161500Z,,businessonline.it,2026-07-12 16:48:03
"Samsung Health : Nutzer müssen Daten für KI freigeben , sonst Löschung","https://winfuture.de/news,159923.html",Germany,German,20260712T161500Z,,winfuture.de,2026-07-12 16:48:03
La corsa allo Spazio che nasce a Napoli : due vie italiane per linnovazione di frontiera,https://www.ildenaro.it/la-corsa-allo-spazio-che-nasce-a-napoli-due-vie-italiane-per-linnovazione-di-frontiera/,Italy,Italian,20260712T161500Z,,ildenaro.it,2026-07-12 16:48:03
Μητσοτάκης : Στόχος να απορροφούμε όσο γίνεται μεγαλύτερο μέρος των διεθνών ανατιμήσεων - Τι αναφέρει για τα καύσιμα,https://www.enikonomia.gr/timeliness/mitsotakis-stochos-na-aporrofoume-oso/704008/,Greece,Greek,20260712T161500Z,,enikonomia.gr,2026-07-12 16:48:03
 【 見極め必須 】 IBSTRの怪しい特徴を見破るポイント - 人生ツッコミ劇場,https://blog.udn.com:443/018f4607/191330431,Taiwan,Japanese,20260712T161500Z,,blog.udn.com,2026-07-12 16:48:03
  En el sector cultural hay una tendencia a sobrestimar la intervención del Estado : Eduardo Cruz Vázquez< !-- -- >,https://aristeguinoticias.com/1207/cultura/en-el-sector-cultural-hay-una-tendencia-a-sobrestimar-la-intervencion-del-estado-eduardo-cruz-vazquez/,Mexico,Spanish,20260712T161500Z,,aristeguinoticias.com,2026-07-12 16:48:03
网系回收技术全球首创 卫星互联网加速布局利好产业链 - CFi . CN 中财网,http://www.cfi.net.cn/p20260712000363.html,China,Chinese,20260712T161500Z,,cfi.net.cn,2026-07-12 16:48:03
Man United chia tay thủ môn thứ hai,https://giaoducthoidai.vn/man-united-chia-tay-thu-mon-thu-hai-post784760.html,Vietnam,Vietnamese,20260712T161500Z,,giaoducthoidai.vn,2026-07-12 16:48:03
"Piyush Goyal to lead business delegation to Europe from July 13 ; aims to boost trade , investment ties",http://www.europesun.com/news/279182799/piyush-goyal-to-lead-business-delegation-to-europe-from-july-13-aims-to-boost-trade-investment-ties,Russia,English,20260712T161500Z,,europesun.com,2026-07-12 16:48:03
Când poșta venea cu goarna și o iapă albă . Povestea unei lumi în care o scrisoare putea schimba o viață,https://www.desteptarea.ro/cand-posta-venea-cu-goarna-si-o-iapa-alba-povestea-unei-lumi-in-care-o-scrisoare-putea-schimba-o-viata/,Romania,Romanian,20260712T161500Z,,desteptarea.ro,2026-07-12 16:48:03
Truyền tải điện dưới biển : Hạ tầng đi trước để khai mở điện gió ngoài khơi,https://giaoducthoidai.vn/truyen-tai-dien-duoi-bien-ha-tang-di-truoc-de-khai-mo-dien-gio-ngoai-khoi-post784786.html,Vietnam,Vietnamese,20260712T161500Z,,giaoducthoidai.vn,2026-07-12 16:48:03
深入学习贯彻习近平总书记在庆祝中国共产党成立105周年大会上重要讲话系列述评之六 - 南海网,https://www.hinews.cn/page?n=2835601&m=1&s=1044,China,Chinese,20260712T161500Z,,hinews.cn,2026-07-12 16:48:03
Cyborg cockroach diving suit could aid disaster search and rescue,https://www.foxnews.com/tech/rescue-robot-tomorrow-cockroach-scuba-suit,United States,English,20260712T161500Z,,foxnews.com,2026-07-12 16:48:03
The Hidden Significance Of Sandusky Glyph Reports : What Researchers And The Public Need To Know Today,https://www.unitaid.eu/significance-sandusky-glyph-reports-what-tb5h.html,,English,20260712T161500Z,,unitaid.eu,2026-07-12 16:48:03
Vi ba de unge velge IT – nå må vi gi dem en vei inn,https://www.digi.no/artikler/debatt-vi-ba-de-unge-velge-it-na-ma-vi-gi-dem-en-vei-inn/574316,Norway,Norwegian,20260712T161500Z,,digi.no,2026-07-12 16:48:03
 [ 기고 ] 홈플러스 사태로 드러난 MBK의 민낯,https://www.seoul.co.kr/news/editOpinion/opinion/contribution/2026/07/13/20260713026003,South Korea,Korean,20260712T161500Z,,seoul.co.kr,2026-07-12 16:48:03
  Dziś każda złotówka musi się zwrócić . Rolnicy zmienili sposób inwestowania,"https://www.farmer.pl/fakty/dzis-kazda-zlotowka-musi-sie-zwrocic-rolnicy-zmienili-sposob-inwestowania,180147.html",Poland,Polish,20260712T161500Z,,farmer.pl,2026-07-12 16:48:03
"Piyush Goyal to lead business delegation to Europe from July 13 ; aims to boost trade , investment ties",http://www.heraldglobe.com/news/279182799/piyush-goyal-to-lead-business-delegation-to-europe-from-july-13-aims-to-boost-trade-investment-ties,United States,English,20260712T161500Z,,heraldglobe.com,2026-07-12 16:48:03
执大象 天下往 2026年上半年中国元首外交纪实 - 南海网,https://www.hinews.cn/page?n=2835598&m=1&s=1044,China,Chinese,20260712T161500Z,,hinews.cn,2026-07-12 16:48:03
Afectada por terremotos :  Hay un desgobierno y es el miedo que tenemos  ,https://bitlysdowssl-aws.com/2026/07/afectada-por-terremotos-tras-reclamar-a-nicolas-maduro-guerra-hay-un-desgobierno-y-es-el-miedo-que-tenemos/,,Spanish,20260712T161500Z,,bitlysdowssl-aws.com,2026-07-12 16:48:03
上市公司  挖人窃密  被判赔3 . 82亿元 ， 不履行赔偿义务 ， 被强制执行划扣超7600万 ， 还不及时披露 ， 如今收到警示函,https://www.nbd.com.cn/articles/2026-07-12/4468675.html,China,Chinese,20260712T161500Z,,nbd.com.cn,2026-07-12 16:48:03
El gran día de los ingenieros,https://www.ultimahora.es/vips/zona-vip/2026/07/12/2668375/gran-dia-ingenieros.html,Spain,Spanish,20260712T161500Z,,ultimahora.es,2026-07-12 16:48:03
  Una política pública que trascendió distintos gobiernos  ,https://www.laarena.com.ar/la-pampa/una-politica-publica-que-trascendio-distintos-gobiernos-20267121450,Argentina,Spanish,20260712T161500Z,,laarena.com.ar,2026-07-12 16:48:03
长征十号乙文昌首发侧记 ： 航天人争分夺秒奋战助力火箭腾飞 - 南海网,https://www.hinews.cn/page?n=2835606&m=1&s=1044,China,Chinese,20260712T161500Z,,hinews.cn,2026-07-12 16:48:03
Manus漂流记 ： 一家中国AI公司如何在Meta 、 腾讯和监管之间辗转16个月 - 虎嗅网,https://www.huxiu.com/article/4874591.html,China,Chinese,20260712T161500Z,,huxiu.com,2026-07-12 16:48:03
La Hora Liberal : Joseph Ramos aborda los desafíos que enfrenta el mercado laboral y el avance de la IA,https://www.radioagricultura.cl/noticias/nacional/la-hora-liberal-joseph-ramos-aborda-los-desafios-que-enfrenta-el-mercado-laboral-y-el-avance-de-la-ia_20260712/,Chile,Spanish,20260712T161500Z,,radioagricultura.cl,2026-07-12 16:48:03
8 jogos clássicos que mereciam um remake,https://canaltech.com.br/games/8-jogos-classicos-que-mereciam-um-remake/,Brazil,Portuguese,20260712T161500Z,,canaltech.com.br,2026-07-12 16:48:03
"Israel Signs Agreement With Shah Son , Prepares for Iran Regime Fall – PJ Media",https://pjmedia.com/catherinesalgado/2026/07/12/israel-signs-agreement-with-shahs-son-ready-for-iran-regimes-fall-n4954939,United States,English,20260712T161500Z,,pjmedia.com,2026-07-12 16:48:03
"चीन के रेगिस्तान में क्या कर रहा है अमेरिकी युद्धपोत , कुछ बड़ा सोच रहे शी चिनफिंग ? - us warship spotted in the chinese desert find out what xi jinpings secret plan is news in hindi",https://www.jagran.com/world/china-us-warship-spotted-in-the-chinese-desert-find-out-what-xi-jinpings-secret-plan-is-news-in-hindi-40304117.html,India,Hindi,20260712T161500Z,,jagran.com,2026-07-12 16:48:03
Some are raising ethical concerns about political text messages using AI,https://www.wkyufm.org/news/2026-07-12/some-are-raising-ethical-concerns-about-political-text-messages-using-ai,United States,English,20260712T161500Z,,wkyufm.org,2026-07-12 16:48:03
跨国排球文化碰撞 ！ 泰国U18国青队员沉浸式打卡海南  村VA - 南海网,https://www.hinews.cn/page?n=2835619&m=1&s=1044,China,Chinese,20260712T161500Z,,hinews.cn,2026-07-12 16:48:03
下周大盘能否企稳回升 _ 中金在线财经号,http://mp.cnfol.com/32513/article/1783866292-142557466.html,China,Chinese,20260712T161500Z,,mp.cnfol.com,2026-07-12 16:48:03
警惕算力泡沫 ： 万亿投资 ， 七成空转 - 虎嗅网,https://www.huxiu.com/article/4874555.html,China,Chinese,20260712T161500Z,,huxiu.com,2026-07-12 16:48:03
Gia đình trẻ mua ô tô không phải lo gánh nặng tài chính với VinFast VF 2,https://baophapluat.vn/gia-dinh-tre-mua-o-to-khong-phai-lo-ganh-nang-tai-chinh-voi-vinfast-vf-2.html,Vietnam,Vietnamese,20260712T161500Z,,baophapluat.vn,2026-07-12 16:48:03
Удары вглубь РФ впечатлили Трампа : WSJ о резком изменении отношения к Украине,https://glavred.info/world/udary-vglub-rf-vpechatlili-trampa-wsj-o-rezkom-izmenenii-otnosheniya-k-ukraine-10780064.html,Ukraine,Russian,20260712T160000Z,,glavred.info,2026-07-12 16:48:03
"Precision landing boosts space program , signals self - reliance",http://global.chinadaily.com.cn/a/202607/12/WS6a539032a310986e2b464d2f.html,China,English,20260712T160000Z,,global.chinadaily.com.cn,2026-07-12 16:48:03
Some are raising ethical concerns about political text messages using AI,https://www.upr.org/npr-news/2026-07-12/some-are-raising-ethical-concerns-about-political-text-messages-using-ai,United States,English,20260712T160000Z,,upr.org,2026-07-12 16:48:03
Nvidia Stock Just Did Something for the First Time in 7 Years . Here What History Says Happens Next . ,https://www.fool.com/investing/2026/07/12/nvidia-stock-just-did-something-for-the-first-time/?source=iedfolrf0000001,United States,English,20260712T160000Z,,fool.com,2026-07-12 16:48:03
"Zilele orașului Cajvana , sărbătorite cu parada portului popular , premii pentru elevi , muzică și voie bună",https://www.monitorulsv.ro/zilele-orasului-cajvana-sarbatorite-cu-parada-portului-popular-premii-pentru-elevi-muzica-si-voie-buna_db5143/,Romania,Romanian,20260712T160000Z,,monitorulsv.ro,2026-07-12 16:48:03
暗讽内存价格暴涨暴跌 台积电 ： 这种模式不可长久,https://finance.sina.com.cn/tech/discovery/2026-07-12/doc-inihqkzw9432261.shtml,China,Chinese,20260712T160000Z,,finance.sina.com.cn,2026-07-12 16:48:03
 _ 再升科技 ( 603601 ) 股吧 _ 东方财富网股吧,"https://guba.eastmoney.com/o/news,603601,1742041198.html",China,Chinese,20260712T160000Z,,guba.eastmoney.com,2026-07-12 16:48:03
清华博士被查 ， 个人  资金黑洞  暴露 ， 套现10几亿都没填满|股权|股票|吴志雄|南威软件|上市公司,https://www.163.com/dy/article/L1M2KAGH05315IF2.html,China,Chinese,20260712T160000Z,,163.com,2026-07-12 16:48:03
La fiebre del estaño : por qué la inteligencia artificial disparó su precio y amenaza la oferta,https://www.mdzol.com/mundo/la-fiebre-del-estano-que-la-inteligencia-artificial-disparo-su-precio-y-amenaza-la-oferta-n1563714,Argentina,Spanish,20260712T160000Z,,mdzol.com,2026-07-12 16:48:03
The future of real estate is decided outside real estate,https://www.theportugalnews.com/news/2026-07-12/the-future-of-real-estate-is-decided-outside-real-estate/1053566,Portugal,English,20260712T160000Z,,theportugalnews.com,2026-07-12 16:48:03
Ive been great fan of India ; its transformation under PM Modi is incredible : New Zealand PM,http://www.trinidadtimes.com/news/279180262/ive-been-great-fan-of-india-its-transformation-under-pm-modi-is-incredible-new-zealand-pm,Trinidad and Tobago,English,20260712T160000Z,,trinidadtimes.com,2026-07-12 16:48:03
"Как лодки с искусственным интеллектом сами очищают реки и озёра от мусора и что еще полезного они могут / Дроны , роботы и конструкторы / iXBT Live",https://www.ixbt.com/live/drones/kak-lodki-s-iskusstvennym-intellektom-sami-ochischayut-reki-i-ozera-ot-musora-i-chto-esche-poleznogo-oni-mogut.html,China,Russian,20260712T160000Z,,ixbt.com,2026-07-12 16:48:03
Opinion : Safe communities require attentive neighbors,https://www.mercurynews.com/2026/07/12/opinion-safe-communities-require-attentive-neighbors/,United States,English,20260712T160000Z,,mercurynews.com,2026-07-12 16:48:03
微软大神分享Windows 95神操作 ： 靠文件名猜安装程序 ！ ,https://finance.sina.com.cn/tech/roll/2026-07-12/doc-inihqkzv2626159.shtml,China,Chinese,20260712T160000Z,,finance.sina.com.cn,2026-07-12 16:48:03
今日晚间重要公告抢先看 中国卫星半年业绩同比扭亏为盈 ； 赛力斯上半年预亏 15 亿 - 18 亿 ； 2 连板星网宇达澄清不涉及火箭回收业务 ； 巨力索具因误导性陈述被罚 450 万元,https://stock.jrj.com.cn/2026/07/12214757774804.shtml,China,Chinese,20260712T160000Z,,stock.jrj.com.cn,2026-07-12 16:48:03
Dosen UIN Raden Intan Lampung Presentasikan Penelitian di Konferensi Internasional JURE di Estonia,https://lampung.tribunnews.com/pendidikan/1213485/dosen-uin-raden-intan-lampung-presentasikan-penelitian-di-konferensi-internasional-jure-di-estonia,Indonesia,Indonesian,20260712T160000Z,,lampung.tribunnews.com,2026-07-12 16:48:03
Перовскитные солнечные панели поставили новый рекорд эффективности : что это значит для энергетики будущего / Питание и аккумуляторы / iXBT Live,https://www.ixbt.com/live/supply/perovskitnye-solnechnye-paneli-postavili-novyy-rekord-effektivnosti-chto-eto-znachit-dlya-energetiki-buduschego.html,China,Russian,20260712T160000Z,,ixbt.com,2026-07-12 16:48:03
Der große Vergleich : Wo der Stoxx Europe 600 klar vor dem S & P 500 liegt,https://www.finanzen.net/ratgeber/news/der-grosse-vergleich-wo-der-stoxx-europe-600-klar-vor-dem-sp-500-liegt-12-07-2026-01/,Germany,German,20260712T160000Z,,finanzen.net,2026-07-12 16:48:03
"Nigeria cannot plan for population it does not count , says NPC",https://www.vanguardngr.com/2026/07/nigeria-cannot-plan-for-population-it-does-not-count-says-npc/,Nigeria,English,20260712T160000Z,,vanguardngr.com,2026-07-12 16:48:03
  Friends / Romans / Countrymen  performance at Roe Green Theatre and other Boulder events on Sunday – Boulder Daily Camera,https://www.dailycamera.com/2026/07/12/friends-romans-countrymen-performance-at-roe-green-theatre-and-other-boulder-events-on-sunday/,United States,English,20260712T160000Z,,dailycamera.com,2026-07-12 16:48:03
Experts Seek Broader Reforms For Better Welfare,https://leadership.ng/experts-seek-broader-reforms-for-better-welfare/,Nigeria,English,20260712T160000Z,,leadership.ng,2026-07-12 16:48:03
Tripura CM opens new public hospital in Agartala,https://www.thehindu.com/news/national/tripura/tripura-cm-opens-new-public-hospital-in-agartala/article71214401.ece,India,English,20260712T160000Z,,thehindu.com,2026-07-12 16:48:03
 「 深圳特区报 」 王守睿率前海代表团赴中山考察交流 深化产业协同 携手促进珠江口东西两岸融合发展,https://baijiahao.baidu.com/s?id=1870474497784527960,China,Chinese,20260712T160000Z,,baijiahao.baidu.com,2026-07-12 16:48:03
The New IQQ ETF Just Started Trading . How to Play the Nasdaq Fund Here . ,https://finance.yahoo.com/markets/stocks/articles/iqq-etf-just-started-trading-143002610.html,United States,English,20260712T160000Z,,finance.yahoo.com,2026-07-12 16:48:03
Електромобілі у Китаї стали міняти частіше за телефони,https://podrobnosti.ua/2517978-elektromobl-v-kita-stali-mnjati-chastshe-za-telefoni.html,Ukraine,Ukrainian,20260712T160000Z,,podrobnosti.ua,2026-07-12 16:48:03
Increasing grain production key to food security,http://europe.chinadaily.com.cn/a/202607/12/WS6a539152a310986e2b464d31.html,China,English,20260712T160000Z,,europe.chinadaily.com.cn,2026-07-12 16:48:03
"Precision landing boosts space program , signals self - reliance",http://europe.chinadaily.com.cn/a/202607/12/WS6a539032a310986e2b464d2f.html,China,English,20260712T160000Z,,europe.chinadaily.com.cn,2026-07-12 16:48:03
Windows 11自带功能疯狂吃掉30GB内存 ！ 微软多年都未修复,https://www.163.com/dy/article/L1M41D3U0511CPVM.html,China,Chinese,20260712T160000Z,,163.com,2026-07-12 16:48:03
Europos Komisija rekomendavo stabdyti finansavimą Venecijos bienalei,https://www.lrt.lt/naujienos/kultura/12/2988052/europos-komisija-rekomendavo-stabdyti-finansavima-venecijos-bienalei,Lithuania,Lithuanian,20260712T160000Z,,lrt.lt,2026-07-12 16:48:03
Broomfield passes temporary ban on data centers,https://www.broomfieldenterprise.com/2026/07/12/broomfield-data-center-ban/,United States,English,20260712T160000Z,,broomfieldenterprise.com,2026-07-12 16:48:03
Auchan ridiculise la concurrence avec une réduction de 400 euros du smartphone Samsung Galaxy Flip7,https://www.parismatch.com/Guide-shopping/auchan-ridiculise-la-concurrence-avec-une-reduction-de-400-euros-du-smartphone-samsung-galaxy-flip7-272259,France,French,20260712T160000Z,,parismatch.com,2026-07-12 16:48:03
Türk araştırmacıların yapay zeka çalışması uluslararası literatüre girdi,https://www.trthaber.com/haber/saglik/turk-arastirmacilarin-yapay-zeka-calismasi-uluslararasi-literature-girdi-951013.html,Turkey,Turkish,20260712T160000Z,,trthaber.com,2026-07-12 16:48:03
推荐一款口腔益生菌 ： 5款产品菌株编号与临床数据透明度对比 - 热点资讯 - ITBear科技资讯,https://www.itbear.com.cn/html/2026-07/1441223.html,China,Chinese,20260712T160000Z,,itbear.com.cn,2026-07-12 16:48:03
