title,url,source_country,language,published_date,tone,domain,collected_at
"Hai controllato il telefono negli ultimi cinque minuti ? Se sì , hai un problema ( lo abbiamo tutti ) ",https://www.quotidiano.net/luce/attualita/dipendenza-smartphone-e5eada4b,Italy,Italian,20260711T140000Z,,quotidiano.net,2026-07-11 14:19:43
"  Skill development centre for medical students , specialists will have great impact  ",https://www.thehindu.com/news/cities/Mangalore/skill-development-centre-for-medical-students-specialists-will-have-good-impact/article71210252.ece,India,English,20260711T140000Z,,thehindu.com,2026-07-11 14:19:43
Τι βλέπουμε το Σαββατοκύριακο : 5 σειρές για κάθε διάθεση,https://pelop.gr/ti-vlepoume-to-savvatokyriako-5-seires-gia-kathe-diathesi/,Greece,Greek,20260711T140000Z,,pelop.gr,2026-07-11 14:19:43
New carbon credit issuance supports sustainability : ministry,https://en.antaranews.com/news/422305/new-carbon-credit-issuance-supports-sustainability-ministry,Indonesia,English,20260711T140000Z,,en.antaranews.com,2026-07-11 14:19:43
Nữ thượng úy phát biểu tại Lễ kỷ niệm 80 năm Ngày truyền thống lực lượng An ninh nhân dân,https://baomoi.com/nu-thuong-uy-phat-bieu-tai-le-ky-niem-80-nam-ngay-truyen-thong-luc-luong-an-ninh-nhan-dan-c55596071.epi,Vietnam,Vietnamese,20260711T140000Z,,baomoi.com,2026-07-11 14:19:43
Shy on the dance floor ? Virtual reality  partner aim to help you find your groove,https://www.wgcu.org/2026-07-11/shy-on-the-dance-floor-virtual-reality-partners-aim-to-help-you-find-your-groove,United States,English,20260711T140000Z,,wgcu.org,2026-07-11 14:19:43
26支队伍同台竞技  电波卫士  永州硬核过招,https://baijiahao.baidu.com/s?id=1870425792357677729,China,Chinese,20260711T140000Z,,baijiahao.baidu.com,2026-07-11 14:19:43
Previsiones principales de la semana del 12 al 18 de julio de 2026,https://www.prensa-latina.cu/2026/07/11/previsiones-principales-de-la-semana-del-12-al-18-de-julio-de-2026/,Cuba,Spanish,20260711T140000Z,,prensa-latina.cu,2026-07-11 14:19:43
Shy on the dance floor ? Virtual reality  partner aim to help you find your groove,https://www.kazu.org/npr-news/2026-07-11/shy-on-the-dance-floor-virtual-reality-partners-aim-to-help-you-find-your-groove,United States,English,20260711T140000Z,,kazu.org,2026-07-11 14:19:43
The World Cup comes to America,https://www.washingtonexaminer.com/premium/4641667/world-cup-comes-to-america/,United States,English,20260711T140000Z,,washingtonexaminer.com,2026-07-11 14:19:43
直擊美妝新制 歐思佛生技引領合規商機,https://n.yam.com/Article/20260711741420,Taiwan,Chinese,20260711T140000Z,,n.yam.com,2026-07-11 14:19:43
University of Luxembourg Frontiers Day Event to Focus on AI & Science,https://www.chronicle.lu/category/conferences-seminars/62344-university-of-luxembourg-frontiers-day-event-to-focus-on-ai-science,Luxembourg,English,20260711T140000Z,,chronicle.lu,2026-07-11 14:19:43
"Torna Confartigianato Motori : il premio che unisce Formula 1 , imprese e territorio",https://www.mbnews.it/2026/07/torna-confartigianato-motori-il-premio-che-unisce-formula-1-imprese-e-territorio,Italy,Italian,20260711T140000Z,,mbnews.it,2026-07-11 14:19:43
人形机器人给猪做了手术 ， 但  主刀者  还是人类医生|腹腔镜手术|宇树科技|手术室|外科手术,https://news.sina.com.cn/o/2026-07-11/doc-inihmzuv4912087.shtml,China,Chinese,20260711T140000Z,,news.sina.com.cn,2026-07-11 14:19:43
উত্তরায় ডিএমপি কমিশনারের বিশেষ অপরাধ সভা ; পেশাদারিত্ব ও জনবান্ধব পুলিশিংয়ের কড়া নির্দেশনা,https://dailyinqilab.com/motropolis/news/915218,Bangladesh,Bengali,20260711T140000Z,,dailyinqilab.com,2026-07-11 14:19:43
Nikhil Kamath Favorite Books Marathi : अब्जाधीश निखिल कामथ यांनी सुचवलेली ५ पुस्तके,https://www.loksatta.com/business/nikhil-kamath-favorite-books-marathi-zerodha-co-founder-success-story-guide-rap-91-6014102/,India,Marathi,20260711T140000Z,,loksatta.com,2026-07-11 14:19:43
Catalunya anuncia una inversió de més de 1 . 000 milions en la construcció un centre dIA a Flix,https://www.elperiodico.cat/politica/20260711/intelligencia-artificial-catalunya-inversio-1000-milions-flix-ercros-132360493,Spain,Catalan,20260711T140000Z,,elperiodico.cat,2026-07-11 14:19:43
Fears of Gulf Stream Collapse Fade as Hard Data Reveal Major Role of Natural Variation,https://wattsupwiththat.com/2026/07/11/fears-of-gulf-stream-collapse-fade-as-hard-data-reveal-major-role-of-natural-variation/,United States,English,20260711T140000Z,,wattsupwiththat.com,2026-07-11 14:19:43
Chronicle . lu,https://www.chronicle.lu/event/14310-uni-lu-frontiers-day-ai-and-science,Luxembourg,English,20260711T140000Z,,chronicle.lu,2026-07-11 14:19:43
The NBA Election : Moving Beyond Politics to Purpose,https://thenewsnigeria.com.ng/2026/07/11/the-nba-election-moving-beyond-politics-to-purpose/,Nigeria,English,20260711T140000Z,,thenewsnigeria.com.ng,2026-07-11 14:19:43
桃園步態分析鞋墊OEM 》 廣薪實業 如何協助企業快速布局鞋墊 OEM / ODM 市場 ？ - 4jwqkdne22521 的部落格,https://blog.udn.com:443/4jwqkdne22521/191323711,Taiwan,Chinese,20260711T140000Z,,blog.udn.com,2026-07-11 14:19:43
Oakland County community calendar July 12 and beyond,https://www.theoaklandpress.com/2026/07/11/oakland-county-community-calendar-july-12-and-beyond/,United States,English,20260711T140000Z,,theoaklandpress.com,2026-07-11 14:19:43
La Jornada : Denuncian filtraciones y derrumbes en hospital de Xoco,https://www.jornada.com.mx/2026/07/11/capital/025n1cap,Mexico,Spanish,20260711T140000Z,,jornada.com.mx,2026-07-11 14:19:43
Європейські сподівання та українські реалії . До чого призведе тиск влади на мілтех DSnews . ua,https://www.dsnews.ua/ukr/politics/yevropeyski-spodivannya-ta-ukrajinski-realiji-do-chogo-prizvede-tisk-vladi-na-milteh-11072026-463203,Ukraine,Ukrainian,20260711T140000Z,,dsnews.ua,2026-07-11 14:19:43
关键词 ： 10万级新能源紧凑型SUV排名,https://k.sina.com.cn/article_1747383115_6826f34b02003hnay.html,China,Chinese,20260711T140000Z,,k.sina.com.cn,2026-07-11 14:19:43
মানবিক দৃষ্টিভঙ্গি ও সঠিক চিকিৎসা স্বাস্থ্যসেবায় আস্থা ফেরাতে পারে : প্রধানমন্ত্রী,https://www.ntvbd.com/bangladesh/news-1769585,Bangladesh,Bengali,20260711T140000Z,,ntvbd.com,2026-07-11 14:19:43
HyperTexting : la nueva app que transforma la web en un feed social,https://www.cadena3.com/noticia/tecnologia/hypertexting-la-nueva-app-que-transforma-la-web-en-un-feed-social_571985,Argentina,Spanish,20260711T140000Z,,cadena3.com,2026-07-11 14:19:43
重磅 ！ 这所十一盟校又有新动作 ， 新高一特色实验班全新亮相 ！ ,https://www.163.com/dy/article/L1JAEMPB0536JW7T.html,China,Chinese,20260711T140000Z,,163.com,2026-07-11 14:19:43
Cebu City Council Reshuffle : Archival Urges Partisan Unity,https://www.sunstar.com.ph/cebu/political-realignment-clips-minority-roles-in-council,Philippines,English,20260711T140000Z,,sunstar.com.ph,2026-07-11 14:19:43
Việt Nam lập kỷ lục với 4 Huy chương Vàng tại Olympic Vật lý quốc tế,https://baoxaydung.vn/viet-nam-lap-ky-luc-voi-4-huy-chuong-vang-tai-olympic-vat-ly-quoc-te-192260711144713034.htm,,Vietnamese,20260711T140000Z,,baoxaydung.vn,2026-07-11 14:19:43
曝中兴旗下将深度聚焦AI手机 ， 常规产品也正常迭代,https://www.163.com/dy/article/L1J91PBG0511ADC6.html,China,Chinese,20260711T140000Z,,163.com,2026-07-11 14:19:43
Il divieto dei social ai minori è la vera soluzione ? ,https://www.2duerighe.com/attualita/200625-il-divieto-dei-social-ai-minori-e-la-vera-soluzione.html,Italy,Italian,20260711T140000Z,,2duerighe.com,2026-07-11 14:19:43
"Apple судится с OpenAI , обвинив ее в краже коммерческих тайн",https://www.dw.com/ru/apple-podala-v-sud-na-openai-obviniv-ee-v-kraze-kommerceskih-sekretov/a-77916559,Germany,Russian,20260711T140000Z,,dw.com,2026-07-11 14:19:43
Ρούμπιν στο Fox News : Γιατί οι ΗΠΑ δεν πρέπει να πουλήσουν F - 35 στην Τουρκία,https://www.inewsgr.com/441/roubin-sto-Fox-News-giati-oi-ipa-den-prepei-na-poulisoun-F-35-stin-tourkia.htm,Greece,Greek,20260711T140000Z,,inewsgr.com,2026-07-11 14:19:43
"APC chairman hails FG , security agencies over rescue of abducted Oyo pupils",https://www.vanguardngr.com/2026/07/apc-chairman-hails-fg-security-agencies-over-rescue-of-abducted-oyo-pupils/,Nigeria,English,20260711T140000Z,,vanguardngr.com,2026-07-11 14:19:43
Argentina y Suiza : el pasado migratorio y diplomático desde el siglo XIX que pocos conocen antes del Mundial 2026 | Mundo,https://larepublica.pe/mundo/2026/07/11/argentina-y-suiza-el-pasado-migratorio-y-diplomatico-desde-el-siglo-xix-que-pocos-conocen-antes-del-mundial-2026-925990,Peru,Spanish,20260711T140000Z,,larepublica.pe,2026-07-11 14:19:43
Главный недостаток iPhone 18 и Galaxy S27 уже известен : дело не в камерах,https://www.unian.net/techno/gadgets/glavnyy-nedostatok-iphone-18-i-galaxy-s27-uzhe-izvesten-delo-ne-v-kamerah-13437828.html,Ukraine,Russian,20260711T140000Z,,unian.net,2026-07-11 14:19:43
存储芯片股过去数周跌超20 %， 存储芯片底层逻辑面临重估,https://www.tmtpost.com/nictation/8061433.html,China,Chinese,20260711T140000Z,,tmtpost.com,2026-07-11 14:19:43
AI走進零售現場 momo登Google Cloud Day Taipei分享大型電商AI落地經驗,https://n.yam.com/Article/20260711189593,Taiwan,Chinese,20260711T140000Z,,n.yam.com,2026-07-11 14:19:43
"  사상 최고 트래픽 폭증 … OpenAI , Codex · ChatGPT Work 사용량 제한 긴급 복구",https://www.radioseoul1650.com/archives/146722,United States,Korean,20260711T140000Z,,radioseoul1650.com,2026-07-11 14:19:43
Kontrola łańcucha dostaw nie działa ? Europejskie mikrokontrolery napędzają rosyjski przemysł militarny,https://www.computerworld.pl/article/100051706/kontrola-lancucha-dostaw-nie-dziala-europejskie-mikrokontrolery-napedzaja-rosyjski-przemysl-militarny.html,Poland,Polish,20260711T140000Z,,computerworld.pl,2026-07-11 14:19:43
"Holanda ndërton kampin për robërit e luftës , mund të mbajë deri në 2 mijë ushtarë të Putin",https://newsmaxbalkans.al/bote/europa/53388/holanda-nderton-kampin-per-roberit-e-luftes-mund-te-mbaje-deri-ne-2-mije-ushtare-te-putin/news,,Albanian,20260711T140000Z,,newsmaxbalkans.al,2026-07-11 14:19:43
পরিবেশ রক্ষার লড়াই সরকারের একার পক্ষে সম্ভব নয় : পরিবেশমন্ত্রী,https://dailyinqilab.com/national/news/915202,Bangladesh,Bengali,20260711T140000Z,,dailyinqilab.com,2026-07-11 14:19:43
iPhone Air 2 : Νέα διαρροή αποκαλύπτει μεγαλύτερη μπαταρία και ισχυρότερο chip,https://digitallife.gr/iphone-air-2-nea-diarroi-apokalyptei-megalyteri-bataria-kai-ischyrotero-chip-90018/,Greece,Greek,20260711T140000Z,,digitallife.gr,2026-07-11 14:19:43
中山大学教授赵昌文 ： 产业集群不是  堆  在一起 ， 而是  长  在一起,https://baijiahao.baidu.com/s?id=1870250418036795097,China,Chinese,20260711T140000Z,,baijiahao.baidu.com,2026-07-11 14:19:43
Gcore Event Debates Europe AI Infrastructure & Digital Sovereignty,https://www.chronicle.lu/category/conferences-seminars/62345-gcore-event-debates-europes-ai-infrastructure-digital-sovereignty,Luxembourg,English,20260711T140000Z,,chronicle.lu,2026-07-11 14:19:43
Renault в Україні представляє Symbioz новий компактний сімейний SUV C - сегмента,https://nikvesti.com/news/business/321007-renault-in-ukraini-presentuie-symbioz,Ukraine,Ukrainian,20260711T140000Z,,nikvesti.com,2026-07-11 14:19:43
Gcore Event Debates Europe AI Infrastructure & Digital Sovereignty,https://www.chronicle.lu/category/working-in-luxembourg/62345-gcore-event-debates-europes-ai-infrastructure-digital-sovereignty,Luxembourg,English,20260711T140000Z,,chronicle.lu,2026-07-11 14:19:43
id Software gives statement after layoffs with a positive outlook for its future,https://www.thesixthaxis.com/2026/07/11/id-software-gives-statement-after-layoffs-with-a-positive-outlook-for-its-future/,United States,English,20260711T140000Z,,thesixthaxis.com,2026-07-11 14:19:43
ঢাবির এমপিএইচআরএম প্রোগ্রামের ১৬তম ব্যাচের ওরিয়েন্টেশন অনুষ্ঠিত,https://www.ntvbd.com/education/news-1769513,Bangladesh,Bengali,20260711T140000Z,,ntvbd.com,2026-07-11 14:19:43
নকিয়ার মূল প্রতিষ্ঠান এইচএমডির মোবাইল এখন বাংলাদেশে,https://www.ntvbd.com/tech/news-1769517,Bangladesh,Bengali,20260711T140000Z,,ntvbd.com,2026-07-11 14:19:43
习近平总书记重要讲话激励广大科技工作者勇担使命 _ 四川在线,https://focus.scol.com.cn/gcdt/202607/83286407.html,China,Chinese,20260711T140000Z,,focus.scol.com.cn,2026-07-11 14:19:43
Sát thủ BrahMos : Indonesia sở hữu siêu tên lửa diệt hạm ? ,https://motthegioi.vn/brahmos-indonesia-sieu-ten-lua/,Vietnam,Vietnamese,20260711T140000Z,,motthegioi.vn,2026-07-11 14:19:43
BW2026盛大开幕 ， ROG  玩创宇宙  主题展区引爆玩家热情 _ 中文科技资讯 ,https://www.citnews.com.cn/news/219615,China,Chinese,20260711T140000Z,,citnews.com.cn,2026-07-11 14:19:43
机器人 、 AI潮玩齐亮相 ， 2026王府井论坛让  科技+消费  触手可及 _ 新浪财经 _ 新浪网,https://finance.sina.com.cn/jjxw/2026-07-11/doc-inihmzut8138183.shtml,China,Chinese,20260711T140000Z,,finance.sina.com.cn,2026-07-11 14:19:43
Khofifah Komunikasi publik harus jembatani kebijakan pemerintah - rakyat,https://www.antaranews.com/berita/5645665/khofifah-komunikasi-publik-harus-jembatani-kebijakan-pemerintah-rakyat,Indonesia,Indonesian,20260711T140000Z,,antaranews.com,2026-07-11 14:19:43
"India , New Zealand eye strategic partnership ; aim to double trade to ₹35 , 000 cr by 2030",https://www.thehindubusinessline.com/economy/india-new-zealand-eye-strategic-partnership-aim-to-double-trade-to-35000-cr-by-2030/article71210201.ece,India,English,20260711T140000Z,,thehindubusinessline.com,2026-07-11 14:19:43
"विकसित भारत 2047 के लिए तकनीक बनेगी सबसे बड़ी ताकत , हैदराबाद में उद्योग जगत से बोले अश्विनी वैष्णव | Ashwini Vaishnaw Interacts with IT Leaders on Viksit Bharat 2047 in Hyderabad",https://www.pratahkal.com/indian-railways/ashwini-vaishnaw-hyderabad-viksit-bharat-it-industry-interaction-1611384,India,Hindi,20260711T140000Z,,pratahkal.com,2026-07-11 14:19:43
AIROC 2026 : Học sinh Việt giải bài toán đô thị bằng AI và robot,https://baoxaydung.vn/airoc-2026-hoc-sinh-viet-giai-bai-toan-do-thi-bang-ai-va-robot-192260711161821704.htm,,Vietnamese,20260711T140000Z,,baoxaydung.vn,2026-07-11 14:19:43
2026年东吴双创周在苏州吴中开启,https://baijiahao.baidu.com/s?id=1870424814337360629,China,Chinese,20260711T140000Z,,baijiahao.baidu.com,2026-07-11 14:19:43
A medicina está voltando a falar de algo que nunca deveria ter esquecido : os nossos hábitos,https://jc.uol.com.br/colunas/saude-e-bem-estar/2026/07/11/por-que-a-medicina-voltou-a-falar-tanto-sobre-habitos.html,Brazil,Portuguese,20260711T140000Z,,jc.uol.com.br,2026-07-11 14:19:43
Meeting between Prime Minister Muhammad Shehbaz Sharif and President Recep Tayyip Erdoğan,https://www.globalsecurity.org/wmd/library/news/pakistan/2026/pakistan-260704-pakistanpm01.htm,Syria,English,20260711T134500Z,,globalsecurity.org,2026-07-11 14:19:43
  杭州新八骏  成科创打卡地 中外嘉宾为何慕名而来,https://baijiahao.baidu.com/s?id=1870331513074139343,China,Chinese,20260711T134500Z,,baijiahao.baidu.com,2026-07-11 14:19:43
Top 5 Podcasts in India Redefining Long - Form Conversations and Thought Leadership,http://www.bignewsnetwork.com/news/279180783/top-5-podcasts-in-india-redefining-long-form-conversations-and-thought-leadership,United States,English,20260711T134500Z,,bignewsnetwork.com,2026-07-11 14:19:43
Grendel : Devil Crucible -- Sedition # 1 Preview : Clone Wars,https://bleedingcool.com/comics/grendel-devils-crucible-sedition-1-preview-clone-wars/,United States,English,20260711T134500Z,,bleedingcool.com,2026-07-11 14:19:43
Cómo la tecnología nos arruga el cuello y debilita las manos Ensegundos República Dominicana,https://ensegundos.do/2026/07/11/como-la-tecnologia-nos-arruga-el-cuello-y-debilita-las-manos/,Dominican Republic,Spanish,20260711T134500Z,,ensegundos.do,2026-07-11 14:19:43
Shy on the dance floor ? Virtual reality  partner aim to help you find your groove,https://knpr.org/npr/2026-07-11/shy-on-the-dance-floor-virtual-reality-partners-aim-to-help-you-find-your-groove,United States,English,20260711T134500Z,,knpr.org,2026-07-11 14:19:43
"His Girlfriend Moved In With Him , But He Asked Her To Move Out After She Said They Should See Other People",https://www.chipchick.com/2026/07/his-girlfriend-moved-in-with-him-but-he-asked-her-to-move-out-after-she-said-they-should-see-other-people,United States,English,20260711T134500Z,,chipchick.com,2026-07-11 14:19:43
"Your degree got an upgrade with ABC , LMS platforms",https://www.educationtimes.com/article/campus-beat-college-life/99742221/your-degree-got-an-upgrade-with-abc-lms-platforms,India,English,20260711T134500Z,,educationtimes.com,2026-07-11 14:19:43
США вложат $16 млн в перезапуск производства « неубиваемых » 45 - нанометровых микросхем для космоса и сложной техники,https://www.ixbt.com/news/2026/07/11/ssha-vlozhat-16-mln-v-perezapusk-proizvodstva-neubivaemyh-45nanometrovyh-mikroshem--dlja-kosmosa-i-slozhnoj-tehniki.html,China,Russian,20260711T134500Z,,ixbt.com,2026-07-11 14:19:43
美增列60多家中企黑名單 北京斥違背 「 川習會 」 共識 | 兩岸 ( 大陸 ) | 三立新聞網 SETN . COM,https://www.setn.com/news/1870998,Taiwan,Chinese,20260711T134500Z,,setn.com,2026-07-11 14:19:43
好太太获得两项  AAA级国家认证  ,https://baijiahao.baidu.com/s?id=1870332850732830588,China,Chinese,20260711T134500Z,,baijiahao.baidu.com,2026-07-11 14:19:43
How the federal government proposed digital regulator would work,https://www.therecord.com/news/canada/how-the-federal-governments-proposed-digital-regulator-would-work/article_9e2129f3-9959-5fb1-9f40-ba74577324e1.html,Canada,English,20260711T134500Z,,therecord.com,2026-07-11 14:19:43
拥抱人机共生未来 成都交子大道机器人街区超级场景启动,https://baijiahao.baidu.com/s?id=1870333435074617242,China,Chinese,20260711T134500Z,,baijiahao.baidu.com,2026-07-11 14:19:43
汾酒进阶生活哲学家|白酒|悦己|基酒|清香型 _ 网易订阅,https://www.163.com/dy/article/L1J8F1BA0519H4OO.html,China,Chinese,20260711T134500Z,,163.com,2026-07-11 14:19:43
JT to advertise data center ordinance – Times News Online,https://www.tnonline.com/20260711/jt-to-advertise-data-center-ordinance/,United States,English,20260711T134500Z,,tnonline.com,2026-07-11 14:19:43
Shy on the dance floor ? Virtual reality  partner aim to help you find your groove,https://www.wcsufm.org/latest-from-npr/2026-07-11/shy-on-the-dance-floor-virtual-reality-partners-aim-to-help-you-find-your-groove,United States,English,20260711T134500Z,,wcsufm.org,2026-07-11 14:19:43
11天百万行代码重写 ： AI加速工程背后 ， Zig创始人怒批与行业争议 - 数码极客 - ITBear科技资讯,https://www.itbear.com.cn/html/2026-07/1440347.html,China,Chinese,20260711T134500Z,,itbear.com.cn,2026-07-11 14:19:43
"Burundi , Russia agree to support African - led peace initiatives - Xinhua",https://english.news.cn/20260711/6d00456e62934adaa61e941160257e8e/c.html,,English,20260711T134500Z,,english.news.cn,2026-07-11 14:19:43
"Vinmec  lập hat - trick  tại HR Asia Awards , khẳng định chiến lược lấy con người làm gốc",https://baocantho.com.vn/vinmec-lap-hat-trick-tai-hr-asia-awards-khang-dinh-chien-luoc-lay-con-nguoi-lam-goc-a209435.html,Vietnam,Vietnamese,20260711T134500Z,,baocantho.com.vn,2026-07-11 14:19:43
"AlgoLaser Launches DIY KIT MK3 : Start , Just That Simple -- A Smarter Way to Laser Engrave",https://www.itnewsonline.com/PRNewswire/AlgoLaser-Launches-DIY-KIT-MK3-Start-Just-That-Simple--A-Smarter-Way-to-Laser-Engrave/1136714,United States,English,20260711T134500Z,,itnewsonline.com,2026-07-11 14:19:43
President Xi Jinping Holds Talks with Namibian President Netumbo Nandi - Ndaitwah,https://www.globalsecurity.org/wmd/library/news/china/2026/07/china-260710-prc-mofa02.htm,Syria,English,20260711T134500Z,,globalsecurity.org,2026-07-11 14:19:43
Santé numérique : la Tunisie brille au forum mondial « AI for Good » ,https://realites.com.tn/fr/sante-numerique-la-tunisie-brille-au-forum-mondial-ai-for-good/,Tunisia,French,20260711T134500Z,,realites.com.tn,2026-07-11 14:19:43
Info BMKG : Terjadi Gempa Bumi di Tolikara Papua pada Sabtu 11 Juli 2026,https://manado.tribunnews.com/sulawesi-utara/1883828/info-bmkg-terjadi-gempa-bumi-di-tolikara-papua-pada-sabtu-11-juli-2026,Indonesia,Indonesian,20260711T134500Z,,manado.tribunnews.com,2026-07-11 14:19:43
"Contracts for July 10 , 2026",https://www.globalsecurity.org/military/library/news/2026/07/dod-contracts_4540411.htm,Syria,English,20260711T134500Z,,globalsecurity.org,2026-07-11 14:19:43
В речном порту Камбарки запущена станция фасовки грузов : предприятие выходит на круглогодичный режим,https://www.korabel.ru/news/comments/v_rechnom_portu_kambarki_zapuschena_stanciya_fasovki_gruzov_predpriyatie_vyhodit_na_kruglogodichnuyu_rezhim.html,Russia,Russian,20260711T134500Z,,korabel.ru,2026-07-11 14:19:43
" « Работа понятная , оплата достойная »: студенты о временной занятости во время каникул",https://www.sb.by/articles/za-opytom-i-zarabotkom.html,Belarus,Russian,20260711T134500Z,,sb.by,2026-07-11 14:19:43
Lakhanpur Selected For Developing  Street Food Hub  Under Central Scheme : Dr Jitendra,https://www.dailyexcelsior.com/lakhanpur-selected-for-developing-street-food-hub-under-central-scheme-dr-jitendra/,India,English,20260711T134500Z,,dailyexcelsior.com,2026-07-11 14:19:43
Shy on the dance floor ? Virtual reality  partner aim to help you find your groove,https://www.aspenpublicradio.org/2026-07-11/shy-on-the-dance-floor-virtual-reality-partners-aim-to-help-you-find-your-groove,United States,English,20260711T134500Z,,aspenpublicradio.org,2026-07-11 14:19:43
Глава Туркменистана выступил с речью на заседании правительства | Политика,https://www.turkmeninform.com/ru/news/20260711/15560.html,Turkmenistan,Russian,20260711T134500Z,,turkmeninform.com,2026-07-11 14:19:43
  成都造  捷达M6计划今年9月正式上市 ！ 提前达标  史上最严  电动汽车新国标 - 新浪汽车,https://k.sina.com.cn/article_5953190046_162d6789e06703hp5q.html,China,Chinese,20260711T134500Z,,k.sina.com.cn,2026-07-11 14:19:43
"  PM Modi , let me say on behalf of 5 million New Zealanders , you are worth the wait : Christopher Luxon",http://www.calcuttanews.net/news/279180735/pm-modi-let-me-say-on-behalf-of-5-million-new-zealanders-you-are-worth-the-wait-christopher-luxon,India,English,20260711T134500Z,,calcuttanews.net,2026-07-11 14:19:43
The Critical Role Of AI Chatbots In Modern Mental Health,http://www.rozanaspokesman.com/lifestyle/health/110726/ai-chatbots-mental-health-support-future.html,India,English,20260711T134500Z,,rozanaspokesman.com,2026-07-11 14:19:43
Verdadero periodismo,https://nuevaalcarria.com/articulos/verdadero-periodismo,United Kingdom,Spanish,20260711T134500Z,,nuevaalcarria.com,2026-07-11 14:19:43
"U . S . Coast Guard announces $230 million contract for Base Charleston facilities , awarding over $440 million in recent infrastructure upgrades",https://www.globalsecurity.org/military/library/news/2026/07/mil-260710-uscg02.htm,Syria,English,20260711T134500Z,,globalsecurity.org,2026-07-11 14:19:43
Power sector to be India biggest AI opportunity : Report,http://www.calcuttanews.net/news/279180771/power-sector-to-be-india-biggest-ai-opportunity-report,India,English,20260711T134500Z,,calcuttanews.net,2026-07-11 14:19:43
苹果阔折叠iPhone Ultra电池入网 4883mAh容量 9月或与iPhone 18 Pro同台发布 - 手机快报 - ITBear科技资讯,https://www.itbear.com.cn/html/2026-07/1440349.html,China,Chinese,20260711T134500Z,,itbear.com.cn,2026-07-11 14:19:43
La Unión Europea tiene un plan para dejar de depender de la tecnología de Estados Unidos : los expertos no lo tienen tan claro,https://www.superdeporte.es/fuera-de-juego/tecnologia/2026/07/11/union-europea-plan-dependencia-tecnologia-estados-unidos-trump-ia-nube-amazon-microsoft-google-soberania-digital-132357363.html,Spain,Spanish,20260711T134500Z,,superdeporte.es,2026-07-11 14:19:43
Will these sons of St . Petersburg get to redevelop Tropicana Field ? ,https://www.yahoo.com/news/politics/articles/sons-st-petersburg-redevelop-tropicana-130000150.html,United States,English,20260711T134500Z,,yahoo.com,2026-07-11 14:19:43
