title,url,source_country,language,published_date,tone,domain,collected_at
سولر جنریشن کی تیزی سے توسیع کی وجہ سے بجلی کا شعبہ بنیادی تبدیلی سے گزر رہا ہے ، وزیر توانائی,https://www.express.pk/story/2821636/the-electricity-sector-is-undergoing-a-fundamental-transformation-due-to-the-rapid-expansion-of-solar-generation-says-the-energy-minister-2821636,Pakistan,Urdu,20260711T134500Z,,express.pk,2026-07-11 14:19:43
公园底下藏着  水质净化地下心脏  国内首个全地下式5G智慧水厂什么样 ？ ,https://baijiahao.baidu.com/s?id=1870334000306825537,China,Chinese,20260711T134500Z,,baijiahao.baidu.com,2026-07-11 14:19:43
Chinese medical team provides specialized nursing skills training in Sierra Leone - Xinhua,https://english.news.cn/20260711/e614c69ce06e494fa7eea7b5c1dd3f41/c.html,,English,20260711T134500Z,,english.news.cn,2026-07-11 14:19:43
Anadolu : Inteligenţa artificială sporeşte eficienţa atacurilor cibernetice,https://www.bursa.ro/anadolu-inteligenta-artificiala-sporeste-eficienta-atacurilor-cibernetice-28455956,Romania,Romanian,20260711T134500Z,,bursa.ro,2026-07-11 14:19:43
CM Maryam Nawaz  Mera Pyara Virtual Center  crowned global E - Governance Champion at WSIS,https://en.dailypakistan.com.pk/11-Jul-2026/cm-maryam-nawazs-mera-pyara-virtual-center-crowned-global-e-governance-champion-at-wsis,Pakistan,English,20260711T134500Z,,en.dailypakistan.com.pk,2026-07-11 14:19:43
共建共融共生长 2026年房地产代建高质量发展大会在海南召开,https://www.163.com/dy/article/L1J9MO5G05198ETO.html,China,Chinese,20260711T134500Z,,163.com,2026-07-11 14:19:43
"  PM Modi , let me say on behalf of 5 million New Zealanders , you are worth the wait : Christopher Luxon",http://www.bruneinews.net/news/279180735/pm-modi-let-me-say-on-behalf-of-5-million-new-zealanders-you-are-worth-the-wait-christopher-luxon,Malaysia,English,20260711T134500Z,,bruneinews.net,2026-07-11 14:19:43
Bakan Işıkhan : İyi Yetişmiş Gençler G Olacak,https://www.haberaktuel.com/bakan-isikhan-iyi-yetismis-gencler-guc-olacak-3461287,Turkey,Turkish,20260711T134500Z,,haberaktuel.com,2026-07-11 14:19:43
Hava savunma mimarisini baştan yazacak silah için 870 milyon harcandı,https://www.sozcu.com.tr/hava-savunma-mimarisini-bastan-yazacak-silah-icin-870-milyon-harcandi-p335629,Turkey,Turkish,20260711T134500Z,,sozcu.com.tr,2026-07-11 14:19:43
ЗИС - 101А : как комсомольцы создали советский суперкар / Авто и транспорт / iXBT Live,https://www.ixbt.com/live/car/zis-101a-kak-komsomolcy-sozdali-sovetskiy-superkar.html,China,Russian,20260711T134500Z,,ixbt.com,2026-07-11 14:19:43
"TCS Q1 FY27 Results : AI Revenue Hits $2 . 6 bn Run Rate as Revenue Reaches ₹72 , 275 Crore and Order Book Touches $9 . 5 bn",https://infotechlead.com/software/tcs-q1-fy27-results-ai-revenue-hits-2-6-bn-run-rate-as-revenue-reaches-%E2%82%B972275-crore-and-order-book-touches-9-5-bn-97070,India,English,20260711T134500Z,,infotechlead.com,2026-07-11 14:19:43
习近平总书记重要讲话激励广大科技工作者勇担使命,https://news.ycwb.com/ikimvkltjj/content_54224498.htm,China,Chinese,20260711T134500Z,,news.ycwb.com,2026-07-11 14:19:43
Unicredit - Commerzbank : la partita del risiko tra campioni europei e difesa degli interessi nazionali,https://www.key4biz.it/unicredit-commerzbank-la-partita-del-risiko-tra-campioni-europei-e-difesa-degli-interessi-nazionali/580179/,Italy,Italian,20260711T134500Z,,key4biz.it,2026-07-11 14:19:43
HDFC Bank MD : Chakraborty abrupt exit a  challenging event  that raised governance questions,https://economictimes.indiatimes.com/industry/banking/finance/banking/hdfc-bank-md-chakrabortys-abrupt-exit-a-challenging-event-that-raised-governance-questions/articleshow/132331320.cms,India,English,20260711T134500Z,,economictimes.indiatimes.com,2026-07-11 14:19:43
India stands as primary guarantor of peace & stability in Indian Ocean Region : Raksha Mantri lauds Indian Navy for safeguarding maritime interests,https://www.globalsecurity.org/wmd/library/news/india/2026/india-260710-india-pib01.htm,Syria,English,20260711T134500Z,,globalsecurity.org,2026-07-11 14:19:43
Should you open windows in a heatwave ? Experts all say the same thing,https://www.walesonline.co.uk/whats-on/whats-on-news/should-you-open-windows-heatwave-34275801,United Kingdom,English,20260711T134500Z,,walesonline.co.uk,2026-07-11 14:19:43
聚焦规模化商业落地前景 ， 广州开发区强化机器人产业集聚,https://www.163.com/dy/article/L1J9FBRG0519DDQ2.html,China,Chinese,20260711T134500Z,,163.com,2026-07-11 14:19:43
"Побывали в БГТУ , где готовят кадры для лесного хозяйства , и узнали , как идет вступительная кампания",https://www.sb.by/articles/mechta-a-ne-rabota.html,Belarus,Russian,20260711T134500Z,,sb.by,2026-07-11 14:19:43
Hackathon AESH 2026 : l  équipe tunisienne « Les Talelas » de lINSAT qualifiée pour la finale mondiale,https://directinfo.webmanagercenter.com/2026/07/10/hackathon-aesh-2026-lequipe-tunisienne-les-talelas-de-linsat-qualifiee-pour-la-finale-mondiale/,Tunisia,French,20260711T134500Z,,directinfo.webmanagercenter.com,2026-07-11 14:19:43
"Burundi , Russia agree to support African - led peace initiatives - Xinhua",https://english.news.cn/europe/20260711/d771957a79b2405881350856079d5162/c.html,,English,20260711T134500Z,,english.news.cn,2026-07-11 14:19:43
Nagpur to get country largest Agro Convention Centre : CM Fadnavis,https://www.nagpurtoday.in/nagpur-agro-convention-centre/,India,English,20260711T134500Z,,nagpurtoday.in,2026-07-11 14:19:43
Joint media statement - Melbourne,https://www.globalsecurity.org/wmd/library/news/australia/2026/australia-260710-australia-pm01.htm,Syria,English,20260711T134500Z,,globalsecurity.org,2026-07-11 14:19:43
Shy on the dance floor ? Virtual reality  partner aim to help you find your groove,https://www.wuft.org/2026-07-11/shy-on-the-dance-floor-virtual-reality-partners-aim-to-help-you-find-your-groove,United States,English,20260711T134500Z,,wuft.org,2026-07-11 14:19:43
La IA eligió acciones argentinas para invertir y un bróker de la City le toma examen,https://www.iprofesional.com/finanzas/459728-la-ia-eligio-acciones-argentinas-para-invertir-y-un-broker-de-la-city-le-toma-examen,Argentina,Spanish,20260711T134500Z,,iprofesional.com,2026-07-11 14:19:43
Китай создал « черный ящик » для ядерных космолетов,https://www.ixbt.com/news/2026/07/11/kitaj-sozdal-chernyj-jashik-dlja-jadernyh-kosmoletov.html,China,Russian,20260711T134500Z,,ixbt.com,2026-07-11 14:19:43
"  PM Modi , let me say on behalf of 5 million New Zealanders , you are worth the wait : Christopher Luxon",http://www.londonmercury.com/news/279180735/pm-modi-let-me-say-on-behalf-of-5-million-new-zealanders-you-are-worth-the-wait-christopher-luxon,United Kingdom,English,20260711T134500Z,,londonmercury.com,2026-07-11 14:19:43
 ¿ Son todos los dispositivos digitales igual de adictivos ? Esto dice un análisis,https://www.eltiempo.com/tecnosfera/son-todos-los-dispositivos-digitales-igual-de-adictivos-esto-dice-un-analisis-3570586,Colombia,Spanish,20260711T134500Z,,eltiempo.com,2026-07-11 14:19:43
AIをもっと身近に 。 生成AIと人の創造力で 、 中小企業の未来を支える 。 ,http://373news.com/lifestyle/info/pr_times/detail/Ba0d3DCmRvb/,Japan,Japanese,20260711T134500Z,,373news.com,2026-07-11 14:19:43
"3D Printing News Briefs , July 11 , 2026 : Fundraiser , Strategic Guide , Dentures , & More - 3DPrint . com",https://3dprint.com/328628/3d-printing-news-briefs-7-11-2026/,United States,English,20260711T134500Z,,3dprint.com,2026-07-11 14:19:43
"Pirelli P Zero al Goodwood Festival of Speed 2026 : Ferrari Luce , Pagani Cyber Tyre e oltre 300 omologazioni",https://www.motorionline.com/pirelli-p-zero-al-goodwood-festival-of-speed-2026-ferrari-luce-pagani-cyber-tyre-e-oltre-300-omologazioni/,Italy,Italian,20260711T134500Z,,motorionline.com,2026-07-11 14:19:43
"Discours de Jean - Noël Barrot , ministre de lEurope et des Affaires étrangères , lors de la conférence des ambassadrices et ambassadeurs polonais",https://www.globalsecurity.org/wmd/library/news/france/2026/france-260710-france-meae01.htm,Syria,English,20260711T134500Z,,globalsecurity.org,2026-07-11 14:19:43
HYDIS Programme Reaches Final Concept Review Milestone as Nations Validate Lead Interceptor Design,https://www.globalsecurity.org/military/library/news/2026/07/mil-260710-occar01.htm,Syria,English,20260711T134500Z,,globalsecurity.org,2026-07-11 14:19:43
Horizon : Oceans of the Solar System,https://www.tvguide.co.uk/schedule/e14d58bc-00d1-58ab-ae27-9c5264da914d/horizon-oceans-of-the-solar-system,United Kingdom,English,20260711T134500Z,,tvguide.co.uk,2026-07-11 14:19:43
"PM Modi , Luxon agree to deepen cooperation , double trade by 2030 as India - New Zealand ties get strategic push",http://www.calcuttanews.net/news/279180760/pm-modi-luxon-agree-to-deepen-cooperation-double-trade-by-2030-as-india-new-zealand-ties-get-strategic-push,India,English,20260711T134500Z,,calcuttanews.net,2026-07-11 14:19:43
Joint Statement Between the People Republic of China and the Republic of Namibia on Building a China - Namibia Community with a Shared Future for the New Era,https://www.globalsecurity.org/wmd/library/news/china/2026/07/china-260710-prc-mofa03.htm,Syria,English,20260711T134500Z,,globalsecurity.org,2026-07-11 14:19:43
La processione digitale tra le strade del Cilento,https://www.ilmattino.it/salerno/processione_digitale_strade_cilento-9645347.html,Italy,Italian,20260711T134500Z,,ilmattino.it,2026-07-11 14:19:43
Sonalika Marks 30 - Year Milestone with 20 Lakh Tractor Production at Hoshiarpur Manufacturing Plant,http://www.calcuttanews.net/news/279180743/sonalika-marks-30-year-milestone-with-20-lakh-tractor-production-at-hoshiarpur-manufacturing-plant,India,English,20260711T134500Z,,calcuttanews.net,2026-07-11 14:19:43
苹果状告OpenAI细节曝光,https://www.163.com/dy/article/L1J95JUE0514R9KQ.html,China,Chinese,20260711T134500Z,,163.com,2026-07-11 14:19:43
"Cần xây dựng tốt quy hoạch địa phương để tạo nguồn lực , dư địa phát triển",https://baocantho.com.vn/can-xay-dung-tot-quy-hoach-dia-phuong-de-tao-nguon-luc-du-dia-phat-trien-a209437.html,Vietnam,Vietnamese,20260711T134500Z,,baocantho.com.vn,2026-07-11 14:19:43
AFRIMA : le Maroc peut devenir un hub majeur de la musique africaine,https://lematin.ma/culture/le-maroc-dispose-du-leadership-pour-devenir-un-hub-de-la-musique-africaine/355282,Morocco,French,20260711T134500Z,,lematin.ma,2026-07-11 14:19:43
Top 5 Podcasts in India Redefining Long - Form Conversations and Thought Leadership,http://www.asiabulletin.com/news/279180783/top-5-podcasts-in-india-redefining-long-form-conversations-and-thought-leadership,China,English,20260711T134500Z,,asiabulletin.com,2026-07-11 14:19:43
The President and the Chairman Emeritus of the U . S . House Committee on Foreign Affairs Discussed NATO Summit Outcomes and Cooperation with the United States,https://www.globalsecurity.org/wmd/library/news/ukraine/2026/07/ukraine-260710-ukraine-president01.htm,Syria,English,20260711T134500Z,,globalsecurity.org,2026-07-11 14:19:43
EU skyndar på elektrifieringen av Europa :  Går för långsamt  ,https://www.realtid.se/samhalle/hallbarhet/eu-skyndar-pa-elektrifieringen-av-europa-gar-for-langsamt/,Sweden,Swedish,20260711T134500Z,,realtid.se,2026-07-11 14:19:43
"Не литий , а натрий : ESS представила систему хранения энергии с ресурсом до 20 лет",https://www.ixbt.com/news/2026/07/11/ne-litij-a-natrij-ess-predstavila-sistemu-hranenija-jenergii-s-resursom-do-20-let.html,China,Russian,20260711T134500Z,,ixbt.com,2026-07-11 14:19:43
員林智慧鞋墊客製化 》 廣薪實業 如何協助品牌完成鞋墊客製開發與量產 ？ - t62et73352065 的部落格,https://blog.udn.com:443/t62et73352065/191323678,Taiwan,Chinese,20260711T134500Z,,blog.udn.com,2026-07-11 14:19:43
Chat Control sì del Parlamento Ue tra le polemiche | Introdotta la sorveglianza di massa,https://www.zazoom.it/2026-07-11/chat-control-si-del-parlamento-ue-tra-le-polemiche-introdotta-la-sorveglianza-di-massa/19449831/,Italy,Italian,20260711T133000Z,,zazoom.it,2026-07-11 14:19:43
在文物中感受中美民间友好温度 （ 环球热点 ） ,https://world.qianlong.com/2026/0711/8696156.shtml,China,Chinese,20260711T133000Z,,world.qianlong.com,2026-07-11 14:19:43
Kat Timpf And The Evolution Of Modern Swimwear Design,https://www.unitaid.eu/kat-timpf-bikini-x3fg.html,,English,20260711T133000Z,,unitaid.eu,2026-07-11 14:19:43
Yahoo Horoscopes : Your Daily Guide To Celestial Insights And Personal Growth,https://www.unitaid.eu/yahoo-horoscopes-8hjr.html,,English,20260711T133000Z,,unitaid.eu,2026-07-11 14:19:43
Υπόθεση Marfin : Επιστρέφει στην Ελλάδα η 46χρονη – Δηλώνει αθώα και θέλει να καταθέσει στις Αρχές,https://www.skaikritis.gr/ypothesi-marfin-epistrefei-stin-ellada-i-46chroni-dilonei-athoa-kai-thelei-na-katathesei-stis-arches/,Greece,Greek,20260711T133000Z,,skaikritis.gr,2026-07-11 14:19:43
Como espelhar o celular na TV Philips ? Veja como conectar Android e iOS,https://www.techtudo.com.br/guia/2026/07/como-espelhar-o-celular-na-tv-philips-veja-como-conectar-android-e-ios-edinfoeletro.ghtml,Brazil,Portuguese,20260711T133000Z,,techtudo.com.br,2026-07-11 14:19:43
"I Lived With My Parents for 6 Years As an Adult . Now , Were Neighbors . ",https://www.businessinsider.com/lived-with-parents-adult-now-neighbors-benefits-2026-7,United States,English,20260711T133000Z,,businessinsider.com,2026-07-11 14:19:43
Sabotageverdacht nach Brand – wichtige Bahnstrecke in NRW bleibt gesperrt,https://www.sueddeutsche.de/panorama/koeln-duesseldorf-bahn-brand-sperrung-sabotage-li.3514299,Germany,German,20260711T133000Z,,sueddeutsche.de,2026-07-11 14:19:43
AI as a Service India : Transforming Technology Landscape - Pragativadi I Latest Odisha News in English I Breaking News,https://pragativadi.com/hyderabad-poised-as-ai-and-semiconductor-hub-as-india-eyes-viksit-bharat-2047/,India,English,20260711T160000Z,,pragativadi.com,2026-07-11 16:43:31
Promete director del IMSS más crecimiento,https://diario.mx/juarez/2026/jul/11/promete-director-del-imss-mas-crecimiento-1127282.html,Mexico,Spanish,20260711T160000Z,,diario.mx,2026-07-11 16:43:31
Bir dönem temizliğin vazgeçilmeziydi . Şimdi sadece 70 usta kaldı,https://www.ntv.com.tr/yerel-haberler/galeri-bir-donem-temizligin-vazgecilmeziydi-simdi-sadece-70-usta-kaldi-1732422,Turkey,Turkish,20260711T160000Z,,ntv.com.tr,2026-07-11 16:43:31
Яка вживана Mazda CX - 5 : огляд усіх поколінь та двигунів,https://24tv.ua/auto/yake_pokolinnia_mazda_cx_5_ye_naikrashchym_vyborom_na_vtorynnomu_rynku_ohliad_perevahy_ta_problemy_n73885,Ukraine,Ukrainian,20260711T160000Z,,24tv.ua,2026-07-11 16:43:31
港珠澳45分钟生活圈成型 ！ 南湾通勤优选揭榜 ， 这个盘为何成港澳客心头好 ？ ,https://www.163.com/dy/article/L1JGTF310552NVEU.html,China,Chinese,20260711T160000Z,,163.com,2026-07-11 16:43:31
Gary Bermúdez critica la imagen de México tras el Mundial 2026,https://www.excelsior.com.mx/nacional/gary-bermudez-mundial-mediocridad,Mexico,Spanish,20260711T160000Z,,excelsior.com.mx,2026-07-11 16:43:31
The Gulf : The Age of Self - Reliance,https://english.aawsat.com/opinion/5294777-gulf-age-self-reliance,Syria,English,20260711T160000Z,,english.aawsat.com,2026-07-11 16:43:31
"  PM Modi , let me say on behalf of 5 million New Zealanders , you are worth the wait : Christopher Luxon",http://www.afghanistannews.net/news/279180735/pm-modi-let-me-say-on-behalf-of-5-million-new-zealanders-you-are-worth-the-wait-christopher-luxon,Afghanistan,English,20260711T160000Z,,afghanistannews.net,2026-07-11 16:43:31
  房子  也能出口 ！ 中国  预制房  为何如此吃香 ？ ,https://baijiahao.baidu.com/s?id=1870428086233043871,China,Chinese,20260711T160000Z,,baijiahao.baidu.com,2026-07-11 16:43:31
Teleperformance ( OTCMKTS : TLPFY ) Shares Gap Down – Here What Happened,https://www.themarketsdaily.com/2026/07/11/teleperformance-otcmktstlpfy-shares-gap-down-heres-what-happened.html,United States,English,20260711T160000Z,,themarketsdaily.com,2026-07-11 16:43:31
Балістика рф долітає за 60 секунд : чому тривога запізнюється,https://week.ukrainianwall.com/166761-balistika-rf-dolitaye-za-60-sekund-puski-ne-fiksuyut-kovalenko,Ukraine,Ukrainian,20260711T160000Z,,week.ukrainianwall.com,2026-07-11 16:43:31
Un retraso regulatorio permite probar gratis el nuevo robotaxi de Waymo en California,https://es.gizmodo.com/un-retraso-regulatorio-permite-probar-gratis-el-nuevo-robotaxi-de-waymo-en-california-2000245754,United States,Spanish,20260711T160000Z,,es.gizmodo.com,2026-07-11 16:43:31
"Đà Nẵng : Đón  cú hích  hạ tầng , trường đại học mở ngành đường sắt tốc độ cao",https://thanhnien.vn/da-nang-don-cu-hich-ha-tang-truong-dai-hoc-mo-nganh-duong-sat-toc-do-cao-185260711214435554.htm,Vietnam,Vietnamese,20260711T160000Z,,thanhnien.vn,2026-07-11 16:43:31
"Y sí sí , nos apoyamos más en la tecnología para el ambiente",https://www.eldiariodechihuahua.mx/opinion/2026/jul/10/y-si-si-nos-apoyamos-mas-en-la-tecnologia-para-el-ambiente-816492.html,Mexico,Spanish,20260711T160000Z,,eldiariodechihuahua.mx,2026-07-11 16:43:31
Exploring The Services Of Placentia Library District Central Library : A Community Hub For Learning And Growth,https://www.unitaid.eu/services-offered-placentia-library-district-291k.html,,English,20260711T160000Z,,unitaid.eu,2026-07-11 16:43:31
Exploring The Vibrant Culture And Community Of Scottsdale Alive,https://www.unitaid.eu/scottdale-alive-0t5z.html,,English,20260711T160000Z,,unitaid.eu,2026-07-11 16:43:31
Creators Summit – SIBA 2026 Puts Gujarat Digital Creators in the Spotlight,https://www.newsx.com/nx-news/creators-summit-siba-2026-puts-gujarats-digital-creators-in-the-spotlight-247315/,India,English,20260711T160000Z,,newsx.com,2026-07-11 16:43:31
"Biz - Insights IT Solutions and Femtech Cosme Tokyo Forge Strategic AI , IT & Women Healthcare Alliance",https://www.newsx.com/nx-news/biz-insights-it-solutions-and-femtech-cosme-tokyo-forge-strategic-ai-it-womens-healthcare-alliance-247352/,India,English,20260711T160000Z,,newsx.com,2026-07-11 16:43:31
Llevarán Destilichadero a 6 colonias,https://www.eldiariodechihuahua.mx/local/2026/jul/11/llevaran-destilichadero-a-6-colonias-816544.html,Mexico,Spanish,20260711T160000Z,,eldiariodechihuahua.mx,2026-07-11 16:43:31
Coast 4C raises $2 . 5M to expand seaweed farming network across Southeast Asia,https://www.manilatimes.net/2026/07/11/business/science-technology/coast-4c-raises-25m-to-expand-seaweed-farming-network-across-southeast-asia/2382497,Philippines,English,20260711T160000Z,,manilatimes.net,2026-07-11 16:43:31
"  PM Modi , let me say on behalf of 5 million New Zealanders , you are worth the wait : Christopher Luxon",http://www.indiagazette.com/news/279180735/pm-modi-let-me-say-on-behalf-of-5-million-new-zealanders-you-are-worth-the-wait-christopher-luxon,India,English,20260711T160000Z,,indiagazette.com,2026-07-11 16:43:31
"Whittier Trust Co . of Nevada Inc . Buys 7 , 780 Shares of Meta Platforms , Inc . $META",https://www.themarketsdaily.com/2026/07/11/whittier-trust-co-of-nevada-inc-buys-7780-shares-of-meta-platforms-inc-meta.html,United States,English,20260711T160000Z,,themarketsdaily.com,2026-07-11 16:43:31
"Panamá crea una comisión para impulsar la IA , los chips y la computación cuántica",https://es.gizmodo.com/panama-crea-una-comision-para-impulsar-la-ia-los-chips-y-la-computacion-cuantica-2000245777,United States,Spanish,20260711T160000Z,,es.gizmodo.com,2026-07-11 16:43:31
"China expands early pregnancy care , empowers youth",http://www.mexicostar.com/news/279180902/china-expands-early-pregnancy-care-empowers-youth,Mexico,English,20260711T160000Z,,mexicostar.com,2026-07-11 16:43:31
Novo Nordisk går ind i kapløb om GLP - 1 - implantat mod vægtøgning,https://npinvestor.dk/nyheder/novo-nordisk-gaar-ind-i-kaploeb-om-glp-1-implantat-mod-vaegtoegning/,Denmark,Danish,20260711T160000Z,,npinvestor.dk,2026-07-11 16:43:31
  Liberen a Willy  regresa con los hermanos Russo tras 30 años,https://www.excelsior.com.mx/espectaculos/liberen-willy-regresa-con-hermanos-russo-tras-30-anos,Mexico,Spanish,20260711T160000Z,,excelsior.com.mx,2026-07-11 16:43:31
"Intelligenza artificiale , lONU lancia lallarme :  Ultima generazione per agire  ",https://www.tecnoandroid.it/news/intelligenza-artificiale-lonu-lancia-lallarme-ultima-generazione-per-agire-1927818/,Italy,Italian,20260711T160000Z,,tecnoandroid.it,2026-07-11 16:43:31
"Temblor en EE . UU . EN VIVO hoy , 11 y 12 de julio 2026 : hora exacta , magnitud y dónde fue el epicentro del último sismo | USGS California | Nueva York | MIX",https://gestion.pe/mix/usa/temblor-en-eeuu-en-vivo-hoy-11-y-12-de-julio-2026-hora-exacta-magnitud-y-donde-fue-el-epicentro-del-ultimo-sismo-usgs-california-nueva-york-nnda-nnrt-noticia/,Peru,Spanish,20260711T160000Z,,gestion.pe,2026-07-11 16:43:31
"Az Apple perre vitte az ügyet : azzal vádolja az OpenAI - t , hogy üzleti titkokat lopott tőle",https://hu.euronews.com/next/2026/07/11/mit-kell-tudni-az-apple-openai-ellen-inditott-uzleti-titokpererol,United States,Hungarian,20260711T160000Z,,hu.euronews.com,2026-07-11 16:43:31
"  PM Modi , let me say on behalf of 5 million New Zealanders , you are worth the wait : Christopher Luxon",http://www.mexicostar.com/news/279180735/pm-modi-let-me-say-on-behalf-of-5-million-new-zealanders-you-are-worth-the-wait-christopher-luxon,Mexico,English,20260711T160000Z,,mexicostar.com,2026-07-11 16:43:31
Music Industry Plans Labeling to Alert Fans of AI Use in Songs,https://z100missoula.com/ixp/295/p/music-industry-announces-labeling-system-to-alert-fans-of-ai-use-in-songs/,United States,English,20260711T160000Z,,z100missoula.com,2026-07-11 16:43:31
从  卖车  到建能源网络 ， 比亚迪英国市场的下一步 _ 凤凰网,https://tech.ifeng.com/c/8ugJuN65kQa,China,Chinese,20260711T160000Z,,tech.ifeng.com,2026-07-11 16:43:31
LAMMINISTRAZIONE TRUMP TAGLIA I SISTEMI PER LA SORVEGLIANZA DEGLI OCEANI,http://www.nogeoingegneria.com/uncategorized/lamministrazione-trump-taglia-i-sistemi-per-la-sorveglianza-degli-oceani/,,Italian,20260711T160000Z,,nogeoingegneria.com,2026-07-11 16:43:31
UPSC Weekly Current Affairs Quiz ( July 05 – July 11 ) ,https://indianexpress.com/article/upsc-current-affairs/upsc-essentials/upsc-weekly-current-affairs-quiz-july-05-july-11-prelims-2027-10782244/,India,English,20260711T160000Z,,indianexpress.com,2026-07-11 16:43:31
万博TOD顶流圈层揭秘 ： 谁在买入耀胜尊府 ？ 这两类人达成了  生活公约数  |广州|客群,https://www.163.com/dy/article/L1JHFP810552NVEU.html,China,Chinese,20260711T160000Z,,163.com,2026-07-11 16:43:31
"На Запорізькій області за добу 1011 ударів рф : загиблий , 30 поранені",https://mig.com.ua/na-zaporizkij-oblasti-za-dobu-1011-udariv-rf-ie-zahyblyj-ta-poraneni/,Ukraine,Ukrainian,20260711T160000Z,,mig.com.ua,2026-07-11 16:43:31
TSMC und ASML vor Zahlen : Hält der KI Boom sein Versprechen ? ,https://www.boersennews.de/nachrichten/artikel/boersennews/tsmc-und-asml-vor-zahlen-haelt-der-ki-boom-sein-versprechen/5206141/,Germany,German,20260711T160000Z,,boersennews.de,2026-07-11 16:43:31
Guerra e petrolio alle stelle non frenano le acquisizioni : in Italia 700 operazioni di m & a nel primo semestre 2026,https://www.milanofinanza.it/news/guerra-e-petrolio-alle-stelle-non-frenano-le-acquisizioni-in-italia-700-operazioni-di-m-a-nel-primo-semestre-202607101743152601,Italy,Italian,20260711T160000Z,,milanofinanza.it,2026-07-11 16:43:31
8 Nearly Perfect Alternate History TV Shows,https://screenrant.com/nearly-perfect-alternate-history-tv-shows/,United States,English,20260711T160000Z,,screenrant.com,2026-07-11 16:43:31
Beijing Olympics legacy still vibrant lasting asset,http://usa.chinadaily.com.cn/a/202607/11/WS6a521ce6a310986e2b464c7b.html,China,English,20260711T160000Z,,usa.chinadaily.com.cn,2026-07-11 16:43:31
নকলের সুযোগ না দেয়ায় এইচএসসি পরীক্ষা কেন্দ্রে হামলা,https://www.mzamin.com/article/27833,Bangladesh,Bengali,20260711T160000Z,,mzamin.com,2026-07-11 16:43:31
وزير الاتصالات : نعمل على صياغة نهج أفريقي للذكاء الاصطناعي المُوجه نحو التنمية,https://www.almasryalyoum.com/news/details/4312159,Egypt,Arabic,20260711T160000Z,,almasryalyoum.com,2026-07-11 16:43:31
"Οι Βig Tech χρηματοδοτούν την Τεχνητή Νοημοσύνη , οι εταιρείες τσιπ ... κερδίζουν",https://www.in.gr/2026/07/11/in-science/ai/oi-vig-tech-xrimatodotoun-tin-texniti-noimosyni-oi-etaireies-tsip-kerdizoun/,Greece,Greek,20260711T160000Z,,in.gr,2026-07-11 16:43:31
Brave1 : гранти до €33 000 на компоненти для дронів 20 команд,https://week.ukrainianwall.com/166764-do-33-000-na-komponenti-dlya-droniv-brave1-i-brdo-shukayut-20-komand-virobnikiv,Ukraine,Ukrainian,20260711T160000Z,,week.ukrainianwall.com,2026-07-11 16:43:31
"Eljött a vezetékes fül - és fejhallgatók reneszánsza , még két lépés , és újra divat lesz a gramofon is",https://nepszava.hu/3328699_zenehallgatas-ful-es-fejhallgato-divat-reneszansz-gramofon,Hungary,Hungarian,20260711T160000Z,,nepszava.hu,2026-07-11 16:43:31
