title,url,source_country,language,published_date,tone,domain,collected_at
"TomTom ( OTCMKTS : TMOAY ) Short Interest Up 729 , 900 . 0 % in June",https://www.themarketsdaily.com/2026/07/11/tomtom-otcmktstmoay-short-interest-up-729900-0-in-june.html,United States,English,20260711T160000Z,,themarketsdaily.com,2026-07-11 16:43:31
La agricultura suma una nueva alarma : plantas que brillan en verde cuando detectan un virus,https://es.gizmodo.com/la-agricultura-suma-una-nueva-alarma-plantas-que-brillan-en-verde-cuando-detectan-un-virus-2000245750,United States,Spanish,20260711T160000Z,,es.gizmodo.com,2026-07-11 16:43:31
华南理工大学学子李响首秀海南  村VA  解锁九人制排球新体验 - 南海网,https://www.hinews.cn/page?n=2835543&m=1&s=1044,China,Chinese,20260711T160000Z,,hinews.cn,2026-07-11 16:43:31
Creador de Ethereum expone los 2 posibles escenarios ante el avance de la IA,https://actualidad.rt.com/actualidad/616105-creador-ethereum-exponer-posibles-escenarios,Russia,Spanish,20260711T160000Z,,actualidad.rt.com,2026-07-11 16:43:31
"Từ chỉ đạo của Tổng Bí thư , Chủ tịch nước Tô Lâm : Trao việc khó , khơi dậy khát vọng cống hiến của thanh niên ( bài 1 ) ",https://danviet.vn/xay-dung-the-he-thanh-nien-hoc-tap-suot-doi-trao-viec-kho-khoi-day-khat-vong-cong-hien-cua-thanh-nien-bai-1-d1441927.html,Vietnam,Vietnamese,20260711T160000Z,,danviet.vn,2026-07-11 16:43:31
OpenAI sikkerhedschef stopper midt i stor omorganisering - NPinvestor x Netposten,https://npinvestor.dk/nyheder/openais-sikkerhedschef-stopper-midt-i-stor-omorganisering/,Denmark,Danish,20260711T160000Z,,npinvestor.dk,2026-07-11 16:43:31
七天走遍海南六城 ！ 马新社镜头定格封关半年开放新图景 - 南海网,https://www.hinews.cn/page?n=2835534&m=1&s=1044,China,Chinese,20260711T160000Z,,hinews.cn,2026-07-11 16:43:31
"Founder - led branding builds stronger consumer trust , says Country Club CMD Y . Rajeev Reddy",https://www.newsx.com/bl-news/founder-led-branding-builds-stronger-consumer-trust-says-country-club-cmd-y-rajeev-reddy-247410/,India,English,20260711T160000Z,,newsx.com,2026-07-11 16:43:31
"Panamá se posiciona como el segundo país de la región en la lucha contra el comercio ilegal , según índice global • Periódico Digital Centroamericano y del Caribe",https://newsinamerica.com/pdcc/boletin/2026/panama-se-posiciona-como-el-segundo-pais-de-la-region-en-la-lucha-contra-el-comercio-ilegal-segun-indice-global/,Guatemala,Spanish,20260711T160000Z,,newsinamerica.com,2026-07-11 16:43:31
La IA entra en la era de la eficiencia y Wall Street mira más allá de los grandes modelos,https://www.lacapitalmdp.com/la-ia-entra-en-la-era-de-la-eficiencia-y-wall-street-mira-mas-alla-de-los-grandes-modelos/,Argentina,Spanish,20260711T160000Z,,lacapitalmdp.com,2026-07-11 16:43:31
 « رجال أعمال إسكندرية » تبحث تطوير منظومة التجارة الخارجية وتعزيز تنافسية الاقتصاد المصري,https://www.almasryalyoum.com/news/details/4311722,Egypt,Arabic,20260711T160000Z,,almasryalyoum.com,2026-07-11 16:43:31
Ant vientisos drobės nutapytas didžiausias šalyje daugiasluoksnės aliejinės tapybos paveikslas,https://www.respublika.lt/lt/naujienos/lietuva/kitos-lietuvos-zinios/ant-vientisos-drobes-nutapytas-didziausias-salyje-daugiasluoksnes-aliejines-tapybos-paveikslas/,Lithuania,Lithuanian,20260711T160000Z,,respublika.lt,2026-07-11 16:43:31
China publicó en una revista científica militar el diseño de un arma de microondas de 100 gigavatios capaz de freír la electrónica de los satélites Starlink sin destruirlos,https://es.gizmodo.com/china-publico-en-una-revista-cientifica-militar-el-diseno-de-un-arma-de-microondas-de-100-gigavatios-capaz-de-freir-la-electronica-de-los-satelites-starlink-sin-destruirlos-2000245732,United States,Spanish,20260711T160000Z,,es.gizmodo.com,2026-07-11 16:43:31
"এআই , টেকসই উন্নয়ন ও প্রতিযোগিতা সক্ষমতা নিয়ে সম্মেলন করছে বায়লা",https://www.mzamin.com/article/27755,Bangladesh,Bengali,20260711T160000Z,,mzamin.com,2026-07-11 16:43:31
EL DÍA - Noticias de Bolivia para el mundo,https://www.eldia.com.bo/2026-07-11/editorial/morir-antes-que-privatizar.html,Bolivia,Spanish,20260711T160000Z,,eldia.com.bo,2026-07-11 16:43:31
So your boss is AI - pilled,https://www.nbcnews.com/tech/tech-news/boss-ai-pilled-rcna353554,United States,English,20260711T160000Z,,nbcnews.com,2026-07-11 16:43:31
习近平总书记重要讲话激励广大科技工作者勇担使命 - 南海网,https://www.hinews.cn/page?n=2835529&m=1&s=1044,China,Chinese,20260711T160000Z,,hinews.cn,2026-07-11 16:43:31
九组主理人走上秀场 海南  村VA  刮起星月菩提风 - 南海网,https://www.hinews.cn/page?n=2835542&m=1&s=1044,China,Chinese,20260711T160000Z,,hinews.cn,2026-07-11 16:43:31
Lisandro Martinez :  Trọng tài đã làm công việc xuất sắc tại World Cup 2026,https://danviet.vn/lisandro-martinez-trong-tai-da-lam-cong-viec-xuat-sac-tai-world-cup-2026-d1442581.html,Vietnam,Vietnamese,20260711T160000Z,,danviet.vn,2026-07-11 16:43:31
Розслідування по  Скелі : військового відправили під арешт за побиття капелана та підполковника,https://unn.ua/news/rozsliduvannia-po-skeli-sud-vidpravyv-pid-aresht-viiskovoho-za-pobyttia-kapelana-ta-pidpolkovnyka,,Ukrainian,20260711T160000Z,,unn.ua,2026-07-11 16:43:31
"Interview : Africa should empower private sector in EV development , Chinese auto executive says - Xinhua",https://english.news.cn/20260711/bf58e0720ceb44a4873f42b029fd1756/c.html,,English,20260711T160000Z,,english.news.cn,2026-07-11 16:43:31
マット ・ デイモン 、 トム ・ ホランド 、 アン ・ ハサウェイら集結 ノーラン最新作 『 オデュッセイア 』 ワールドプレミア開催 IMAX上映も決定｜ORICON NEWS｜Web東奥,https://www.toonippo.co.jp/articles/-/2315437,Japan,Japanese,20260711T160000Z,,toonippo.co.jp,2026-07-11 16:43:31
New Hobby Helps Huey Lewis Deal With the End of His Music Career,https://z100missoula.com/ixp/295/p/huey-lewis-end-of-music-career/,United States,English,20260711T160000Z,,z100missoula.com,2026-07-11 16:43:31
Las peores películas en la historia del cine - Periodismo . com,https://www.periodismo.com/2026/07/11/las-peores-peliculas-en-la-historia-del-cine-4/,Argentina,Spanish,20260711T160000Z,,periodismo.com,2026-07-11 16:43:31
Promete director del IMSS mayor crecimiento,https://www.eldiariodechihuahua.mx/estado/2026/jul/11/promete-director-del-imss-mayor-crecimiento-816527.html,Mexico,Spanish,20260711T160000Z,,eldiariodechihuahua.mx,2026-07-11 16:43:31
Bakan Işıkhan :  Mardine 560 milyon liralık çocuk ve gençlik merkezi kuruluyor  | Mersin Haber,https://www.mersinhaber.com/haber-bakan-isikhan-mardine-560-milyon-liralik-cocuk-ve-genclik-merkezi-kuruluyor/700553,Turkey,Turkish,20260711T160000Z,,mersinhaber.com,2026-07-11 16:43:31
Profesorul Florin Bîrsășteanu a lansat cu succes la Reșița o campanie inedită de prevenție : CT pulmonar la prețul unui pachet de țigări ! » Radio România Reșița,https://www.radioresita.ro/actualitate/profesorul-florin-birsasteanu-a-lansat-cu-succes-la-resita-o-campanie-inedita-de-preventie-ct-pulmonar-la-pretul-unui-pachet-de-tigari,Romania,Romanian,20260711T160000Z,,radioresita.ro,2026-07-11 16:43:31
La inteligencia artificial no necesita controlar tu mente para decidir por ti . La comodidad de los algoritmos está cambiando silenciosamente cómo pensamos y elegimos,https://es.gizmodo.com/no-diste-cuenta-pero-inteligencia-artificial-esta-pensando-por-vos-2000158400,United States,Spanish,20260711T160000Z,,es.gizmodo.com,2026-07-11 16:43:31
Skaitmeninius antrininkus kūręs Jurčys : viskas gali pajudėti į serialo „ Black Mirror  pusę,https://www.lrt.lt/lituanica/istorijos/752/2968426/skaitmeninius-antrininkus-kures-jurcys-viskas-gali-pajudeti-i-serialo-black-mirror-puse,Lithuania,Lithuanian,20260711T160000Z,,lrt.lt,2026-07-11 16:43:31
Chorvatský premiér otevřeně : Náš cestovní ruch naplnil kapacity ! Zmínil i vývoj cen,https://www.blesk.cz/clanek/zpravy-svet/843688/chorvatsky-premier-otevrene-nas-cestovni-ruch-naplnil-kapacity-zminil-i-vyvoj-cen.html,Czech Republic,Czech,20260711T160000Z,,blesk.cz,2026-07-11 16:43:31
iCAR V25申报信息曝光 搭载增程式动力系统,https://auto.sina.com.cn/newcar/2026-07-10/detail-inihinfw3821505.shtml?oaid=00117,China,Chinese,20260711T160000Z,,auto.sina.com.cn,2026-07-11 16:43:31
وزير المالية لـ فريق « الكول سنتر » بالضرائب : « تلطفوا مع المستثمرين والمواطنين .. إحنا شغالين عندهم » ,https://www.almasryalyoum.com/news/details/4312808,Egypt,Arabic,20260711T160000Z,,almasryalyoum.com,2026-07-11 16:43:31
"PHEV : मर्सिडीज की नई प्लग इन हाइब्रिड सेडान 23 जुलाई को होगी लॉन्च , जानें लग्जरी फीचर",https://www.haribhoomi.com/automobile/news/mercedesamg-e53-phev-india-launch-on-23-july-updates-103851,India,Hindi,20260711T160000Z,,haribhoomi.com,2026-07-11 16:43:31
Government Meetings 7 - 11 - 26,http://www.wyomingnews.com/news/government_meetings_listing/government-meetings-7-11-26/article_9f84ca7e-25bc-4c5d-8311-86ed4467797f.html,United States,English,20260711T160000Z,,wyomingnews.com,2026-07-11 16:43:31
Abelardo De La Espriella designó a Indalecio Dangond Baquero como ministro de Agricultura,https://www.semana.com/politica/articulo/abelardo-de-la-espriella-designo-a-indalecio-dangond-baquero-como-ministro-de-agricultura/202631/,Colombia,Spanish,20260711T160000Z,,semana.com,2026-07-11 16:43:31
30 Tahun Elnusa Petrofin : Menghubungkan Energi dan Menggerakkan Negeri,https://www.jpnn.com/news/30-tahun-elnusa-petrofin-menghubungkan-energi-dan-menggerakkan-negeri,Indonesia,Indonesian,20260711T154500Z,,jpnn.com,2026-07-11 16:43:31
Traži se mudar sudac,https://www.glas-slavonije.hr/mozaik/film-i-tv/2026/07/11/trazi-se-mudar-sudac-771328/,Croatia,Croatian,20260711T154500Z,,glas-slavonije.hr,2026-07-11 16:43:31
"Notable analyst calls this week : Broadcom , Seagate and Shopify among top picks ( CRM : NYSE ) ",https://seekingalpha.com/news/4612951-notable-analyst-calls-this-week-broadcom-seagate-and-shopify-among-top-picks,United States,English,20260711T154500Z,,seekingalpha.com,2026-07-11 16:43:31
Las tribulaciones de Friedrich Merz,https://www.larioja.com/internacional/tribulaciones-friedrich-merz-20260711162348-ntrc.html,Spain,Spanish,20260711T154500Z,,larioja.com,2026-07-11 16:43:31
Trapani : la Sicilia lancia un modello innovativo per la transizione sostenibile e leconomia blu . ,https://www.sicilianews24.it/trapani-la-sicilia-lancia-un-modello-innovativo-per-la-transizione-sostenibile-e-leconomia-blu-834945.html,Italy,Italian,20260711T154500Z,,sicilianews24.it,2026-07-11 16:43:31
U Soljanima održani Dani polja lubenice : Slavonska lubenica vrhunske je kvalitete i treba postati prepoznatljiv domaći proizvod,https://www.glas-slavonije.hr/regija/2026/07/11/u-soljanima-odrzani-dani-polja-lubenice-slavonska-lubenica-vrhunske-je-kvalitete-i-treba-postati-prepoznatljiv-domaci-proizvod-773810/,Croatia,Croatian,20260711T154500Z,,glas-slavonije.hr,2026-07-11 16:43:31
How overlapping US and China sanctions are complicating business in Africa – Ghanamma . com,https://www.ghanamma.com/2026/07/11/how-overlapping-us-and-china-sanctions-are-complicating-business-in-africa/,Ghana,English,20260711T154500Z,,ghanamma.com,2026-07-11 16:43:31
荷兰弟手持折叠屏iPhone照片引热议 疑点曝光或为AI之作 苹果新品细节揭秘 - 手机快报 - ITBear科技资讯,https://www.itbear.com.cn/html/2026-07/1440409.html,China,Chinese,20260711T154500Z,,itbear.com.cn,2026-07-11 16:43:31
Pływalnia Manta będzie zamknięta • Wodzisław Śląski,https://www.nowiny.pl/wiadomosci/249835-plywalnia-manta-bedzie-zamknieta.html,Poland,Polish,20260711T154500Z,,nowiny.pl,2026-07-11 16:43:31
Understanding UPMC HR Direct : A Comprehensive Guide For Employees,https://www.unitaid.eu/hr-direct-upmc-c9fx.html,,English,20260711T154500Z,,unitaid.eu,2026-07-11 16:43:31
易联支付 ， 被重罚近1000万元,https://finance.ifeng.com/c/8ugG7yGWIZO,China,Chinese,20260711T154500Z,,finance.ifeng.com,2026-07-11 16:43:31
Mugshot Zone : Understanding Public Records And Online Accessibility,https://www.unitaid.eu/mugshot-zone-website-r9m9.html,,English,20260711T154500Z,,unitaid.eu,2026-07-11 16:43:31
Erling Haaland i jego majątek . Nieruchomości i auta warte miliony dolarów,https://www.money.pl/finanse/erling-haaland-i-jego-majatek-nieruchomosci-i-auta-warte-miliony-dolarow-7306317915867488a.html,Poland,Polish,20260711T154500Z,,money.pl,2026-07-11 16:43:31
2025年我国港口货物 、 集装箱吞吐量稳居世界第一,https://www.stdaily.com/web/gdxw/2026-07/11/content_545970.html,China,Chinese,20260711T154500Z,,stdaily.com,2026-07-11 16:43:31
Nowe rachunki za prąd . Polacy od razu zobaczą te 4 kluczowe opłaty,"https://www.farmer.pl/finanse/nowe-rachunki-za-prad-polacy-od-razu-zobacza-te-4-kluczowe-oplaty,180156.html",Poland,Polish,20260711T154500Z,,farmer.pl,2026-07-11 16:43:31
Boyce : Your safety our priority,https://nationnews.com/2026/07/11/boyce-your-safety-our-priority/,Barbados,English,20260711T154500Z,,nationnews.com,2026-07-11 16:43:31
"Lợi nhuận quý II / 2026 : Bán lẻ , dầu khí , cao su và thép được dự báo dẫn dắt đà tăng trưởng",https://stockbiz.vn/tin-tuc/loi-nhuan-quy-ii2026-ban-le-dau-khi-cao-su-va-thep-duoc-du-bao-dan-dat-da-tang-truong/40862778,Vietnam,Vietnamese,20260711T154500Z,,stockbiz.vn,2026-07-11 16:43:31
疾风骤雨守一线 中国太保全力迎战  巴威 _ 产业经济 _ 财经 _ 中金在线,http://news.cnfol.com/chanyejingji/20260711/32304973.shtml,China,Chinese,20260711T154500Z,,news.cnfol.com,2026-07-11 16:43:31
"Majestic Realm Unveils Cyber Pop Odyssey  Digital Human , a Meditation on Where Humanity and Technology Converge",https://cashboxcanada.ca/reviews-album/majestic-realm-unveils-cyber-pop-odyssey-digital-human-meditation-where-humanity-and,Canada,English,20260711T154500Z,,cashboxcanada.ca,2026-07-11 16:43:31
Aprendizaje colaborativo : el conocimiento colectivo del agro también se  crea  de manera digital,https://www.infocampo.com.ar/aprendizaje-colaborativo-el-conocimiento-colectivo-del-agro-tambien-se-crea-de-manera-digital/,Argentina,Spanish,20260711T154500Z,,infocampo.com.ar,2026-07-11 16:43:31
Ensuring Campus Accessibility and Safety Needs,https://www.cuindependent.com/ensuring-campus-accessibility-and-safety-needs/,United States,English,20260711T154500Z,,cuindependent.com,2026-07-11 16:43:31
Meta Verified scam uses PDF attachment to steal your Facebook login,https://www.foxnews.com/tech/meta-verified-scam-threatens-facebook-deletion,United States,English,20260711T154500Z,,foxnews.com,2026-07-11 16:43:31
Tříkolka Piaggio MP3 530 Exclusive kombinuje svobodu motorky s technologiemi a stabilitou auta,https://www.e15.cz/magazin/cestovani-a-cestovni-ruch/trikolka-piaggio-mp3-530-exclusive-kombinuje-svobodu-motorky-s-technologiemi-a-stabilitou-auta-1433975,Czech Republic,Czech,20260711T154500Z,,e15.cz,2026-07-11 16:43:31
小米REDMI Note 17系列规格揭晓 ： 骁龙芯片加持 ， 续航与性能双提升 - 业界动态 - ITBear科技资讯,https://www.itbear.com.cn/html/2026-07/1440418.html,China,Chinese,20260711T154500Z,,itbear.com.cn,2026-07-11 16:43:31
"СИМПТОМИ КОИ ЛИЧАТ НА ПИЈАНСТВО , А ВСУШНОСТ СЕ ОПАСНИ ПО ЖИВОТ : Препознајте го падот на шеќерот",https://vecer.mk/life/62e1abdc-9781-40d7-9841-c3395e0ac236-1,Macedonia,Macedonian,20260711T154500Z,,vecer.mk,2026-07-11 16:43:31
India to augment AI compute capacity : Ashwini Vaishnaw,https://economictimes.indiatimes.com/tech/artificial-intelligence/india-to-augment-ai-compute-capacity-ashwini-vaishnaw/articleshow/132332909.cms,India,English,20260711T154500Z,,economictimes.indiatimes.com,2026-07-11 16:43:31
"Index - Tudomány - Putyin sem mond nemet egy kis peptidre , ami a fiatalság új csodaszere",https://index.hu/tudomany/2026/07/11/peptid-oregedes-regeneralas-gyogyulas-kozmetika-anti-aging-putyin-amerika/,Hungary,Hungarian,20260711T154500Z,,index.hu,2026-07-11 16:43:31
显微技术引领口腔精细化诊疗新方向 《 现代根管治疗精品班 》 在青岛宝岛吾同口腔医院圆满举办 - 半岛网,http://news.bandao.cn/a/1783762364549483.html,China,Chinese,20260711T154500Z,,news.bandao.cn,2026-07-11 16:43:31
迎战  巴威 ： 上海探空  大白  携北斗系统翱翔万米 精准  捕风 - 信息流 - ITBear科技资讯,https://www.itbear.com.cn/html/2026-07/1440413.html,China,Chinese,20260711T154500Z,,itbear.com.cn,2026-07-11 16:43:31
Президент Словакии посетит Азербайджан,https://haqqin.az/newsarchive/388252,Azerbaijan,Russian,20260711T154500Z,,haqqin.az,2026-07-11 16:43:31
Israel Embassy in New Delhi hosts launch of Eyal Nir book  Budo for Life  ,https://ianslive.in/israel-embassy-in-new-delhi-hosts-launch-of-eyal-nirs-book-budo-for-life--20260711200738,India,English,20260711T153000Z,,ianslive.in,2026-07-11 16:43:31
"Apple подала иск против компании OpenAI и ее сотрудников , обвинив их в краже коммерческой тайны",https://www.bbc.com/russian/articles/c15yj0pq5yko,United Kingdom,Russian,20260711T153000Z,,bbc.com,2026-07-11 16:43:31
"Meta to discontinue controversial AI feature following privacy concerns , Hollywood SAG - AFTRA union welcomes move",https://www.livemint.com/companies/news/meta-discontinue-controversial-ai-feature-users-generate-images-public-instagram-privacy-concerns-hollywood-sagaftra-11783765782518.html,India,English,20260711T153000Z,,livemint.com,2026-07-11 16:43:31
Εμπρησμός στη Marfin : Πώς η Αστυνομία ξετύλιξε το κουβάρι και έφτασε στις συλλήψεις,https://www.lykavitos.gr/news/greece/emprismos-sti-marfin-pos-i-astynomia-ksetylikse-to-kouvari-kai-eftase-stis-syllipseis,Greece,Greek,20260711T153000Z,,lykavitos.gr,2026-07-11 16:43:31
VIDA enters the Asia Book of Records with the launch of the new VIDA Evooter VX2 Plus 4 . 4 kWh,https://www.equitybulls.com/category.php?id=372763,India,English,20260711T153000Z,,equitybulls.com,2026-07-11 16:43:31
Nič sa nezmení ? Nový tréner Jesus nemá problém osloviť Cristiana Rolanda do národného tímu Portugalska,https://spravy.pozri.sk/clanok/nic-sa-nezmeni-novy-trener-jesus-nema-problem-oslovit-cristiana-rolanda-do-narodneho-timu-portugalska/1610755,Slovak Republic,Slovak,20260711T153000Z,,spravy.pozri.sk,2026-07-11 16:43:31
Κικίλιας από Κάλυμνο : Το νησί πρέπει να έχει σταθερή ακτοπλοϊκή σύνδεση όλο τον χρόνο,https://www.athensvoice.gr/epikairotita/politiki-oikonomia/974459/kikilias-apo-kalumno-to-nisi-prepei-na-ehei-statheri-aktoploiki-sundesi-olo-ton-hrono/,Greece,Greek,20260711T153000Z,,athensvoice.gr,2026-07-11 16:43:31
活力中国调研行丨从  机器人谷 ， 攀  机器人峰 _ 要闻 _ 奥一网,https://www.oeeee.com/html/202607/11/1723540.html,China,Chinese,20260711T153000Z,,oeeee.com,2026-07-11 16:43:31
مقابلة خاصة : خبيرة مصرية : العلاقات بين مصر والصين  نموذج استراتيجي  للتعاون بين دول الجنوب - شبكة فلسطين للأنباء,https://www.shfanews.net/post/305820,Israel,Arabic,20260711T153000Z,,shfanews.net,2026-07-11 16:43:31
"El 70 % los alumnos de Primaria extremeños disponen de móvil propio , según un estudio",https://www.europapress.es/extremadura/noticia-70-alumnos-primaria-extremenos-disponen-movil-propio-estudio-20260711133250.html,Spain,Spanish,20260711T153000Z,,europapress.es,2026-07-11 16:43:31
Motorola Edge 70 Max resmi olarak duyuruldu,https://www.teknolojioku.com/mobil/motorola-edge-70-max-resmi-olarak-duyuruldu-6a51eaa555ae08588706f1b3,Turkey,Turkish,20260711T153000Z,,teknolojioku.com,2026-07-11 16:43:31
,https://retizen.republika.co.id/posts/770330/ziswaf-saatnya-beralih-dari-sekadar-menyalurkan-menjadi-membangun-kemandirian,Indonesia,Indonesian,20260711T153000Z,,retizen.republika.co.id,2026-07-11 16:43:31
Szef MON : możemy pomóc Ukrainie ws . modernizacji MiG - ów ; koszty po jej stronie lub chętnych sojuszników,"https://www.wnp.pl/rynki/szef-mon-mozemy-pomoc-ukrainie-ws-modernizacji-mig-ow-koszty-po-jej-stronie-lub-chetnych-sojusznikow,1080355.html",Poland,Polish,20260711T153000Z,,wnp.pl,2026-07-11 16:43:31
高雄復健鞋墊製造工廠 》 廣薪實業 鞋墊 OEM / ODM 製造優勢 ， 從打樣到量產一站完成 - n94ghfm898380 的部落格,https://blog.udn.com:443/n94ghfm898380/191323910,Taiwan,Chinese,20260711T153000Z,,blog.udn.com,2026-07-11 16:43:31
习近平总书记重要讲话激励广大科技工作者勇担使命,https://www.oeeee.com/html/202607/11/1723550.html,China,Chinese,20260711T153000Z,,oeeee.com,2026-07-11 16:43:31
Ni logos en la carcasa ni aplicaciones basura : así obligó Steve Jobs a las operadoras a respetar el diseño del iPhone,https://www.applesfera.com/curiosidades/logos-carcasa-aplicaciones-basura-asi-obligo-steve-jobs-a-operadoras-a-respetar-diseno-iphone,United States,Spanish,20260711T153000Z,,applesfera.com,2026-07-11 16:43:31
"Колишньому сержанту « Скелі », якого підозрюють у побитті капелана та підполковника , обрано запобіжний захід",https://glavcom.ua/country/criminal/serzhantu-skeli-jakoho-pidozrjujut-u-pobitti-kapelana-ta-pidpolkovnika-obrano-zapobizhnij-zakhid-1130678.html,Ukraine,Ukrainian,20260711T153000Z,,glavcom.ua,2026-07-11 16:43:31
" « Ta clim consomme , mon arbre grandit » : ce Mûrier platane garde sa maison au frais même pendant la canicule",https://www.pleinevie.fr/vie-quotidienne/jardin/ta-clim-consomme-mon-arbre-grandit-ce-murier-platane-garde-sa-maison-au-frais-meme-pendant-la-canicule-215325.html,France,French,20260711T153000Z,,pleinevie.fr,2026-07-11 16:43:31
India UPI to be integrated with New Zealand payment network,https://organiser.org/2026/07/11/369369/world/pm-modi-announces-upi-integration-with-new-zealands-payment-network-during-historic-visit/,India,English,20260711T153000Z,,organiser.org,2026-07-11 16:43:31
Setkab Dokumentasikan Pengembangan Kampung Nelayan Merah Putih di Sinjai,https://daerah.sindonews.com/read/1727397/174/setkab-dokumentasikan-pengembangan-kampung-nelayan-merah-putih-di-sinjai-1783778845,Indonesia,Indonesian,20260711T153000Z,,daerah.sindonews.com,2026-07-11 16:43:31
"Deepened bonds , strengthened partnerships : PM Modi concludes three - nation visit , departs from NZ to India",https://timesofoman.com/article/174232-indian-pm-modi-concludes-three-nation-visit-departs-from-nz-to-india,Oman,English,20260711T153000Z,,timesofoman.com,2026-07-11 16:43:31
Poznati investitor predviđa kraj Bitcoina i upozorava što bi moglo pokrenuti lančanu reakciju,https://www.glasistre.hr/tehnologija/2026/07/11/poznati-investitor-predvida-kraj-bitcoina-i-upozorava-sto-bi-moglo-pokrenuti-lancanu-reakciju-1079105,Croatia,Croatian,20260711T153000Z,,glasistre.hr,2026-07-11 16:43:31
Украинская Бронетехника : Официальная позиция ООО « Украинская бронетехника » и опровержение заявлений СБУ и ОГПУ Блоги,https://www.obozrevatel.com/politics-news/ofitsialnaya-pozitsiya-ooo-ukrainskaya-bronetehnika-i-oproverzhenie-zayavlenij-sbu-i-ogpu.htm,Ukraine,Ukrainian,20260711T153000Z,,obozrevatel.com,2026-07-11 16:43:31
岚图飘了 ？ 全新MPV竟敢定价50万级 ！ ,https://finance.sina.com.cn/wm/2026-07-10/doc-inihmzuq6426498.shtml,China,Chinese,20260711T153000Z,,finance.sina.com.cn,2026-07-11 16:43:31
习近平总书记重要讲话激励广大科技工作者勇担使命 - 聚焦,https://www.fjsen.com/2026-07/11/content_32217192.htm,China,Chinese,20260711T153000Z,,fjsen.com,2026-07-11 16:43:31
DSTV EMPIRE CRACKING ! Canal+ Shake - Up Sparks Staff Exodus as Ugandan Subscribers Dump Pay - TV Giant,https://redpepper.co.ug/dstv-empire-cracking-canal-shake-up-sparks-staff-exodus-as-ugandan-subscribers-dump-pay-tv-giant/149550/,Uganda,English,20260711T153000Z,,redpepper.co.ug,2026-07-11 16:43:31
零售业创新发展再迎政策利好,https://baijiahao.baidu.com/s?id=1870376276061528939,China,Chinese,20260711T153000Z,,baijiahao.baidu.com,2026-07-11 16:43:31
"Kitajska v zraku ujela raketo , obiskala asteroid ... in pripravila načrt za uničenje Starlinka ? ",https://www.rtvslo.si/znanost-in-tehnologija/kitajska-v-zraku-ujela-raketo-obiskala-asteroid-in-pripravila-nacrt-za-unicenje-starlinka/787694,Slovenia,Slovenian,20260711T153000Z,,rtvslo.si,2026-07-11 16:43:31
Solo el trabajo nos reconstruirá - Runrun . es : En defensa de tus derechos humanos,https://runrun.es/opinion/614523/reconstruccion-de-venezuela-2/,Spain,Spanish,20260711T153000Z,,runrun.es,2026-07-11 16:43:31
"Pellegrini odcestuje do Azerbajdžanu , s prezidentom Alijevom bude rokovať o energetike aj Karabachu",https://spravy.pozri.sk/clanok/pellegrini-odcestuje-do-azerbajdzanu-s-prezidentom-alijevom-bude-rokovat-o-energetike-aj-karabachu/1610753,Slovak Republic,Slovak,20260711T153000Z,,spravy.pozri.sk,2026-07-11 16:43:31
