title,url,source_country,language,published_date,tone,domain,collected_at
Noile cifre ale creșterii economice din China nu sună bine și dezvăluie un fenomen îngrijorător pentru Beijing,https://hotnews.ro/noile-cifre-ale-cresterii-economice-din-china-nu-suna-bine-si-dezvaluie-dezechilibre-si-fenomene-ingrijoratoare-pentru-beijing-2300883,Romania,Romanian,20260715T091500Z,,hotnews.ro,2026-07-15 09:51:19
More than 50 % of Australian university assignments used AI . How should unis respond ? ,http://www.australianherald.com/news/279185409/more-than-50-of-australian-university-assignments-used-ai-how-should-unis-respond,Australia,English,20260715T091500Z,,australianherald.com,2026-07-15 09:51:19
"Cum să - ți reduci facturile și să - ți crești confortul : soluții pentru casă cu grant de până la 22 , 5 % ",https://protv.md/articol-comercial/cum-sa-ti-reduci-facturile-si-sa-ti-cresti-confortul-solutii-pentru-casa-cu-grant-de-pana-la-22-5---2762943.html,Moldova,Romanian,20260715T091500Z,,protv.md,2026-07-15 09:51:19
Devina Mehra : What drives market euphoria ? And why do we see the same story over and over ? ,https://www.livemint.com/opinion/online-views/devina-mehra-market-euphoria-ai-bubble-spacex-technology-artificial-intelligence-11784024424787.html,India,English,20260715T091500Z,,livemint.com,2026-07-15 09:51:19
ASCII . jp ： So - net 光 、 PlayStation ( R ) 5オプションを提供開始,https://ascii.jp/elem/000/004/419/4419970/,Japan,Japanese,20260715T091500Z,,ascii.jp,2026-07-15 09:51:19
Ивана Радомирова пред СТАНДАРТ : Бирата е част от Бранд България - Podcast Новини Стандарт,https://www.standartnews.com/podcast/ivana-radomirova-pred-standart-birata-e-chast-ot-brand-balgariya-640483.html,Bulgaria,Bulgarian,20260715T091500Z,,standartnews.com,2026-07-15 09:51:19
"Supreme Court rejects plea to curb reels , podcasts ; warns against politicising Article 32",https://www.thehindu.com/news/national/supreme-court-rejects-plea-to-curb-reels-podcasts-warns-against-politicising-article-32/article71224697.ece,India,English,20260715T091500Z,,thehindu.com,2026-07-15 09:51:19
Paypal - Aktie : Wird der Bezahldienstleister aufgekauft ? ,https://deutsche-wirtschafts-nachrichten.de/721377/paypal-aktie-stripe-und-advent-wollen-bezahldienst-kaufen,Germany,German,20260715T091500Z,,deutsche-wirtschafts-nachrichten.de,2026-07-15 09:51:19
PLDT Home strengthens connectivity and customer support ahead of typhoon season,https://gadgetsmagazine.com.ph/technology/telcos/pldt-home-typhoon-season,Philippines,English,20260715T091500Z,,gadgetsmagazine.com.ph,2026-07-15 09:51:19
Bueckers leads Dallas against New York after 22 - point showing,https://www.elpasoinc.com/news/ap_wire/bueckers-leads-dallas-against-new-york-after-22-point-showing/article_114f3475-02ad-5907-baaa-2d85de8a38b3.html,United States,English,20260715T091500Z,,elpasoinc.com,2026-07-15 09:51:19
第五届  科技小院行  大学生暑期联合社会实践启动,https://news.cau.edu.cn/jcdt/36f35009dc44442a90d257d2aa8bc34d.htm,China,Chinese,20260715T091500Z,,news.cau.edu.cn,2026-07-15 09:51:19
Simon Abkarian : Charles de Gaulle a restauré lhonneur de la France - Nouvelles dArménie en Ligne – Toute lactualité sur le monde arménien,https://www.armenews.com/simon-abkarian-charles-de-gaulle-a-restaure-lhonneur-de-la-france/,Armenia,French,20260715T091500Z,,armenews.com,2026-07-15 09:51:19
"Die besten E - SUV über 4 , 70 Meter im Test",https://www.autobild.de/rankings/die-besten-e-suv-ueber-4-70-meter-im-test-28722623.html,Germany,German,20260715T091500Z,,autobild.de,2026-07-15 09:51:19
"  Clients will get annoyed  if firms pass on AI costs , says Keypoint CEO",https://www.lawyersweekly.com.au/biglaw/44659-clients-will-get-annoyed-if-firms-pass-on-ai-costs-says-keypoint-s-ceo,Australia,English,20260715T091500Z,,lawyersweekly.com.au,2026-07-15 09:51:19
La importancia de las personas en el crecimiento sostenible,https://www.hoy.es/economia/importancia-personas-crecimiento-sostenible-20260715103204-ntrc.html,Spain,Spanish,20260715T091500Z,,hoy.es,2026-07-15 09:51:19
Confundir eletricidade com energia atrasa a transio,https://greensavers.sapo.pt/confundir-eletricidade-com-energia-atrasa-a-transicao/,Portugal,Portuguese,20260715T091500Z,,greensavers.sapo.pt,2026-07-15 09:51:19
"WBR Corp united kingdom Limited Hosts Prestigious Asian united kingdom Business Meet & Awards 2026 and Global Health Awards 2026 at the House of Commons , London",http://www.southeastasiapost.com/news/279188329/wbr-corp-uk-limited-hosts-prestigious-asian-uk-business-meet-awards-2026-and-global-health-awards-2026-at-the-house-of-commons-london,Pakistan,English,20260715T091500Z,,southeastasiapost.com,2026-07-15 09:51:19
"  Not the Ceiling , but the base : Harjinder Kang outlines 5 - pillars for future of India - UK relations after FTA comes into effect",http://www.bignewsnetwork.com/news/279188547/not-the-ceiling-but-the-base-harjinder-kang-outlines-5-pillars-for-future-of-india-uk-relations-after-fta-comes-into-effect,United States,English,20260715T091500Z,,bignewsnetwork.com,2026-07-15 09:51:19
SpaceX hisseleri sert çakıldı : Elon Musk 850 milyar dolar kaybetti - Son Dakika Ekonomi Haberleri,https://www.odatv.com/ekonomi/spacex-hisseleri-sert-cakildi-elon-musk-850-milyar-dolar-kaybetti-120154749,Turkey,Turkish,20260715T091500Z,,odatv.com,2026-07-15 09:51:19
DBS crowned Southeast Asia most valuable brand in Kantar BrandZ 2026 ranking,http://www.southeastasiapost.com/news/279188433/dbs-crowned-southeast-asia-most-valuable-brand-in-kantar-brandz-2026-ranking,Pakistan,English,20260715T091500Z,,southeastasiapost.com,2026-07-15 09:51:19
Asya Borsaları Çin Hariç Yükseldi,https://www.haberaktuel.com/asya-borsalari-cin-haric-yukseldi-3463226,Turkey,Turkish,20260715T091500Z,,haberaktuel.com,2026-07-15 09:51:19
Braiin ( NASDAQ : BRAI ) Shares Gap Up – Still a Buy ? ,https://www.themarketsdaily.com/2026/07/15/braiin-nasdaqbrai-shares-gap-up-still-a-buy.html,United States,English,20260715T091500Z,,themarketsdaily.com,2026-07-15 09:51:19
"Bakan Bolat : Milletimiz Türkiyenin geleceğini korudu – Güncel Haberler , Son Dakika Haberleri , Turktime Haber Portalı",https://www.turktime.com/haber/bakan-bolat-milletimiz-turkiye-nin-gelecegini-korudu/749444,Turkey,Turkish,20260715T091500Z,,turktime.com,2026-07-15 09:51:19
IT Data Architect - South Africa - Johannesburg,https://www.bizcommunity.com/job/johannesburg/internet/it-data-architect-076789a,South Africa,English,20260715T091500Z,,bizcommunity.com,2026-07-15 09:51:19
"Pere Estupinyà , divulgador científico :  Saber que tienes muchas posibilidades de llegar a los 90 te cambia el chip  ",https://www.diariodenavarra.es/noticias/cultura-ocio/cultura/2026/07/15/pere-estupinya-divulgador-cientifico-tienes-muchas-posibilidades-llegar-90-te-cambia-chip-828423-104.html,Spain,Spanish,20260715T091500Z,,diariodenavarra.es,2026-07-15 09:51:19
A sombre Dáil sets divisions aside for apology to Bill Kenneally victims – The Irish Times,https://www.irishtimes.com/politics/2026/07/15/a-sombre-dail-sets-divisions-aside-for-apology-to-bill-kenneally-victims/,Ireland,English,20260715T091500Z,,irishtimes.com,2026-07-15 09:51:19
Meta Muse Spark 1 . 1 Review : Features and Performance,https://www.geeky-gadgets.com/meta-muse-spark-review/,United Kingdom,English,20260715T091500Z,,geeky-gadgets.com,2026-07-15 09:51:19
大众将中国研发车搬回德国老家造 ： 金标与众系列反向输欧 百年风向要变,https://finance.sina.com.cn/tech/roll/2026-07-15/doc-inihwrqy7968575.shtml,China,Chinese,20260715T091500Z,,finance.sina.com.cn,2026-07-15 09:51:19
ร่อนจดหมายเปิดผนึกบี้  อนุทิน  ถก  สี จิ้นผิง  สยบมลพิษข้ามพรมแดนจากเหมืองจีน,https://www.dailynews.co.th/news/6029660/,Thailand,Thai,20260715T091500Z,,dailynews.co.th,2026-07-15 09:51:19
2026 MLB All - Star Game team - by - team breakdown,https://www.mlb.com/giants/news/2026-mlb-all-star-game-team-by-team-breakdown,United States,English,20260715T091500Z,,mlb.com,2026-07-15 09:51:19
高速光模块订单大增 ， 剑桥科技上半年净利润同比增长156 . 65 % 至197 . 18 % ,https://finance.sina.com.cn/tech/roll/2026-07-15/doc-inihwrqy7975610.shtml,China,Chinese,20260715T091500Z,,finance.sina.com.cn,2026-07-15 09:51:19
Talgo da la bienvenida a su nuevo consejero delegado con subidas en el Mercado Continuo,https://www.estrategiasdeinversion.com/actualidad/noticias/bolsa-espana/talgo-da-la-bienvenida-a-su-nuevo-consejero-delegado-n-935149,Spain,Spanish,20260715T091500Z,,estrategiasdeinversion.com,2026-07-15 09:51:19
棉花的花朵长什么样 ？ 带你体验智能打顶机器人的精准高效,https://baijiahao.baidu.com/s?id=1870769743992957323,China,Chinese,20260715T091500Z,,baijiahao.baidu.com,2026-07-15 09:51:19
12 U . S . states sue to block Paramount - Warner merger,http://www.australianherald.com/news/279185479/12-us-states-sue-to-block-paramount-warner-merger,Australia,English,20260715T091500Z,,australianherald.com,2026-07-15 09:51:19
SiteHive plugs the missing piece in environmental monitoring – weather | Empower Stories | Build Authority,https://econews.com.au/sitehive-plugs-the-missing-piece-in-environmental-monitoring-weather/,Australia,English,20260715T091500Z,,econews.com.au,2026-07-15 09:51:19
Social media giants failing to address rising rates of sexual extortion : Australian commissioner,http://www.australianherald.com/news/279185750/social-media-giants-failing-to-address-rising-rates-of-sexual-extortion-australian-commissioner,Australia,English,20260715T091500Z,,australianherald.com,2026-07-15 09:51:19
" „ Rapide  Chance : Okta , CrowdStrike und der IBM - Moment ! Neugierig ? () ",https://www.aktiencheck.de/analysen/Artikel-Rapide_Chance_Okta_CrowdStrike_und_IBM_Moment_Neugierig-19932973,Germany,German,20260715T091500Z,,aktiencheck.de,2026-07-15 09:51:19
"Asya piyasalarında teknoloji rallisi – Güncel Haberler , Son Dakika Haberleri , Turktime Haber Portalı",https://www.turktime.com/haber/asya-piyasalarinda-teknoloji-rallisi/749461,Turkey,Turkish,20260715T091500Z,,turktime.com,2026-07-15 09:51:19
UK will be safest place for teenagers online with social media curfew – minister,https://www.chesterstandard.co.uk/news/national/26281215.uk-will-safest-place-teenagers-online-social-media-curfew---minister/,United Kingdom,English,20260715T091500Z,,chesterstandard.co.uk,2026-07-15 09:51:19
A TIG hegesztési eljárás és annak számos előnye,https://dunaujvaros.com/hirek/202607/a_tig_hegesztesi_eljaras_es_annak_szamos_elonye,Hungary,Hungarian,20260715T091500Z,,dunaujvaros.com,2026-07-15 09:51:19
Rrezet X të para të marra në hapësirë nga astronautët,https://telegrafi.com/rrezet-x-te-para-te-marra-ne-hapesire-nga-astronautet/,Kosovo,Albanian,20260715T091500Z,,telegrafi.com,2026-07-15 09:51:19
ภาวะตลาดหุ้นฮ่องกง : ฮั่งเส็งปิดพุ่ง 340 . 37 จุด ขานรับเงินเฟ้อสหรัฐฯ,https://www.ryt9.com/s/iq/12830282,Thailand,Thai,20260715T091500Z,,ryt9.com,2026-07-15 09:51:19
South African Tourism COO Ismail Dockrat : Why execution is the real test of strategy,https://www.bizcommunity.com/article/south-african-tourism-coo-ismail-dockrat-why-execution-is-the-real-test-of-strategy-408639a,South Africa,English,20260715T091500Z,,bizcommunity.com,2026-07-15 09:51:19
How It Made,https://www.tvguide.co.uk/schedule/bf1e85ff-20f6-50ae-a5d0-23c29ac64d83/how-its-made,United Kingdom,English,20260715T091500Z,,tvguide.co.uk,2026-07-15 09:51:19
La UCLM impulsará la práctica deportiva en personas con discapacidad intelectual,https://www.lacerca.com/noticias/castilla_la_mancha/uclm-impulsara-practica-deportiva-personas-discapacidad-intelectual-822424-1.html,Spain,Spanish,20260715T091500Z,,lacerca.com,2026-07-15 09:51:19
US Completes Another Round Of Strikes On Iranian Military Targets,http://www.sandiegosun.com/news/279188316/us-completes-another-round-of-strikes-on-iranian-military-targets,United States,English,20260715T091500Z,,sandiegosun.com,2026-07-15 09:51:19
UK will be safest place for teenagers online with social media curfew – minister,https://www.greenocktelegraph.co.uk/news/national/26281215.uk-will-safest-place-teenagers-online-social-media-curfew---minister/,United Kingdom,English,20260715T091500Z,,greenocktelegraph.co.uk,2026-07-15 09:51:19
Πιερρακάκης : Οι ελληνικές επιχειρήσεις να ανταγωνίζονται ισότιμα στις πιο απαιτητικές αγορές του πλανήτη,https://www.voria.gr/article/pierrakakis-oi-ellinikes-epiheiriseis-na-antagonizontai-isotima-stis-pio-apaititikes-agores,Greece,Greek,20260715T091500Z,,voria.gr,2026-07-15 09:51:19
打造AI影像生产线 2026美图影像节发布MeituHub,https://finance.sina.com.cn/roll/2026-07-15/doc-inihwrqy7965676.shtml,China,Chinese,20260715T091500Z,,finance.sina.com.cn,2026-07-15 09:51:19
Europa se apropie de vârful demografic pe care nu îl va putea susține,https://hotnews.ro/europa-se-apropie-de-varful-demografic-pe-care-nu-il-va-putea-sustine-2300919,Romania,Romanian,20260715T091500Z,,hotnews.ro,2026-07-15 09:51:19
 „ Oră de stingere . Adolescenții din Marea Britanie nu vor mai putea accesa rețelele sociale după miezul nopții,https://www.antena3.ro/externe/ora-de-stingere-adolescentii-din-marea-britanie-nu-vor-mai-putea-accesa-retelele-sociale-dupa-miezul-noptii-795661.html,Romania,Romanian,20260715T091500Z,,antena3.ro,2026-07-15 09:51:19
Why AI is more likely to fill offices than empty them,https://www.irishtimes.com/property/commercial-property/2026/07/15/why-ai-is-more-likely-to-fill-offices-than-empty-them/,Ireland,English,20260715T091500Z,,irishtimes.com,2026-07-15 09:51:19
Η Τουρκία πληρώνει « χρυσά » τα F - 35 : 5 δισ . για 6 μαχητικά 1ης γενιάς - Γιατί η Άγκυρα τα αγοράζει πιο ακριβά,https://www.enikos.gr/politics/i-tourkia-plironei-chrysa-ta-f-35-5-dis-gia-6-machitika-1is-genias-giati-i-agkyra-ta-agorazei-pio-akriva/2613999/,Greece,Greek,20260715T091500Z,,enikos.gr,2026-07-15 09:51:19
Η σημαντική προειδοποίηση της Google για όλους με Google λογαριασμό,https://techmaniacs.gr/i-simantiki-proeidopoiisi-tis-google-gia-oloys-me-google-logariasmo/,Greece,Greek,20260715T091500Z,,techmaniacs.gr,2026-07-15 09:51:19
Nörolojik hastalıklarda  dijital ikiz  yöntemiyle kişiye özel tedavi yapılacak,https://www.haberler.com/guncel/omu-de-norolojik-hastaliklara-dijital-ikiz-teknolojisi-20053733-haberi/,Turkey,Turkish,20260715T091500Z,,haberler.com,2026-07-15 09:51:19
В НИЦЭМ имени Гамалеи создадут банк клеток для разработки альтернативы семаглутиду – журнал Vademecum,https://www.vademec.ru/news/2026/07/15/v-nitsem-imeni-gamalei-sozdadut-bank-kletok-dlya-razrabotki-alternativy-semaglutidu/,Russia,Russian,20260715T091500Z,,vademec.ru,2026-07-15 09:51:19
" „ Rapide  Chance : Okta , CrowdStrike und der IBM - Moment ! Neugierig ? () ",https://www.aktiencheck.de/exklusiv/Artikel-Rapide_Chance_Okta_CrowdStrike_und_IBM_Moment_Neugierig-19932973,Germany,German,20260715T091500Z,,aktiencheck.de,2026-07-15 09:51:19
Chytré hodinky mohou napáchat stejné škody jako vysoký cholesterol . Jak nepropadnout závislosti na fitness technologiích ? ,https://domaci.hn.cz/c1-67903670-chytre-hodinky-mohou-napachat-stejne-skody-jako-vysoky-cholesterol-jak-nepropadnout-zavislosti-na-fitness-technologiich,,Czech,20260715T091500Z,,domaci.hn.cz,2026-07-15 09:51:19
LEDARE : Piketty och ekonomer kritiserar svensk skattepolitik,https://www.di.se/ledare/ekonomerna-vilseleder-om-svensk-skatt-och-jamlikhet/,Sweden,Swedish,20260715T091500Z,,di.se,2026-07-15 09:51:19
 [ 业绩预告 ] 隆平高科 ( 000998 ): 2026年半年度业绩预告 - CFi . CN 中财网,http://www.cfi.net.cn/p20260715001536.html,China,Chinese,20260715T091500Z,,cfi.net.cn,2026-07-15 09:51:19
从苏炳添到刘名芳 ！ 盘点广东近十年的感动中国面孔 - 新闻频道,http://www.zsnews.cn/news/index/view/cateid/37/id/779021.html,China,Chinese,20260715T091500Z,,zsnews.cn,2026-07-15 09:51:19
The Telegraph : Volkswagen küşün eşiğinde,https://www.ensonhaber.com/the-telegraph-volkswagen-cokusun-esiginde-h1550052,Turkey,Turkish,20260715T091500Z,,ensonhaber.com,2026-07-15 09:51:19
台灣智綠科技打造能源 × AI整合平台 一站式AI導入服務助企業加速數位轉型,https://n.yam.com/Article/20260715913792,Taiwan,Chinese,20260715T091500Z,,n.yam.com,2026-07-15 09:51:19
Hong Kong steps up to US crypto fund challenge with tokenised fund approval,https://www.scmp.com/tech/blockchain/article/3360652/hong-kong-steps-us-crypto-fund-challenge-tokenised-fund-approval,China,English,20260715T091500Z,,scmp.com,2026-07-15 09:51:19
"Hơn 7 , 1 triệu nguyện vọng đại học 2026 : Chọn đúng ngành , không chạy theo số lượng",http://vov.vn/xa-hoi/vi-sao-stem-tro-thanh-lua-chon-cua-hon-nua-thi-sinh-dai-hoc-2026-post1315487.vov,Vietnam,Vietnamese,20260715T091500Z,,vov.vn,2026-07-15 09:51:19
Công ty Mỹ bán mặt trời với giá 5 . 000 USD / giờ,https://vnreview.vn/threads/cong-ty-my-ban-mat-troi-voi-gia-5-000-usd-gio.87607/,Vietnam,Vietnamese,20260715T091500Z,,vnreview.vn,2026-07-15 09:51:19
Logitech launches Rally AI Cameras for smarter hybrid collaboration,https://gadgetsmagazine.com.ph/technology/accessories-and-peripherals/logitech-rally-ai-cameras,Philippines,English,20260715T091500Z,,gadgetsmagazine.com.ph,2026-07-15 09:51:19
"Na polskie ulice może trafić znak ostrzegający przed telefonami . Błagam , nie",https://spidersweb.pl/2026/07/znak-drogowy-przeciwko-telefonom-komentarz.html,Poland,Polish,20260715T091500Z,,spidersweb.pl,2026-07-15 09:51:19
Microsoft CEOsu Satya Nadelladan ezber bozan uyarı : Göründüğünden çok daha tehlikeli - Son Dakika Bilim ve Teknoloji Haberleri,https://www.odatv.com/bilim-ve-teknoloji/microsoft-ceosu-satya-nadelladan-ezber-bozan-uyari-gorundugunden-cok-daha-tehlikeli-120154745,Turkey,Turkish,20260715T091500Z,,odatv.com,2026-07-15 09:51:19
US Completes Another Round Of Strikes On Iranian Military Targets,http://www.utahindependent.com/news/279188316/us-completes-another-round-of-strikes-on-iranian-military-targets,United States,English,20260715T091500Z,,utahindependent.com,2026-07-15 09:51:19
SCB WEALTH ชี้ธีม AI ยังไปต่อ แนะไม่ลงทุนตามกระแส,https://www.ryt9.com/s/iq/12830246,Thailand,Thai,20260715T091500Z,,ryt9.com,2026-07-15 09:51:19
China DeepSeek Prepares to List Shares in Shanghai Next Year,https://www.livemint.com/global/chinas-deepseek-prepares-to-list-shares-in-shanghai-next-year-11784105076760.html,India,English,20260715T091500Z,,livemint.com,2026-07-15 09:51:19
Pioggia artificiale : illusione o soluzione alla siccità ? ,https://www.rsi.ch/info/ambiente/Pioggia-artificiale-illusione-o-soluzione-alla-siccit%C3%A0--3888692.html,Switzerland,Italian,20260715T091500Z,,rsi.ch,2026-07-15 09:51:19
INAIR 2 Elite Suite Review : Best AR Glasses for Work,https://www.geeky-gadgets.com/inair-2-elite-suite-review/,United Kingdom,English,20260715T091500Z,,geeky-gadgets.com,2026-07-15 09:51:19
Asian shares rise after rally on Wall Street as data show US inflation slowing,https://www.yoursourceone.com/news/national_news/asian-shares-rise-after-rally-on-wall-street-as-data-show-us-inflation-slowing/article_e91e69ba-e998-5fb8-8484-75fcb1ef6922.html,,English,20260715T091500Z,,yoursourceone.com,2026-07-15 09:51:19
Росія перетворила Японію на  гніздо шпигунів  ,https://gazeta.ua/articles/world-life/_rosiya-peretvorila-aponiyu-na-gnizdo-shpiguniv/1254623,Ukraine,Ukrainian,20260715T091500Z,,gazeta.ua,2026-07-15 09:51:19
Equinix秉持三大承诺 助大马晋升AI枢纽 | 财经,https://www.orientaldaily.com.my/news/business/2026/07/15/833299,Malaysia,Chinese,20260715T091500Z,,orientaldaily.com.my,2026-07-15 09:51:19
Сергей Кравчук посетил « Дальтрансуголь » и встретился с сотрудниками предприятия,https://www.nakanune.ru/news/2026/07/15/22880021/,Russia,Russian,20260715T091500Z,,nakanune.ru,2026-07-15 09:51:19
Nowy Burger King w Warszawie . Otwiera się dzisiaj w Arkadii,"https://www.propertynews.pl/centra-handlowe/nowy-burger-king-w-warszawie-otwiera-sie-dzisiaj-w-arkadii,199909.html",Poland,Polish,20260715T091500Z,,propertynews.pl,2026-07-15 09:51:19
Regeringen begynder yderligere indkøb af dronesystemer,https://www.kristeligt-dagblad.dk/danmark/regeringen-begynder-yderligere-indkoeb-af-dronesystemer,Denmark,Danish,20260715T091500Z,,kristeligt-dagblad.dk,2026-07-15 09:51:19
Imax : Saiba o valor do ingresso e quais cinemas no Brasil têm a tecnologia usada em  A Odisseia  ,https://oglobo.globo.com/cultura/filmes/noticia/2026/07/15/imax-saiba-o-valor-do-ingresso-e-quais-cinemas-no-brasil-tem-a-tecnologia-usada-em-a-odisseia.ghtml,Brazil,Portuguese,20260715T091500Z,,oglobo.globo.com,2026-07-15 09:51:19
The University of Western Australia appoints SRM Technologies as Information Technology Partner for its India Branch Campuses,http://www.newzealandstar.com/news/279188536/the-university-of-western-australia-appoints-srm-technologies-as-information-technology-partner-for-its-india-branch-campuses,New Zealand,English,20260715T091500Z,,newzealandstar.com,2026-07-15 09:51:19
Deadline,https://deadline.com/print-article/1236981923/,United States,English,20260715T091500Z,,deadline.com,2026-07-15 09:51:19
AWS เผยไทยใช้ AI พุ่ง 34 % แต่ส่วนใหญ่ยังเน้นใช้งานขั้นพื้นฐาน,https://www.springnews.co.th/digital-tech/technology/864206,Thailand,Thai,20260715T091500Z,,springnews.co.th,2026-07-15 09:51:19
HIMARS : в Україні розповіли про ліцензію на створення аналога цієї системи,https://www.unian.ua/weapons/himars-v-ukrajini-rozpovili-pro-licenziyu-na-stvorennya-analoga-ciyeji-sistemi-13441401.html,Ukraine,Ukrainian,20260715T091500Z,,unian.ua,2026-07-15 09:51:19
"Laporan Judi Online Melonjak 260 %, OJK Minta Bank Perkuat Pengawasan",https://keuangan.kontan.co.id/news/laporan-judi-online-melonjak-260-ojk-minta-bank-perkuat-pengawasan,Indonesia,Indonesian,20260715T091500Z,,keuangan.kontan.co.id,2026-07-15 09:51:19
卖一台车巨亏162万 ！ 美国新势力Lucid被曝将破产 股票暴跌40 % 停牌,https://tech.ifeng.com/c/8umVXdPf0xE,China,Chinese,20260715T091500Z,,tech.ifeng.com,2026-07-15 09:51:19
Само минути до ежедневното банкиране с Postbank,https://www.dnes.bg/a/3-biznes/728510-samo-minuti-do-ezhednevnoto-bankirane-s-postbank,Bulgaria,Bulgarian,20260715T091500Z,,dnes.bg,2026-07-15 09:51:19
ภาวะตลาดหุ้นโตเกียว : นิกเกอิปิดพุ่ง 1 . 49 % รับอานิสงส์เงินเฟ้อสหรัฐฯ,https://www.ryt9.com/s/iq/12830243,Thailand,Thai,20260715T091500Z,,ryt9.com,2026-07-15 09:51:19
"Öğrenci affına ilişkin düzenlemeleri içeren kanun teklifi , komisyonda kabul edildi",https://www.dha.com.tr/politika/ogrenci-affina-iliskin-duzenlemeleri-iceren-kanun-teklifi-komisyonda-kabul-edildi-2910049,Turkey,Turkish,20260715T091500Z,,dha.com.tr,2026-07-15 09:51:19
中文+数智经济碰撞青春火花 ， 近二十名国际青年在上财圆满完成夏令营研学,https://baijiahao.baidu.com/s?id=1870765441054777614,China,Chinese,20260715T091500Z,,baijiahao.baidu.com,2026-07-15 09:51:19
Συνδικάτο Τύπου Χάρτου : Μέτρα υγείας και ασφάλειας σε κάθε χώρο δουλειάς,https://pamehellas.gr/syndikato-typoy-chartoy-metra-ygeias-asfaleias-se-choro-doyleias,Greece,Greek,20260715T091500Z,,pamehellas.gr,2026-07-15 09:51:19
Cerita Perjuangan Penyandang Disabilitas Berburu Pekerjaan di Job Fair Kota Yogyakarta 2026,https://jogja.tribunnews.com/diy/1218624/cerita-perjuangan-penyandang-disabilitas-berburu-pekerjaan-di-job-fair-kota-yogyakarta-2026,Indonesia,Indonesian,20260715T091500Z,,jogja.tribunnews.com,2026-07-15 09:51:19
Voluntary overnight social media curfew looming for teenagers,https://www.liverpoolecho.co.uk/news/uk-world-news/voluntary-overnight-social-media-curfew-34292214,United Kingdom,English,20260715T091500Z,,liverpoolecho.co.uk,2026-07-15 09:51:19
"The U . S . Has Accumulated 100 , 000 Metric Tons of Used Nuclear Fuel . Oklo Sees It as a Massive Potential Energy Resource . ",https://www.fool.com/investing/2026/07/15/the-us-has-accumulated-100000-metric-tons-of-used/?source=iedfolrf0000001,United States,English,20260715T091500Z,,fool.com,2026-07-15 09:51:19
MP High Court Permits 52 - Year - Old Woman To Undergo IVF Despite 50 Yrs Age Bar Under ART Act,https://www.livelaw.in/high-court/madhya-pradesh-high-court/52-year-woman-ivf-treatment-despite-50-years-age-bar-assisted-reproductive-technology-act-2021-541350,India,English,20260715T091500Z,,livelaw.in,2026-07-15 09:51:19
Estas son las telecos con menor número de reclamaciones en 2025 🗞️,https://bandaancha.eu/foros/estas-son-telecos-menor-numero-1760515,Spain,Spanish,20260715T091500Z,,bandaancha.eu,2026-07-15 09:51:19
Financial Comparison : AstroNova ( NASDAQ : ALOT ) vs . Simpple ( NASDAQ : SPPL ) ,https://www.themarketsdaily.com/2026/07/15/financial-comparison-astronova-nasdaqalot-vs-simpple-nasdaqsppl.html,United States,English,20260715T091500Z,,themarketsdaily.com,2026-07-15 09:51:19
