title,url,source_country,language,published_date,tone,domain,collected_at
大家聊AI｜齐鹏 ： 当机器人成为挚友 ， 我们如何创造未来 ？ ,https://www.163.com/dy/article/L1Q7LQ60055040N3.html,China,Chinese,20260714T063000Z,,163.com,2026-07-14 07:04:13
逾200名學者連署公開信 籲各界正視AI就業衝擊 | 全球財經 | 全球,https://udn.com/news/story/6811/9626836,Taiwan,Chinese,20260714T063000Z,,udn.com,2026-07-14 07:04:13
"Oil prices jump as fighting flares in the Middle East , while AI - led retreat pulls Asian stocks lower",http://www.somdnews.com/ap/world/oil-prices-jump-as-fighting-flares-in-the-middle-east-while-ai-led-retreat-pulls/article_b2309b17-ba07-5147-9446-923020d98ec1.html,United States,English,20260714T063000Z,,somdnews.com,2026-07-14 07:04:13
" [ 신제품 · 신기술 ] 한일시멘트 , 3시간 동안 안 굳는 콘크리트 개발",https://biz.heraldcorp.com/article/10808552,South Korea,Korean,20260714T063000Z,,biz.heraldcorp.com,2026-07-14 07:04:13
機器人接手繁重任務 中亞聯大攜手史丹佛機器人中心打造更有溫度的智慧醫療,https://n.yam.com/Article/20260714548828,Taiwan,Chinese,20260714T063000Z,,n.yam.com,2026-07-14 07:04:13
Call with Digital Partnership and TTC Countries,https://www2.fundsforngos.org/innovation/call-with-digital-partnership-and-ttc-countries/,United States,English,20260714T063000Z,,fundsforngos.org,2026-07-14 07:04:13
ASCII . jp ： エレコムが 「 コミックマーケット108 」 に出展 ！ タッチペンなど 、 デジタルでのお絵描きをサポートする製品を販売,https://ascii.jp/elem/000/004/419/4419504/,Japan,Japanese,20260714T063000Z,,ascii.jp,2026-07-14 07:04:13
MORNING BRIEFING - Deutschland / Europa,https://www.finanznachrichten.de/nachrichten-2026-07/69016805-morning-briefing-deutschland-europa-015.htm,Germany,German,20260714T063000Z,,finanznachrichten.de,2026-07-14 07:04:13
HTX làm  đầu tàu  phát triển vùng chuyên canh nông nghiệp Hải Phòng,https://baomoi.com/htx-lam-dau-tau-phat-trien-vung-chuyen-canh-nong-nghiep-hai-phong-c55612000.epi,Vietnam,Vietnamese,20260714T063000Z,,baomoi.com,2026-07-14 07:04:13
Call for Applications : EO Missions and Technology Innovation Call 1 ( United Kingdom ) ,https://www2.fundsforngos.org/innovation/call-for-applications-eo-missions-and-technology-innovation-call-1-united-kingdom/,United States,English,20260714T063000Z,,fundsforngos.org,2026-07-14 07:04:13
Limassol tourism slashed by a quarter despite signs of recovery,https://cyprus-mail.com/2026/07/14/limassol-tourism-slashed-by-a-quarter-despite-signs-of-recovery,Cyprus,English,20260714T063000Z,,cyprus-mail.com,2026-07-14 07:04:13
Tech Bytes : AI - powered referee camera brings Australian World Cup fans closer to the action,https://www.proactiveinvestors.com.au/companies/news/1095378/tech-bytes-ai-powered-referee-camera-brings-australian-world-cup-fans-closer-to-the-action-1095378.html,Australia,English,20260714T063000Z,,proactiveinvestors.com.au,2026-07-14 07:04:13
Warnung der Verbraucherzentrale : Wenn statt der bestellten Klimaanlage nur ein Ventilator geliefert wird,https://www.n-tv.de/ratgeber/Wenn-statt-der-bestellten-Klimaanlage-nur-ein-Ventilator-geliefert-wird-id31060937.html,Germany,German,20260714T063000Z,,n-tv.de,2026-07-14 07:04:13
Taiwan chipmaker TSMC posts 36 % jump in 1st - half revenue on strong AI chip demand,https://aa.com.tr/en/economy/taiwan-chipmaker-tsmc-posts-36-jump-in-1st-half-revenue-on-strong-ai-chip-demand/3996127,Turkey,English,20260714T063000Z,,aa.com.tr,2026-07-14 07:04:13
Starlink來台法規解套 中華電 ： 爭取合資獨家代理 | 產經,https://www.cna.com.tw:443/news/afe/202607140096.aspx,Taiwan,Chinese,20260714T063000Z,,cna.com.tw,2026-07-14 07:04:13
Big Rig ROCK Report 7 . 7 | 103 . 7 NNJ,https://wnnj.iheart.com/featured/big-rig/content/2026-07-14-big-rig-rock-report-77/,United States,English,20260714T063000Z,,wnnj.iheart.com,2026-07-14 07:04:13
報告 ： 台灣居烏克蘭第3大電池供應國 打入無人機市場 | 產經,https://www.cna.com.tw:443/news/afe/202607140139.aspx,Taiwan,Chinese,20260714T063000Z,,cna.com.tw,2026-07-14 07:04:13
名创子公司致歉 审核疏漏引发争议 _ 新闻频道 _ 中华网,https://news.china.com/socialgd/10000169/20260714/49608796.html,China,Chinese,20260714T063000Z,,news.china.com,2026-07-14 07:04:13
"FG Halts N50 , 000 WAEC , NECO Fee Hike Amid Outrage",https://punchng.com/fg-halts-n50000-waec-neco-fee-hike-amid-outrage/,Nigeria,English,20260714T063000Z,,punchng.com,2026-07-14 07:04:13
"Casa Batlló united states la tecnología digital para revelar los detalles ocultos de Gaudí , Miró y Gomis",https://es.euronews.com/cultura/2026/07/14/casa-batllo-usa-la-tecnologia-digital-para-revelar-los-detalles-ocultos-de-gaudi-miro-y-go,United States,Spanish,20260714T063000Z,,es.euronews.com,2026-07-14 07:04:13
Για τα λεφτά τα κάνεις όλα,https://www.inewsgr.com/351/gia-ta-lefta-ta-kaneis-ola.htm,Greece,Greek,20260714T063000Z,,inewsgr.com,2026-07-14 07:04:13
Perché i dazi UE non fermano loffensiva delle auto cinesi,https://www.affaritaliani.it/motori/perche-i-dazi-ue-non-fermano-loffensiva-delle-auto-cinesi.html,Italy,Italian,20260714T063000Z,,affaritaliani.it,2026-07-14 07:04:13
Pemprov Jawa Tengah Perluas Kerja Sama dengan Negara Bagian Malaka,https://koran-jakarta.com/2026-07-14/pemprov-jawa-tengah-perluas-kerja-sama-dengan-negara-bagian-malaka,Indonesia,Indonesian,20260714T063000Z,,koran-jakarta.com,2026-07-14 07:04:13
这个被爷爷奶奶和社工  带大  的孩子 ， 圆梦复旦大学,https://baijiahao.baidu.com/s?id=1870668105721956647,China,Chinese,20260714T063000Z,,baijiahao.baidu.com,2026-07-14 07:04:13
全球首颗软件定义近存计算3D芯片在沪发布,https://www.163.com/dy/article/L1Q8F3EQ0514R9P4.html,China,Chinese,20260714T063000Z,,163.com,2026-07-14 07:04:13
" « Bank to wallet », une révolution sans limites ? ( 1 / 2 ) ",https://lesoleil.sn/actualites/economie/bank-to-wallet-une-revolution-sans-limites-1-2/,Senegal,French,20260714T063000Z,,lesoleil.sn,2026-07-14 07:04:13
الصين : صادرات يونيو تقفز 27 % بفعل الطلب القوي المدفوع بطفرة الذكاء الاصطناعي,https://arabic.euronews.com/2026/07/14/chinas-exports-in-june-surged-by-27-compared-to-the-previous-year-driven-by-strong-demand,United States,Arabic,20260714T063000Z,,arabic.euronews.com,2026-07-14 07:04:13
Kina nabavila EUV mašine iz Holandije ? ASML pod pritiskom SAD - Vesti,https://www.telegraf.rs/vesti/svet/4359601-kina-nabavila-euv-masine-iz-holandije-asml-pod-pritiskom-sad,Serbia,Serbian,20260714T063000Z,,telegraf.rs,2026-07-14 07:04:13
ASCII . jp ： 鍵管理をもっと快適に 。 大人気取っ手付きキーボックスのコンパクトサイズを発売,https://ascii.jp/elem/000/004/419/4419506/,Japan,Japanese,20260714T063000Z,,ascii.jp,2026-07-14 07:04:13
技鋼科技擴展 GIGAPOD AI 與 HPC 基礎架構平台 ， 加速企業 AI 工廠部署,https://www.ithome.com.tw/pr/177287,Taiwan,Chinese,20260714T063000Z,,ithome.com.tw,2026-07-14 07:04:13
BlackSeaNews | Оперативна інформація станом на 08 : 00 14 . 07 . 2026 щодо російського вторгнення,https://www.blackseanews.net/read/246061,Ukraine,Ukrainian,20260714T063000Z,,blackseanews.net,2026-07-14 07:04:13
ASCII . jp ： 生成AI活用は 「 プロンプト作成 」 から 「 業務設計 」 の時代へ,https://ascii.jp/elem/000/004/419/4419511/,Japan,Japanese,20260714T063000Z,,ascii.jp,2026-07-14 07:04:13
Siết kinh doanh trên sàn thương mại điện tử,https://daidoanket.vn/siet-kinh-doanh-tren-san-thuong-mai-dien-tu.html,Vietnam,Vietnamese,20260714T063000Z,,daidoanket.vn,2026-07-14 07:04:13
Europejskie działo elektromagnetyczne już strzela . Przełom w badaniach nad bronią przyszłości,"https://forsal.pl/swiat/bezpieczenstwo/artykuly/11275255,europejskie-dzialo-elektromagnetyczne-juz-strzela-przelom-w-badaniach.html",Poland,Polish,20260714T063000Z,,forsal.pl,2026-07-14 07:04:13
"KT , 삼성전자 · HD현대삼호와 맞손 … 자율 운용 네트워크 조선소 피지컬 AI 실증  ",https://www.etoday.co.kr/news/view/2603474,South Korea,Korean,20260714T063000Z,,etoday.co.kr,2026-07-14 07:04:13
SEDIF reúne más de 17 . 5 toneladas de ayuda para damnificados de Venezuela,https://plazadearmas.com.mx/sedif-reune-mas-de-17-5-toneladas-de-ayuda-para-damnificados-de-venezuela/,Mexico,Spanish,20260714T063000Z,,plazadearmas.com.mx,2026-07-14 07:04:13
"Thủ tướng Lê Minh Hưng : Các tỉnh , thành phố cần quyết tâm cao nhất đạt mục tiêu của từng địa phương",https://baochinhphu.vn/thu-tuong-le-minh-hung-cac-tinh-thanh-pho-can-quyet-tam-cao-nhat-dat-muc-tieu-cua-tung-dia-phuong-102260714120949617.htm,Vietnam,Vietnamese,20260714T063000Z,,baochinhphu.vn,2026-07-14 07:04:13
MORNING BRIEFING - united states / Asien,https://www.finanzen.net/nachricht/aktien/morning-briefing-usa-asien-15796101,Germany,German,20260714T063000Z,,finanzen.net,2026-07-14 07:04:13
4白委加入IPAC遭疑兩岸路線轉彎 黃國昌 ： 五個互相原則沒變 | 政治,https://newtalk.tw/news/view/2026-07-14/1047008,Taiwan,Chinese,20260714T063000Z,,newtalk.tw,2026-07-14 07:04:13
"India - NZ FTA to take effect by year - end , direct flights likely in 1 - 2 years ; bilateral trade set to accelerate : Todd McClay",http://www.iranherald.com/news/279186004/india-nz-fta-to-take-effect-by-year-end-direct-flights-likely-in-1-2-years-bilateral-trade-set-to-accelerate-todd-mcclay,Iran,English,20260714T063000Z,,iranherald.com,2026-07-14 07:04:13
ASCII . jp ： 国際親善試合 「 セレッソ大阪 VS ボルシア ・ ドルトムント 」 エレコムの特別協賛が決定 ！ ,https://ascii.jp/elem/000/004/419/4419505/,Japan,Japanese,20260714T063000Z,,ascii.jp,2026-07-14 07:04:13
"Cụ thể hóa các chuẩn mực quốc tế về phòng , chống rửa tiền",https://daidoanket.vn/cu-the-hoa-cac-chuan-muc-quoc-te-ve-phong-chong-rua-tien.html,Vietnam,Vietnamese,20260714T063000Z,,daidoanket.vn,2026-07-14 07:04:13
AI改變旅遊規劃 91 % 亞太旅客用AI協助安排行程 | 生活,https://www.cna.com.tw:443/news/ahel/202607140126.aspx,Taiwan,Chinese,20260714T063000Z,,cna.com.tw,2026-07-14 07:04:13
Kemnaker Mulai Petakan Kebutuhan Industri Jepang guna Perluas Peluang Kerja,https://koran-jakarta.com/2026-07-14/kemnaker-mulai-petakan-kebutuhan-industri-jepang-guna-perluas-peluang-kerja,Indonesia,Indonesian,20260714T063000Z,,koran-jakarta.com,2026-07-14 07:04:13
"Coffee Lovers Wajib Tahu , Ini Tumbler Kopi Terbaik yang Bisa Menjaga Suhu Lebih Lama",https://www.liputan6.com/lifestyle/read/8245682/coffee-lovers-wajib-tahu-ini-tumbler-kopi-terbaik-yang-bisa-menjaga-suhu-lebih-lama,Indonesia,Indonesian,20260714T063000Z,,liputan6.com,2026-07-14 07:04:13
Учёные СПбГУ научились находить антибиотики в молоке за 10 минут,https://piter.tv/event/videlenie_penicillinov_iz_moloka_uchenie_SPbGU_/,Russia,Russian,20260714T063000Z,,piter.tv,2026-07-14 07:04:13
分科測驗地理科 AI數位殖民 、 無人機電子圍籬入題 | 生活,https://www.cna.com.tw:443/news/ahel/202607140134.aspx,Taiwan,Chinese,20260714T063000Z,,cna.com.tw,2026-07-14 07:04:13
"Oil prices jump as fighting flares in the Middle East , while AI - led retreat pulls Asian stocks lower",https://www.wsls.com/business/2026/07/14/oil-prices-jump-as-fighting-flares-in-the-middle-east-while-ai-led-retreat-pulls-asian-stocks-lower/,United States,English,20260714T063000Z,,wsls.com,2026-07-14 07:04:13
珍宝岛药业与广西新迅达举行战略交流座谈 ， 聚焦AI赋能医药研发与产业升级 _ 产业经济 _ 财经 _ 中金在线,http://news.cnfol.com/chanyejingji/20260714/32306714.shtml,China,Chinese,20260714T063000Z,,news.cnfol.com,2026-07-14 07:04:13
Gir lost Hornbill takes flight again : Gujarat reintroduction project records 4 years of successful breeding,http://www.bignewsnetwork.com/news/279186046/gir-lost-hornbill-takes-flight-again-gujarat-reintroduction-project-records-4-years-of-successful-breeding,United States,English,20260714T063000Z,,bignewsnetwork.com,2026-07-14 07:04:13
Отвъд AI еуфорията : Как технологиите и дизайнът трансформират бизнеса и образованието у нас,https://www.investor.bg/a/566-novini-i-analizi/433478-otvad-ai-euforiyata-kak-tehnologiite-i-dizaynat-transformirat-biznesa-i-obrazovanieto-u-nas,Bulgaria,Bulgarian,20260714T063000Z,,investor.bg,2026-07-14 07:04:13
ASCII . jp ： ＜News＞レトロゲーム配信サービス 『 プロジェクトEGG 』 にて2026年7月14日に 『 ルーンワース 黒衣の貴公子 （ X68000版 ）』 を無料配信開始,https://ascii.jp/elem/000/004/419/4419502/,Japan,Japanese,20260714T063000Z,,ascii.jp,2026-07-14 07:04:13
Sürücüsüz araçlar Türkiyeye geliyor - Son Dakika Ekonomi Haberleri,https://www.posta.com.tr/ekonomi/surucusuz-araclar-turkiyeye-geliyor-3014759,Turkey,Turkish,20260714T063000Z,,posta.com.tr,2026-07-14 07:04:13
GRAVITEO también se saborea : así será el festival donde la música y la gastronomía juegan su propio campeonato,https://www.levante-emv.com/deportes/2026/07/14/graviteo-saborea-sera-festival-musica-132424887.html,Spain,Spanish,20260714T063000Z,,levante-emv.com,2026-07-14 07:04:13
溫德姆集團首插旗嘉義 ！「 戴斯精選酒店 」 進駐高鐵特區 串聯中南部半導體廊帶 | 生活,https://newtalk.tw/news/view/2026-07-14/1047041,Taiwan,Chinese,20260714T063000Z,,newtalk.tw,2026-07-14 07:04:13
Scripbox elevates Mohankumar Swaminathan to Chief Product Officer,https://www.adgully.com/post/18015/scripbox-elevates-mohankumar-swaminathan-to-chief-product-officer,India,English,20260714T063000Z,,adgully.com,2026-07-14 07:04:13
Актрисата Уна Чаплин : Обичам да разказвам истории на хората,https://www.actualno.com/cinema/aktrisata-una-chaplin-obicham-da-razkazvam-istorii-na-horata-news_2617766.html,Bulgaria,Bulgarian,20260714T063000Z,,actualno.com,2026-07-14 07:04:13
Menaker Yassierli bahas pengembangan keterampilan pada LEMM BRICS,https://www.antaranews.com/berita/5648487/menaker-yassierli-bahas-pengembangan-keterampilan-pada-lemm-brics,Indonesia,Indonesian,20260714T063000Z,,antaranews.com,2026-07-14 07:04:13
EFICYENT Opens Nepal Payment Corridor Through Strategic Partnership with IME,http://www.bignewsnetwork.com/news/279186055/eficyent-opens-nepal-payment-corridor-through-strategic-partnership-with-ime,United States,English,20260714T063000Z,,bignewsnetwork.com,2026-07-14 07:04:13
皺鰓鯊標本半吊眼引熱議 海科館揭厭世5鯊表情背後 | 生活,https://www.cna.com.tw:443/news/ahel/202607140127.aspx,Taiwan,Chinese,20260714T063000Z,,cna.com.tw,2026-07-14 07:04:13
From Innovation to Impact : tesa Marks One Year of Debonding on Demand Laboratory in Singapore,http://www.bignewsnetwork.com/news/279186052/from-innovation-to-impact-tesa-marks-one-year-of-debonding-on-demand-laboratory-in-singapore,United States,English,20260714T063000Z,,bignewsnetwork.com,2026-07-14 07:04:13
"EHS teacher , Tammy Sheppard receives  Teacher of the Year Award  ",https://www.northernnews.ca:443/news/ehs-teacher-tammy-sheppard-receives-teacher-of-the-year-award,Canada,English,20260714T063000Z,,northernnews.ca,2026-07-14 07:04:13
纯电汽车的三电系统谁家最可靠 ？ 六大技术标杆车企全解析​,https://k.sina.com.cn/article_6045971783_1685e354700101m2ja.html,China,Chinese,20260714T063000Z,,k.sina.com.cn,2026-07-14 07:04:13
金山这个地块收储 ， 未来将建 … ,https://www.163.com/dy/article/L1Q8CPA70514CILT.html,China,Chinese,20260714T063000Z,,163.com,2026-07-14 07:04:13
活力中國調研行|瓣瓣同心 京津冀聚力生新,https://portal.sina.com.hk/news-china/sina/2026/07/14/1853813/%E6%B4%BB%E5%8A%9B%E4%B8%AD%E5%9C%8B%E8%AA%BF%E7%A0%94%E8%A1%8C%E7%93%A3%E7%93%A3%E5%90%8C%E5%BF%83-%E4%BA%AC%E6%B4%A5%E5%86%80%E8%81%9A%E5%8A%9B%E7%94%9F%E6%96%B0/,Hong Kong,Chinese,20260714T063000Z,,portal.sina.com.hk,2026-07-14 07:04:13
崑大時尚系美業競賽橫掃近50獎 跨文化美學驚豔國際舞台,https://n.yam.com/Article/20260714213274,Taiwan,Chinese,20260714T063000Z,,n.yam.com,2026-07-14 07:04:13
Lula acusa a Trump de piratería por cobrar peaje en el Estrecho de Ormuz,https://www.telesurtv.net/lula-acusa-trump-pirateria-peaje-ormuz/,United States,Spanish,20260714T063000Z,,telesurtv.net,2026-07-14 07:04:13
Khi bất động sản vận hành bằng dữ liệu,https://daidoanket.vn/khi-bat-dong-san-van-hanh-bang-du-lieu.html,Vietnam,Vietnamese,20260714T063000Z,,daidoanket.vn,2026-07-14 07:04:13
Central & Western District Youth - to - Career Expo Connects Hong Kong Youth to Future Careers in AI Era – LiveNews . co . nz,https://livenews.co.nz/2026/07/14/central-western-district-youth-to-career-expo-connects-hong-kong-youth-to-future-careers-in-ai-era/,New Zealand,English,20260714T063000Z,,livenews.co.nz,2026-07-14 07:04:13
AI Account Named Best AI - Driven Accounting Software Platform in South East Asia at the 2026 FinTech Awards – LiveNews . co . nz,https://livenews.co.nz/2026/07/14/ai-account-named-best-ai-driven-accounting-software-platform-in-south-east-asia-at-the-2026-fintech-awards/,New Zealand,English,20260714T063000Z,,livenews.co.nz,2026-07-14 07:04:13
Niezależność Polski chce budować na odpadach . Na śmieciach zbił już majątek,"https://www.wnp.pl/rynki/odpady-zwiekszaja-niezaleznosc-surowcowa-kraju-przeszkadzaja-nam-jednak-procedury,1080075.html",Poland,Polish,20260714T063000Z,,wnp.pl,2026-07-14 07:04:13
Indian - origin NASA astronaut Anil Menon is all set for his first ISS mission on July 14,https://www.moneycontrol.com/science/indian-origin-nasa-astronaut-anil-menon-is-all-set-for-his-first-iss-mission-on-july-14-article-13973304.html,India,English,20260714T063000Z,,moneycontrol.com,2026-07-14 07:04:13
"Fuziunea nucleară , soluție pentru centrele de date AI în 15 ani ? ",https://financiarul.ro/tehnologie/3-terawati-pana-in-2040-pariul-lui-masayoshi-son-ca-fuziunea-nucleara/,Romania,Romanian,20260714T063000Z,,financiarul.ro,2026-07-14 07:04:13
台灣大AI助攻獲利暴衝29 % 上半年EPS達2 . 86元 | 財經,https://newtalk.tw/news/view/2026-07-14/1047032,Taiwan,Chinese,20260714T063000Z,,newtalk.tw,2026-07-14 07:04:13
Menkeu Purbaya Pastikan Tak Naikkan Tarif Pajak,https://koran-jakarta.com/2026-07-14/menkeu-purbaya-pastikan-tak-naikkan-tarif-pajak,Indonesia,Indonesian,20260714T063000Z,,koran-jakarta.com,2026-07-14 07:04:13
Un laboratoire innovant à Béziers pour rendre leau de la station d  épuration potable et consommable,https://www.ici.fr/occitanie/herault-34/beziers/un-laboratoire-innovant-a-beziers-pour-rendre-l-eau-de-la-station-d-epuration-potable-et-consommable-4317770,,French,20260714T063000Z,,ici.fr,2026-07-14 07:04:13
Schimbări de la 1 august în Germania și UE . Românii stabiliți acolo vor fi direct vizați,https://www.capital.ro/schimbari-de-la-1-august-in-germania-si-ue-romanii-stabiliti-acolo-vor-fi-direct-vizati.html,Romania,Romanian,20260714T063000Z,,capital.ro,2026-07-14 07:04:13
Mature woman  best serum in the world  for  tightening crow feet  is £32,https://www.bristolpost.co.uk/whats-on/shopping/people-remark-how-well-look-11056695,United Kingdom,English,20260714T063000Z,,bristolpost.co.uk,2026-07-14 07:04:13
Oil prices extend run higher as fighting flares in the Middle East,https://finance.yahoo.com/energy/articles/oil-prices-extend-run-higher-055339416.html,United States,English,20260714T063000Z,,finance.yahoo.com,2026-07-14 07:04:13
"Oil prices jump as fighting flares in the Middle East , while AI - led retreat pulls Asian stocks lower",http://www.reflector.com/news/national/oil-prices-jump-as-fighting-flares-in-the-middle-east-while-ai-led-retreat-pulls/article_3e938817-2964-534d-82aa-3d1acaafa310.html,United States,English,20260714T063000Z,,reflector.com,2026-07-14 07:04:13
Apply Now : Road to Devcon 8 India – Ecosystem Program,https://www2.fundsforngos.org/science/apply-now-road-to-devcon-8-india-ecosystem-program/,United States,English,20260714T063000Z,,fundsforngos.org,2026-07-14 07:04:13
Anambra Whistleblower Nnamdi Emeh Case Resumes Tuesday Amid Three - Year Illegal Detention By Nigerian Police,https://saharareporters.com/2026/07/13/anambra-whistleblower-nnamdi-emehs-case-resumes-tuesday-amid-three-year-illegal,Nigeria,English,20260714T063000Z,,saharareporters.com,2026-07-14 07:04:13
2026年LNGポンプ市場レポート ： 市場規模 ・ 見通し ・ 次期産業戦略 - 年平均成長率 （ CAGR ） 10 . 56 ％ で成長 （ 2026～2032年 ） ,https://japan.cnet.com/release/31188298/,Japan,Japanese,20260714T063000Z,,japan.cnet.com,2026-07-14 07:04:13
Optum Specialty Pharmacy Careers,https://www.unitaid.eu/optum-specialty-pharmacy-careers-3h0i.html,,English,20260714T063000Z,,unitaid.eu,2026-07-14 07:04:13
"Guerra in Ucraina , pioggia di missili russi su Kiev . Il piano di Putin",https://www.affaritaliani.it/esteri/guerra-in-ucraina-pioggia-di-missili-russi-su-kiev-putin-non-molla-nonostante-i-droni-di-zelensky.html,Italy,Italian,20260714T063000Z,,affaritaliani.it,2026-07-14 07:04:13
Ziua Franței 2026 . De ce este Franța unul dintre cei mai importanți aliați ai României . De la Napoleon al III - lea și generalul Berthelot până la militarii NATO de la Cincu,https://www.capital.ro/ziua-frantei-2026-de-ce-este-franta-unul-dintre-cei-mai-importanti-aliati-ai-romaniei-de-la-napoleon-al-iii-lea-si-generalul-berthelot-pana-la-militarii-nato-de-la-cincu.html,Romania,Romanian,20260714T063000Z,,capital.ro,2026-07-14 07:04:13
"Xobin Unveils NURA , an AI Agent Built for Enterprise Hiring",http://www.bignewsnetwork.com/news/279186058/xobin-unveils-nura-an-ai-agent-built-for-enterprise-hiring,United States,English,20260714T063000Z,,bignewsnetwork.com,2026-07-14 07:04:13
 『 エヴァンゲリオン 』 と国宝  風神雷神図屏風  がコラボ 。 EVA各機体とパイロットを  風神雷神  になぞらえてデザインした全5作 。 日本の伝統文化とアニメが融合した作品は7月17日発売,https://www.famitsu.com/article/202607/81327,Japan,Japanese,20260714T063000Z,,famitsu.com,2026-07-14 07:04:13
"Flipkart Enhances Investments in West Bengal , Boosting Local Jobs and MSMEs , ETRetail",https://retail.economictimes.indiatimes.com/news/e-commerce/e-tailing/flipkart-deepens-west-bengal-investments-backs-jobs-and-msmes/132379998,India,English,20260714T063000Z,,retail.economictimes.indiatimes.com,2026-07-14 07:04:13
Fiasco,https://www.critica.com.mx/vernoticias1.php?artid=117726&mas=116,Mexico,Spanish,20260714T063000Z,,critica.com.mx,2026-07-14 07:04:13
Chullin 75 - 81 : Medicine and the Ways of the Emorites,https://www.torahmusings.com/2026/07/chullin-75-81-medicine-and-the-ways-of-the-emorites/,Israel,English,20260714T063000Z,,torahmusings.com,2026-07-14 07:04:13
"Acuña aseguró que ,  queremos retomar el proyecto de ciudad que se paralizó  ",https://www.nuevodiarioweb.com.ar/provinciales/acunia-aseguro-que-queremos-retomar-el-proyecto-de-ciudad-que-se-paralizo.htm,Argentina,Spanish,20260714T063000Z,,nuevodiarioweb.com.ar,2026-07-14 07:04:13
Changi Airport says Terminal 5 capacity remains on track despite global uncertainties,https://www.channelnewsasia.com/singapore/changi-airport-t5-capacity-lim-ching-kiat-6251246,United States,English,20260714T063000Z,,channelnewsasia.com,2026-07-14 07:04:13
росія за добу втратила 1120 військових і 46 артсистем – Генштаб ЗСУ,https://unn.ua/news/rosiia-za-dobu-vtratyla-1120-viiskovykh-i-46-artsystem-henshtab-zsu,,Ukrainian,20260714T063000Z,,unn.ua,2026-07-14 07:04:13
Entries Open : Zephyr Project Meetup in Hyderabad ( India ) ,https://www2.fundsforngos.org/science/entries-open-zephyr-project-meetup-in-hyderabad-india/,United States,English,20260714T063000Z,,fundsforngos.org,2026-07-14 07:04:13
Kunci Jawaban IPAS Kelas 5 Halaman 28 Kurikulum Merdeka Edisi Revisi : Cara Memenuhi Kebutuhan,https://www.tribunnews.com/pendidikan/7853960/kunci-jawaban-ipas-kelas-5-halaman-28-kurikulum-merdeka-edisi-revisi-cara-memenuhi-kebutuhan,Indonesia,Indonesian,20260714T063000Z,,tribunnews.com,2026-07-14 07:04:13
Lee Administration Launches 3 - Day Series of Real Estate Policy Debates,https://world.kbs.co.kr/service/news_view.htm?lang=e&Seq_Code=202882,South Korea,English,20260714T063000Z,,world.kbs.co.kr,2026-07-14 07:04:13
त्रिविका आंगिक क्याम्पसहरूमा अब कम्तीमा १० प्रतिशत विद्यार्थीलाई पूर्ण छात्रवृत्ति | Nepal first 24 - hour updated news portal,https://www.ratopati.com/story/577158/full-scholarships-will-now-be-ensured-for-at-least-10-percent-of-students-at-tus-affiliated-campuses,Nepal,Nepali,20260714T063000Z,,ratopati.com,2026-07-14 07:04:13
沾喜气 ！ 湖北开启高考录取通知书投递 ， 657分少年圆梦国防科大,https://baijiahao.baidu.com/s?id=1870668862447470816,China,Chinese,20260714T063000Z,,baijiahao.baidu.com,2026-07-14 07:04:13
日本のシリコーンエラストマー市場 ： 調査レポート 、 市場需要 、 市場シェア 、 主要メーカー 、 市場規模 、 成長 、 動向および市場展望 （ 2026年～2036年 ） ,https://japan.cnet.com/release/31188385/,Japan,Japanese,20260714T063000Z,,japan.cnet.com,2026-07-14 07:04:13
